id,lv,text
1,1,Here's a gift from your Tutor!
2,1,Here's your gift for today! And don't forget to log in tomorrow!
3,1,"Many valuable resources are on sale in the Market, don't forget to check it out!"
4,6,Don't forget to complete your Daily Tasks!
5,9,Increase your power to pass more Stages in Tests and win more rewards!
6,12,Here's your gift for today! Don't forget to test your might in Junior Varsity!
7,30,Don't forget to start an Observation in Echoes of Time!
8,58,A powerful Servant can bring you a significant advantage in the battles! So don't forget to train your Servant!
