id,title,name,dialog,select_text
2910,,,"Gestern muss ich sie sehr enttäuscht haben. Aber das ist alles nur für ihre Sicherheit... ich hoffe sie kann das verstehen... Ich muss mein Versprechen gegenüber KongMing einhalten... und dafür Sorgen, dass alle wohlbehalten zurück kehren.",
2911,,,"Als wir eine Zeit gelaufen waren, erschien vor uns plötzlich ein schwaches Licht.",
2912,,Kira,"Wir müssen bald nach oben, miao.",
2913,,*,Nach draußen?,
2914,,Kira,"Den Rest müssen wir oberhalb gehen, miao.",
2915,,Aquaris,Huh? Ist der Vulkan Krater etwa nicht mit der Höhle verbunden?,
2916,,Fenek,"Wenn der Vulkan und die Höhle direkt miteinander verbunden wären, würde die Lava beim Vulkanausbruch direkt in die Höhle fließen.",
2917,,Fenek,"Obwohl das nicht der Fall ist, dringt der Rauch des Vulkans in die Höhle. Es gibt zwar ein paar Maßnahmen dagegen, doch ist deren Effekt begrenzt.",
2918,,Aquaris,"So ist das also... na ein Glück, dass sie nicht miteinander verbunden sind. Aber endlich können wir wieder das Tageslicht sehen! Das tut so gut! Den ganzen Tag in der Höhle ist ja nicht auszuhalten!",
2919,,Kira,"Hier ist der Höhlenausgang, miao.",
2920,,Iron Fist,"Das ist dort, wo...",
2921,,,"Unter Kiras Führung, waren wir aus der dunklen Höhle getreten und bereiteten uns darauf von Sonnenstrahlen und frischer Luft empfangen zu werden...",
2922,,,Aber was auf uns wartete...,
2923,,Aquaris,……,
2924,Vulkanasche,,"Die Sonne wurde von schwarzen Rauchwolken blockiert, die nur ein paar winzige Risse zeigten.",
2925,,,"Die Luft war noch schlechter als in der Höhle, die Russpartikel blockierten unsere Nase und unsere Kleidung fing an sich schwarz zu verfärben.",
2926,,Aquaris,"Ahahaha, was ist das nur zur Hölle?!",
2927,,Anastasia,"So ist es also in der Nähe des Vulkankraters, die Umgebung ist wirklich widerlich und verschmutzt sofort die Kleidung.",
2928,,Turin,"Ja, in der Luft gibt es viele Russpartikel, die vermutlich eine starke Auswirkung auf unsere Gesundheit haben können.",
2929,,*,"Das ist alles weil der Vulkan ausgebrochen ist? Aber... das ist ja furchtbar... da müssen wir ja noch nicht mal vom Kämpfen sprechen, nach einer Weile hier werden wir einfach erstickt sein...!",
2930,,Fenek,Macht euch keine Sorgen! Ich habe so etwas bereits erwartet! Das ist mein neuester Zauber...,
2931,,Fenek,"Ich werde Wassermagie verwendenn, um eine Schutzschicht um unseren Kopf zu bilden. Obwohl die Russpartikel nicht wasserlöslich sind, können wir so immerhin ein direktes Einatmen verhindern.",
2932,,Fenek,Wenn wir durch diese drei Schichten atmen können wir frische Luft bekommen!,
2933,,Fenek,Okay! Würdigt Feneks Magie! Ihr könnte sie Wasserfilmtechnick nennen!,
2934,,*,Wow! Endlich kann ich richtig atmen! Toll gemacht Fenek!,
2935,,Kira,"Miao! Was ist das Miao! Kein Wasser, miao! Ich werde ertrinken, miao!",
2936,,*,"Kira, beruhig dich! Versuche tief einzuatmen!",
2937,,Kira,"Ahhh, miao? (Atmet)",
2938,,*,Siehst du? Kein Problem!,
2939,,Kira,…………………………,
2940,,,Kira drehte ihr rotes Gesicht weg... und find an ihr Haar zu bürsten. Vermutlich um die Peinlichkeit zu überspielen.,
2941,,,.... Einfach genau wie eine Katze.,
2942,,*,Aber... irgendwie hab ich das Gefühl es wird langsam dunkel...,
2943,,Fenek,Ähm... dich denke das ist weil das Wasser den Dreck aus der Luft aufnimmt und immer dunkler wird... Es sieht so aus als müsste ich den inneren Film noch einmal wechseln.,
2944,,Fenek,Mhm... diesrer Zauber scheint relativ umständlich.,
2945,,Aquaris,"Ähm Fenek, kann ich etwas vorschlagen?",
2946,,Fenek,Was?,
2947,,Aquaris,Kannst du den Zauber auf meinen ganzen Körper ausweiten? Meine Klamotten werden alle ganz dreckig...,
2948,,Fenek,Wir sollten nicht die Schönheit anderer verschwenden! Schönheit ist so etwas kostbares!,
2949,,Aquaris,"Was denn... es ist einfach furchtbar so... Ich hab das Gefühl der Dreck dringt durch meine Kleidung... Wenn wir zurück sind, muss ich eine ordentliche Dusche nehmen...",
2950,,*,"Achja Fenek, ich glaube er hier braucht auch noch eine...",
2951,,,Ich hatte gemerkt wie uns ein kleines Tier gefolgt war.,
2952,,Fenek,"Mach dir keine Sorgen, ich hab ihn schon bemerkt.",
2953,,*,In Ordnung... dann sollten wir los gehen.,
2954,,,"Nachdem man endlich richtig atmen konnte, hatte man erst Zeit sich genau die Umgebung anzuschauen.",
2955,,,"Unter den Füßen waren Lavasteine, die sich in Wellen als würde das Lava noch fließen über den Boden ergossen.",
2956,,,"Nicht ein lebendes Tier konnte ich in der Umgebung erkennen, wie in der Hölle...",
2957,,,Und der Schuldige war nicht weit entfernt——aus dem einst heiligen Vulkan Hekla floss immer noch Lava heraus.,
2958,,*,Hier ist es also...,
2959,,Kira,"Genau, miao.",
2960,,Iron Fist,Es ist wirklich eine furchtbare Umgebung...,
2961,,Fenek,Der Berg... war er so groß?,
2962,,Turin,Es fühlt sich an als würde etwas kommen...,
2963,,Anastasia,"Es ist eine Chaos-Kreatur, sieht so aus als wären wir schon sehr nah.",
2964,,Aquaris,"Perfekt, ich werde meine Wut an ihnen auslassen!",
2965,,Fenek,"... Seid vorsichtig während ihr kämpft, nicht dass ihr den Wasserfilm zerstört.",
2966,,*,"... Iron Fist, unterstütze uns von hinten.",
2967,,Iron Fist,... Na gut.,
2968,,*,……,
2969,,Dire,(Ahahaha... sie sind gekommen... das ist meine Chance!),
2970,,Dire,"(Ich muss nur warten, bis sie in einen Kampf mit Lava Dämon eintreten... und ich kann ganz einfach gewinnen. Ahahaha...",
2971,,Anastasia,（……？）,
2972,,Anastasia,(Es scheint mir... irgendwas scheint vertraut zu sein...),
2973,Höllentor,Anastasia,"Warte, warte...",
2974,,*,Was ist los?,
2975,,Anastasia,... Ich hab das Gefühl Chaos liegt in der Luft.,
2976,,*,"Bei so vielen Chaos-Kreaturen wie es hier gibt, ist das ja nur natürlich.",
2977,,Anastasia,... Aber es ist ein bisschen komisch... irgendwo hatte ich schonmal ein ähnliches Gefühl.,
2978,,Anastasia,Vielleicht machst du dir auch nur zu viele Sorgen.,
2979,,Iron Fist,……,
2980,,*,Iron Fist? Was ist los?,
2981,,Iron Fist,"Nein... es ist nichts. Ich fühl mich nur ein bisschen unwohl, nichts weiter... vielleicht ist es diese furchtbare Umgebung.",
2982,,*,Ich verstehe.... sei nicht zu streng zu dir selbst.,
2983,,Iron Fist,... Okay.,
2984,,Aquaris,Mir fällt gerade etwas nicht so gutes ein... darf ich es sagen?,
2985,,*,"Obwohl ich sehr hoffe, dass du es nicht tust...",
2986,,Aquaris,"Ah, sind wir nicht jetzt schon sehr nah am Vulkankrater... Im Falle, dass... ich meine nur für den Falle, dass der Vulkan ausbricht? Was machen wir dann? Können wir dann überhaupt noch weglaufen?",
2987,,*,……,
2988,,,Ich konnte nicht anders als auf die Lava unter meinen Füßen zu schauen.,
2989,,,"Dadurch, dass es weit und breit kein Lebewesen gab, konnte man sich nur das allerschlimmste Zenario ausmalen: Vielleicht waren die  Lebewesen, die man nun vergeblich suchte, schon vor langer Zeit von der Lava unter meinen Füßen begraben worden.",
2990,,*,Wir werden schon Glück haben...,
2991,,,"Obwohl ich das gesagt hatte, spielten sich in meinem Kopf bereits verschiedene Zenarien ab.",
2992,,Fenek,Macht euch nicht so viele Sorgen.,
2993,,Fenek,Den Aufzeichnungen nach gibt es jede Woche nur ein paar Mal Foehn und der Vulkanausbruch ist der einzige Grund für den Foehn.,
2994,,Fenek,"Diese Tage sind wir bereits auf einen Foehn getroffen, selbst wenn man bedenkt wie lange der Foehn braucht, um herzukommen, sollte es noch eine Weile dauern, bis der Vulkan ausbricht.",
2995,,Fenek,"Außerdem wird es jedes Mal bevor der Vulkan ausbricht klare Zeichen dafür geben. Die Jäger können diese wahrnehmen und uns Bescheid sagen, bevor es überhaupt passiert.",
2996,,*,"Wenn das so ist, bin ich beruhigt.",
2997,,Fenek,Aber das ist nur auf den vergangenen Geschehnissen basierend.,
2998,,Fenek,"Obwohl ich nicht glaube das es möglich ist, aber wenn dieser Lava Dämon sogar Vulkanausbrüche verursachen kann...",
2999,,*,"Stop! Stop! Hört auf davon zu reden. Ich hab das Gefühl, wenn ihr weiter darüber redet, wird es womöglich wirklich passieren...",
3000,,Anastasia,"Nachdem wir so weit gekommen sind, denkst du darüber nach aufzugeben? Sind wir nicht wegen dir erst hier?",
3001,,*,Natürlich werde ich das nicht. Ich habe mir viele Gedanken gemacht bevor ich meinen Entschluss gefasst habe.,
3002,,Anastasia,Mhm... scheint als hätte ich mir zu viele Sorgen gemacht.,
3003,,Anastasia,... okay dann lass mich mal sehen wie weit deine Entschlossenheit geht.,
3004,,,Während wir redeten versuchten wir dem Lava auszuweichen und bewegten uns immer weiter auf den Vulkankrater zu.,
3005,Lavatyrann,,Aus dem Lavakrata drang immer noch Russ und stieg in den Himmel auf und Magma lief weiter den Hang hinab.,
3006,,,Es schien so als ob noch nichtmal sie sich in der Nähe des Vulkans wohl fühlen konnten.,
3007,,Kira,Lava Dämon...,
3008,,Schüler,……,
3009,,Aquaris,…………………………,
3010,,Aquaris,Ich spreche...,
3011,,,Obwohl Aquaris Mund sich bewegte schienen kaum Wörter herauszukommen.,
3012,,Aquaris,... Vielleicht sollten wir weglaufen?,
3013,,*,……,
3014,,,"Um die Wahrheit zu sagen, konnte man sie dafür nicht verurteilen...",
3015,,,Die Chaos-Kreatur war heftiger als man sie sich hätte ausmalen können. Sein Körper füllte den gesamten Krater aus.,
3016,,,"Der harte Panzer war fest mit dem inneren des Vulkans verankert. Es war unmöglich sie noch voneinander zu unterscheiden. Er war bereits Teil des Vulkans, oder eher der Vulkan Teil von ihm geworden.",
3017,,*,"... Ich hab gehört, dass er groß ist, aber so groß?!",
3018,,Anastasia,"Wenn zur Zeit des Krieges so eine große Chaos-Kreatur existierte, dann wusste ich es nicht.",
3019,,*,Also...,
3020,,Anastasia,Ich fürchte es ist mit der Antiquität so groß geworden.,
3021,,Kira,Miao... unseren heiligen Gott so zu verwenden kann nicht verziehen werden.,
3022,,*,Hat die Antiquität auch diese Kraft...,
3023,,Fenek,Ohne unterlass zu wachsen...? Ich glaub mir dämmert etwas...,
3024,,,Während wir noch geschockt von dem Anblick des Lava Dämons sind... kommt plötzlich ein Schatten mit beißendem Wind auf uns zu,
3025,,Iron Fist,Senpai!,
3026,,Fenek und Anastasia,Vorsicht!,
3027,,,"Ohne auf meine Reaktion zu warten hatte Fenek einen Schutzzauber gestartet, während Anastasia alle beiseite geschafft hat.",
3028,,*,Was ist das...,
3029,,,"Als ich den Kopf zurückdrehte erkannte ich, dass der Platz an dem ich gestanden hatte bereits mit einen großen Haufen Lavagestein bedeckt war. Fenek Schutzzauber hatte die Lava erfolgreich daran gehindert in alle Richtungen zu fliegen.",
3030,,,"Nach dem Gewicht und der Temperatur zu urteilen... müsste dieser Angriff heftiger als ein kleiner Meteroit sein. Hätte mich das frontal erwischt, fürchte ich hätte ich nun keine Knochen mehr.",
3031,,Lava Dämon,"Ah…ich dachte es wäre nur eine Motte, die versucht, das Feuer zu löschen, aber das scheint gar nicht der Fall zu sein.",
3032,,,"Vor uns öffnet die Chaos-Kreatur seinen riesigen Kiefer, um zu sprechen.",
3033,,Lava Dämon,"Wie es aussieht, seid ihr die Feinde von denen Dire gesprochen hat. Dass ihr hier auftaucht bedeutet, dass er bereits erledigt ist? Natürlich ist er nur ein nutzloses Insekt.",
3034,,,Dire...? Wovon redet er nur? Was hat Dire nun von wieder mit dem ganzen zu tun?,
3035,,Lava Dämon,"Aber wie dem auch sei, vielleicht könnt ihr mir auch mehr Freude als Dire bereiten... Hahaha, wirklich bedauerlich. Wenn ihr meinem Feuerball gerade nicht ausgewichen wäret, hättet ihr wenigstens einen schnellen Tod gehabt.",
3036,,Lava Dämon,"Aber nun habe ich die Freude euch leiden zu sehen. Fleht mich mit euren Schreien, um Gnade an, ich kann euch sogar die Ehre zuteil werden, mein Essen zu werden!",
3037,,,"... Es ist nicht die Zeit, um groß darüber nachzudenken. Ich weiß einfach was ich jetzt tun muss...",
3038,,Anastasia,"Was denkst du? Glaubst du wir machen es noch lebend hier raus, wenn wir weglaufen?",
3039,,*,……,
3040,,*,"Nein, wir müssen früher oder später gegen ihn kämpfen, jetzt wo er uns als Feinde unterschätzt ist womöglich unsere beste Chance. Am Besten wäre, wenn wir seine Schwäche finden oder einen Hinweis auf die Antiquität.",
3041,,Anastasia,"... In Ordnung, dann werden wir seine Aufmerksamkeit erwecken.",
3042,,*,"Turin such du nach seinen Schwächen und schau, ob du etwas über den Aufenthaltsort der Antiquität herausfinden kannst.",
3043,,Turin,Verstanden!,
3044,,*,Fenek bitte unterstütze uns indem du uns beschützt.,
3045,,Fenek,Ich kümmer mich drum!,
3046,,*,Aquaris komm mit mir zusammen Anastasia unterstützen.,
3047,,Aquaris,Ah... ich habe Angst... aber natürlich werde ich alles geben...!,
3048,,*,"Kira... oder vielleicht vertraust du uns noch nicht komplett. Aber ich möchte, dass du weißt, dass wir dir bereits bedingungslos vertrauen... Es gibt hier womöglich noch andere Chaos-Kreaturen in der Nähe, bitte halte uns den Rücken frei.",
3049,,Kira,"... Verstanden, miao. Ich vertraue euch, miao.",
3050,,,"Und dieser kleine Schatten, der sich am Rande herumdrückte... Ich wusste nicht warum, aber zwischen ihm und mir war ein stillschweigendes übereinkommen.",
3051,,,"... Auch das hier hast du vorhergesehen, richtig?",
3052,,*,Und... Iron Fist...,
3053,,Iron Fist,... Ich hab schon verstanden.,
3054,,*,... Tut mir leid.,
3055,,*,Also... Los gehts!,
3056,,Schüler,Angriff!,
3057,,Lava Dämon,"Hahaha! Kommt nur, ihr todesmutigen Trottel! Ich werde euch in Stücke schneiden und euer Fleisch zu Asche verbrennen. Schreit nur!",
3058,,*,"(Bleibt ruhig... Dieser Panzer muss eine Schwachstelle haben, vertraut mir meine Freunde...!)",
3059,,Lava Dämon,"Hahahaha! Nicht schlecht! Wirklich schade, dass ihr sterben müsst...",
3060,,Lava Dämon,Ich habe mich entschlossen euch die Ehre zu erweisen euch zu fressen! So lange habe ich kein Menschenfleisch mehr gekostet... ich kann es gar nicht mehr abwarten!,
3061,,*,(Verdammt... wir können ihm keinen Schaden zufügen),
3062,,Dire,Ahahaha... meine Zeit ist fast gekommen...),
3063,Im Albtraum gefangen,Iron Fist,…………,
3064,,Iron Fist,………………,
3065,,Iron Fist,……………………！？,
3066,,,"Ich weiß auch nicht warum ich eingeschlafen war, aber als ich aufwachte war es so dunkel, dass ich noch nicht mal die fünf Finger meiner ausgestreckten Hand erkennen konte.",
3067,,Iron Fist,Was ist los?,
3068,,Iron Fist,Wo bin ich...? Sollte ich nicht eigentlich beim Vulkan sein?,
3069,,Iron Fist,Senpai? Irgendjemand anders?,
3070,,Anastasia,……,
3071,,Iron Fist,"Anastasia, bist du das?",
3072,,Anastasia,Iron Fist... Ich bin so enttäuscht von dir.,
3073,,Iron Fist,！？,
3074,,Anastasia,"Deine Kampfkünste unterscheiden sich nicht, von denen eines Krüppels, selbst jemandem, der so viele trainiert hat wie ich, fehlen da die Worte.",
3075,,Anastasia,"Und dann auch noch der Tag an dem du kammst, um von mir trainiert zu werden, sowas von unnötig. Eine einzige Verschwendung meiner Zeit. Selbst wenn du dich noch 100 Mal, 1000 Mal mehr anstrengen würdest, du bist und bleibst ein Krüppel.",
3076,,Iron Fist,Anastasia... Das kann nicht sein... So hast du noch nie mit mir geredet...,
3077,,KongMing,Kleine Iron Fist...,
3078,,Iron Fist,KongMing!,
3079,,KongMing,"Vergiss es, nenn mich nicht so.",
3080,,Iron Fist,KongMing....?,
3081,,KongMing,"Ich habe noch nie einen Fehler gemacht, bis auf einmal, ein einziges Mal, und das warst du...",
3082,,KongMing,"Iron Fist du bist mein größter Fehler... auf dem Campus sind so viele Chaos-Kreaturen, alle wegen dir... Dass ich diese kostbare Prothese an deinem Körper angebracht habe ich wirlich eine Vergeudung... einfach nur dumm von mir.",
3083,,KongMing,"Isabella und ich hätten dich damals nicht retten sollen... Wir hätten dich im Wald deinem Schicksal überlassen sollen, dann wäre all das nicht passiert...",
3084,,Iron Fist,…………,
3085,,Aquaris,Iron Fist…,
3086,,Iron Fist,Aquaris... hasst du mich etwa auch?,
3087,,Aquaris,"Iron Fist du siehst immer so unschuldig aus... Das ist deine Art, um die anderen um deinen Finger zu wickeln, oder?",
3088,,Aquaris,"KongMing, Senpai... du stehst im Mittelpunkt von allen, alle müssen dich mit Samthandschuhen anfassen. Das macht bestimmt Spaß, oder?",
3089,,Aquaris,"Alles wegen dir, immer war ich an deiner Seite und musste dich trösten, nie durfte ich selber einmal traurig sein...",
3090,,Aquaris,"Ich bin auch mal traurig, oder frustriert, ich will von Senpai wahrgenommen werden! Aber sobald du da bist, interessieren sich alle nur für dich...",
3091,,Aquaris,"Stattdessen wurde ich von allen immer nur als Dummerchen wahrgenommen, über das man lachen kann. Es macht dich bestimmt glücklich, dass ich niemals deinen Platz einnehmen konnte, oder?!",
3092,,Aquaris,Iron Fist... ich hasse dich. Ich hasse dich über alles!,
3093,,Iron Fist,Tut mir leid... es tut mir so leid...,
3094,,*,Iron Fist…,
3095,,Iron Fist,Senpai... das kann nicht sein... bitte nicht...,
3096,,*,"Iron Fist, komm mir nicht zu nah.",
3097,,Iron Fist,Nein... Nein...,
3098,,*,Auf dem Campus gibt es so viele Leute und du bist die unansehnlichste von ihnen. Woher dachtest du hättest du die Freiheit mir näher zu kommen?,
3099,,Iron Fist,"Hör auf, sprich nicht weiter...",
3100,,*,"Und wieder geht es los... Immer musst du dich beschweren und dich verstecken... Ich habe dich schon früh durchschaut. Hast du bis jetzt noch nicht verstanden, warum alle dich hassen?",
3101,,Iron Fist,"Ich weiß es, ich weiß es... Senpai, ich flehe dich an, hör auf davon zu reden...",
3102,,*,Weil du eine Missgeburt bist.,
3103,,Iron Fist,Miss.... geburt...?,
3104,,???,Iron Fist... versuchst du dir selbst zu entfliehen?,
3105,,Iron Fist,Ah... Blut... du bist...,
3106,,Iron Fist,"Meine Hand... meine Hand, ahhhhhhh...!!!",
3107,,Dire,Hahahaa... deine Verzweiflung ist so niedlich... Jetzt erlaube mir deinen Geist zu konsumieren und deinen Körper zu kontrollieren... du wist meine perfekte Pupe sein.,
3108,,Dire,(Deine Kraft... deine Essenz und die geheime Chaos-Kreaturen Kraft in deinem Körper... alles ist meins...!),
3109,Rückzug,,"Fenek war die erste, die merkte, dass etwas nicht stimmte.",
3110,,Fenek,"…!? Mir scheint, dass irgendwas mit Iron Fist nicht stimmt!",
3111,,*,Was?!,
3112,,,Im Eifer des Gefechts fand ich nur schwer eine Möglichkeit mich umzudrehen...,
3113,,,"Ich sah Iron Fist, wie sie auf dem Boden lag und ihren Arm hielt, während sie mit etwas zu kämpfen schien.",
3114,,*,(Das... Warum...?! Iron Fist hatte doch gar nicht im direkten Kampf teilgenommen... wo hatte ich nicht genug aufgepasst?),
3115,,Anastasia,"... Kein Grund zu zweifeln, tu was du tun musst.",
3116,,*,"... Das ist richtig. Jetzt ist nicht der Moment, um hier zu bleiben.",
3117,,*,Leute...! Macht euch bereit für den Rückzug!,
3118,,Lava Dämon,"Hahahaha, ihr wollt weglaufen? Ihr seid ein Haufen Ameisen... dachtet ihr wirklich, dass es so einfach wäre?!",
3119,,,"Der Lava Dämon trampelte auf dem Boden, sodass dieser wie bei einem Erdbeben anfing zu wackeln und es uns schwerfiel die Balance zu behalten. Und dann auch noch...",
3120,,Aquaris,Der... Boden bricht auf?! Und... es schoßen Ströme von Lava heraus...,
3121,,Anastasia,"Fenek, Turin, schützt uns!",
3122,,Turin,Kein Problem... das ist für mich noch kein Problem.,
3123,,Fenek,Beeilt euch! Der Boden kann jeden Augenblick zusammenbrechen!,
3124,,Anastasia,Haltet euch fest!,
3125,,Aquaris,"Ah, Ahhhhhh?!",
3126,,,"Anastasia umarmte... oder mehr umklammerte Aquaris fest... Es sah so aus, als müsste ich mir da keine Sorgen machen. Sorgen musste ich mich stattdessen...",
3127,,*,Iron Fist! Ich komme rüber...,
3128,,,Ich versuchte so schnell wie möglich über den wackelnden Boden zu Iron Fist zu gelangen... aber...,
3129,,Fenek,Iron Fist ist zu weit weg! Du wirst es nicht rechtzeitig schaffen...!,
3130,,*,Als ob ich das nicht wüsste...!,
3131,,,"Ich hatte nicht viel Zeit, um nachzudenken, ich hatte nur einen Gedanken, so schnell wie möglich an Iron Fists Seite zu kommen... nachdem ich sie umarmte, konnte ich ihr schmerzverzerrtes Gesicht sehen, es war nicht schwer zu erkennen, dass sie höllische Schmerzen hatte.",
3132,,*,……,
3133,,,"Einen Augenblick später brach der Boden um uns herum zusammen und die Lava floß ohne, dass man sie stoppen konnnte auf uns zu.",
3134,,Fenek,Verdammt... es ist zu spät!,
3135,,Turin,Ich komme...!,
3136,,*,Nein... die Zeit reicht nicht.,
3137,,,"Selbst wenn die Zeit ausreichen würde... das war der Grund warum ich dieser Person meinen Rücken anvertraut hatte. Ich wusste auch nicht warum, aber ich vertraute ihr einfach.",
3138,,*,Kira…!,
3139,,,"Kira hatte in Sekundenschnelle verstanden was ich wollte, und indem sie die Ketten in unsere Richtung balancierte ergriff sie mich und Iron Fist.",
3140,,Kira,Miao…!!,
3141,,,"Ich überließ die gesamte Energie meines Körpers meinen Beinen, während die heiße Lava auf uns zu floss. Mit Kiras Hilfe war es leicht uns zwei in die Luft zu befördern...",
3142,,Turin,"Senpai, Senpai... ist alles okay...",
3143,,*,So weit ist alles okay...,
3144,,Fenek,Ihr habt mir wirklich Angst gemacht...,
3145,,*,"Kira, du hast uns gerettet, Danke!",
3146,,Kira,Miao…,
3147,,Anastasia,"Wir können hier nicht lange bleiben, alles andere können wir später besprechen, schnell weg hier.",
3148,,Lava Dämon,Ihr solltet sterben ihr stinkenden Insekten! Denkt ihr wirklich ihr könntet weglaufen??!! Wartet nur... ich werde euch schon fangen und euch alle zerquetschen!!,
3149,,Lava Dämon,…………,
3150,,Lava Dämon,……………………,
3151,,Lava Dämon,HAHAHAHA... HAHAHA! HAHAHA!!!!,
3152,,Lava Dämon,"Ich erinner mich... die, die vor 100 Jahren kamen kamen von einem Ort der Yume hieß? Ich hätte nicht gedacht, dass ihr immer noch am Leben seid.",
3153,,Lava Dämon,"... Aber okay. Ich bin diesen Vulkan eh schon müde. Jetzt werde ich gehen und mir euren Boden nehmen und euren Wald verbrennen, und genüßlich dabei zu sehen wie ihr bei lebendigem Leibe verbrennt! HAHA!",
3154,Unglück hoch zwei,Aquaris,"Ahah... ahhh... ich hätte nicht gedacht, dass wir es lebend da raus schaffen...",
3155,,Anastasia,... Du kannst jetzt loslassen!,
3156,,Aquaris,"Huh.... ah, ja, tschuldige!",
3157,,,"Bis wir zum Versteck der Jäger zurückgekert waren, hatte Aquaris Anastasias Arm nicht losgelassen.",
3158,,Aquaris,(Verdammt... schlägt mein Herz so schnell... wegen dem Kampf gerade? oder...),
3159,,Fenek,Sieht so aus als wären alle okay... nur...,
3160,,*,…Iron Fist ist immer noch im Koma.,
3161,,Turin,Lass mich mal schauen.,
3162,,,"Nachdem ich Iron Fist hingelegt hatte, berührte Turin leicht ihren Körper und fing an sie zu untersuchen.",
3163,,Turin,Das...,
3164,,*,Was ist?,
3165,,Turin,In Iron Fist Körper... kann ich die Anwesenheit einer Chaos-Kreatur spüren...,
3166,,*,……！？,
3167,,Anastasia,"Es ist Dire... Kein Wunder, dass es sich so vertraut anfühlt. Verdammt, ich hätte es womöglich früher merken müssen.",
3168,,Turin,"Nein... es ist mehr als das... Da ist auch noch etwas anderes als Dire, aber es ist nichts lebendiges... Ich weiß auch nicht was es ist.",
3169,,*,…………,
3170,,Anastasia,"Mir scheint, du hast das schon gewusst oder? Zumindest, dass da noch etwas anderes ist.",
3171,,*,"... ich weiß auch nicht viel mehr als ihr, ich wollte Iron Fist nicht beunruhigen und habe deshalb nichts gesagt.",
3172,,Anastasia,"… wie dem auch sei. Das wichtigste ist sie zu retten. Turin, hast du eine Idee?",
3173,,Turin,"Ich habe Iron Fist Prothese untersucht... obwohl es verschiedene Veränderungen gibt, hat der Kern sich nicht verändert. Diese Technik scheint mir von Alberta zu sein.",
3174,,Turin,"Wie es aussieht, hat die Prothese immer schon die Chaos-Kreatur in Iron Fist Körper unterdrückt. Aber weil in letzter Zeit so viele Dinge pasiert sind, hat die Prothese langsam an Kraft verloren.",
3175,,Turin,"Die Invasion von Dire war vermutlich einfach zu viel... auch wenn der Arm sich noch gezwungener Maßen bewegt, ist es jedoch nicht mehr in Iron Fists Willen. Ich fürchte Dire ist gerade dabei die komplette Kontrole von Iron Fists Körper zu übernehmen.",
3176,,*,... also können wir nichts mehr tun?,
3177,,Turin,"… Ich weiß es nicht. Diese Prothese ist nicht von mir konstruiert worden, und ich weiß auch nicht wie ich die Chaos-Kreatur aus ihrem Körper holen soll...",
3178,,Anastasia,... Sollen wir zurück gehen? Zum Campus.,
3179,,*,"… Selbst wenn wir zurück gingen, fürchte ich...",
3180,,Rumpy,Miao!Miao!Miao!!! Miao!,
3181,,*,Rumpy...!?,
3182,,Kira,………………,
3183,,,"Als Kira Rumpy fertig angehört hatte, bekam sie einen ernsten Ausruck. Alle Jäger in der Höhle riefen wild durcheinander... Ich hatte eine schlechte Vorahnung.",
3184,,*,"…Kira, was ist los?",
3185,,Kira,"… Der Vulkan, er wird ausbrechen, miao.",
3186,Aufgeteilte Streitkräfte,*,Hieß es nicht er würde alle paar Wochen nur ein Mal ausbrechen?,
3187,,Fenek,... das ist nur ein Muster in der Vergangenheit. Ich habe gerade erst verstanden... warum sich der Foehn gebildet hat.,
3188,,*,Und... was ist es...,
3189,,Fenek,"Als der Lava Dämon während des Krieges die Antiquität der Jäger raubte, brach der Vulkan zum ersten Mal aus. Dieses Mal müsste es daran liegen, dass Lava Dämon die Antiquität benutzt und den Vulkan nicht weiter unterdrücken kann.",
3190,,Fenek,Immerhin ist Lava Dämon seit über 100 Jahren im Vulkankrater und hat die Kraft der Antiquität benutzt um immer Größer zu werden...,
3191,,Fenek,"Sein Körper ist nun so groß, dass der Krater ihn nicht mehr fassen kann, und er wächst immer noch weiter. Sein Panzer drückt immer stärker auf den Vulkan. Und wenn ein bestimmter Punkt erreicht ist, dann...",
3192,,*,"Also, ist der Grund dass der Vulkan ausbricht...",
