id,string,explanation
1,"Die Verteidigung auf dem Feld ""{1}"" unter {2} wurde besiegt und wir haben {3} Expeditionspunkte erhalten!\nMVP: {4} (aus Lager ""{5}"")","任意地块（包括中央冰川）的守军被首次清空时，并且自身阵营有参与挑战时推送。{3}中显示玩家所属阵营因此分到的积分。地块坐标需要显示为（x,y)的形式"
2,"Wir haben das Feld ""{1}"" unter {2} erobert!\nNeuer Besetzer: {3}",原本属于其他玩家阵营的非普通格地块，被我方阵营占领时推送
3,"Alle Ziele der Phase ""{1}"" wurden erreicht! Wir haben {2} Expeditionspunkte erhalten!",某时代的远征任务全部完成后推送。{2}中显示玩家所属阵营通过该时代的远征任务所获得的积分总和
4,Eine neue Phase hat begonnen: {1}\n{2},新时代开启时推送
5,"{1}, deine Versammlung auf dem Feld {2} {3} wurde beendet. Insgesamt sind dir {4} Truppe(n) gefolgt.",集结指令结束之后推送。*需要替換為學長名
6,"Versammeln wir uns auf diesem Feld, um die Gegner herauszufordern!",在非己方阵营的地块上集结时推送
7,"Lasst uns auf diesem Feld versammeln, um unser Gebiet zu beschützen!",在己方阵营的地块上集结时推送
