id,title,name,dialog,select_text
1345,,Turin,"Obwohl wir das System gemeinsam erstellt haben, hat sie den Hauptteil vervollständigt.",
1346,,Turin,Ich weiß nicht wie es genau funktioniert.,
1347,,*,"Ich verstehe. Dann gibt es noch einen Grund, warum wir Turins Spiel nicht zerstören sollten.",
1348,,Turin,???,
1349,,*,"Das Turin-Spiel hat in der Vergangenheit die Diener verletzt, aber wir könnten es auch nutzen, um ihnen zu helfen.",
1350,,*,Genau wie das von Isabella entworfene Anästhetikum. Es könnte entweder für eine Operation oder als eine tödliche Waffe verwendet werden...,
1351,,Maska,"(Wenn Isabella das hören würde, würde Senpai sicher schnell den tödlichen Teil testen können…)",
1352,,*,"Nur die Person, die Macht hat, entscheidet, ob sie zum Guten oder zum Schlechten eingesetzt wird.",
1353,,*,"Wenn wir herausfinden können, wie dieses Gerät funktioniert, können wir es für das GUTE verwenden.",
1354,,*,"Außerdem denke ich, dass Turin es für das GUTE benutzen kann, oder?",
1355,,Turin,"Vielleicht, aber ich möchte dieses Objekt nie wieder berühren...",
1356,,*,"Ich werde es dann erstmal für dich aufbewahren, vertraust du mir?",
1357,,Turin,Na sicher! Ich wüsste nicht wer besser drauf aufpassen könnte.,
1358,,Maska,"Okay, es ist schon dunkel. Kehren wir zum Camp zurück und ruhen uns aus.",
1359,,Maska,Morgen früh müssen wir noch zur Akademie zurück~,
1360,,,"Nachdem ich Turin und Maska zurück ins Camp gebracht hatte, konnte ich mich endlich entspannen.",
1361,,*,(Alberta... lebt sie noch?),
1362,,*,"(Wird sie uns Hoffnung bringen, so wie es Anastasia und....)",
1363,,*,"(Oder wird es uns wie Kratos, Zerstörung bringen?)",
1364,,*,"(Was auch immer der Fall ist, ich muss den Campus beschützen...)",
1365,Foehn!!!,Aquaris,Hi!,
1366,,Iron Fist,Guten Morgen allerseits~,
1367,,Knospe,"Ich werde nie wieder mit Quinie schlafen! Sie hörte nicht auf, mein Bein die ganze Nacht zu umarmen!",
1368,,Knospe,Ich dachte mein Bein fällt bald ab!,
1369,,Quinie,"Haha, selbst Schuld. Du riechst so toll... nach ESSEN! Hi, hi...",
1370,,Guan Yin,Der Urlaubstag ist vorbei~,
1371,,Sonya,Wir werden vielleicht in Zukunft wieder hierher kommen~,
1372,,Maska,Ich habe meine Zeit hier wirklich genossen.,
1373,,Turin,Maska~,
1374,,Rumpy,Miau,
1375,,Bruno,Wuff!,
1376,,*,"Es scheint, dass jeder zufrieden ist~",
1377,,*,"(Ich hatte nicht einmal Zeit, ein Bad zu nehmen... zumindest hatten die Mädchen Spaß)",
1378,,Anastasia,Es ist toll~,
1379,,Anastasia,"Ok, packt eure Sachen fertig, es ist Zeit, zurück zur Akademie zu gehen~",
1380,,*,"Ich habe mich gefragt, warum dieser Ort Foehn Ödland heißt.",
1381,,Iron Fist,"Ja, das möchte ich auch wissen... 「Foehn」 klingt gefährlich",
1382,,Iron Fist,Hängt das mit dem Waldbrand zusammen?,
1383,,Fenek,"Anastasia erfuhr während ihrer Reise von dem Namen, aber wir wissen nicht genau, warum dieser Ort so heißt.",
1384,,Fenek,"Wir wissen nur, dass es in der Nähe einen Vulkan gibt…",
1385,,*,Natürlich… Das erklärt die heiße Quelle.,
1386,,*,"Aber wenn Dinge aus dem Vulkan herausgeschleudert werden und vom Berg herabsteigen, steigt auch die Temperatur der umgebenden Luft...",
1387,,*,Diese könnte wirklich alles austrocknen... Vielleicht bedeutet Foehn-Föhn?,
1388,,Iron Fist,Ja wirklich…? Das klingt schrecklich.,
1389,,Fenek,Aber Vulkane brechen nicht oft aus.,
1390,,Fenek,"Es ist nicht üblich, einen Ort nach einer Katastrophe zu nennen...",
1391,,Anastasia,"Schnell, weg da!",
1392,,*,Was kommt da?,
1393,,Fenek,IST DAS FOEHN?,
1394,,Anastasia,JA!,
1395,,Fenek,Ah Mist...! Ich werde nicht wieder solchen Unsinn erzählen!,
1396,,*,"Ich habe es verstanden! Der regelmäßige Ausbruch des Vulkans verursachte mehrere Föhnwinde, also…",
1397,,Iron Fist,"Jetzt ist nicht der beste Zeitpunkt, darüber nachzudenken, Senpai!",
1398,,Fenek,Die elementare Barriere wird jeden Moment fertig sein!,
1399,,Iron Fist,Die Temperatur steigt!!!,
1400,,*,"Es brennt, wenn ich spreche...",
1401,,*,Es ist endlich vorbei...,
1402,,Aquaris,"Senpai, wenn deine Zunge brennt, solltest du nicht sprechen~",
1403,,*,.... Es ist alles ok.,
1404,,Aquaris,Was hat er gesagt?,
1405,,Turin,"Es ist nichts, es ist nur ein bisschen schwer zu sprechen ...",
1406,,Iron Fist,"Das ist also der berühmte Foehn...? Es ist so, als ob der Wind eine Flamme ist, die alles auf ihrem Weg verbrennt...",
1407,,Iron Fist,Und deshalb hat sich dieser Wald nie erholen können...,
1408,,Anastasia,"Okay, die Pause ist vorbei. Wir sollten weiter gehen.",
1409,,Fenek,"Ja, Vulkanausbrüche sind hier ziemlich zufällig, wir können nicht...",
1410,,Maska,"Fenek, bitte sei jetzt ruhig!",
1411,,Fenek,Upsi...,
1412,,Rumpy,Miau!,
1413,,Anastasia,Bilde ich mir das ein?,
1414,,Anastasia,... das jemand uns beobachtet...,
1415,,???,…,
1416,Plan der Antiquität,*,"Warum bin ich der einzige, der mit dir in die Große Bibliothek kommen muss? Ich möchte zurück in mein Wohnheim!",
1417,,Anastasia,Wir zwingen dich zu nichts.,
1418,,*,Ich wollte nicht lauschen...,
1419,,Fenek,Verstehe... Verstehe... also hast du gelauscht.,
1420,,*,Und nun?,
1421,,Anastasia,Das war ein Witz. Kommen wir jetzt zur Sache.,
1422,,Anastasia,"Ist dir auch aufgefallen, dass die Akademie schwächer geworden ist?",
1423,,*,…,
1424,,Anastasia,"Li ist im Winterschlaf, das Siegel ist tot, die meisten Walküren haben ihre Kräfte verloren.",
1425,,Anastasia,Die Akademie ist fast ungeschützt.,
1426,,*,"Wie konnten wir nicht bemerken, dass…",
1427,,Fenek,"Während ich die Bibliotheksmaterialien sortiert habe, habe ich über die Existenz der Antiquität erfahren.",
1428,,Fenek,"Es ist genau wie die physische Form eines Phänomens und es hängt eng damit zusammen, wie die Welt funktioniert...",
1429,,*,Es scheint ein mächtiges Werkzeug zu sein... Wir wollen es als Verteidigung für die Akademie einsetzen?,
1430,,Anastasia,"Ja, wir sollten in der Lage sein, seine Macht zu nutzen, nachdem wir sie gefunden haben.",
1431,,Anastasia,Vielleicht könnten wir Li auch wieder erwecken.,
1432,,*,"Glaubst du, du könntest andere Hinweise in der Nähe der heißen Quelle finden?",
1433,,Fenek,Ich habe eine Aufzeichnung einer Legende gefunden.. aber der Autor ist unbekannt…,
1434,,Fenek,Die Legende sprach vom Rotkammwald,
1435,,,Mit der Kraft des Feuers und der Jagd in der Hand wird der Gott des Luchses im Norden erscheinen.,
1436,,,Er wird die Blätter anzünden und die Bäume zum schweigen bringen.,
1437,,,Aber auch in den kältesten Winternächten bleibt die Flamme unseres Gottes in unserer Nähe.,
1438,,,"Stelle das Opfer vor das Auge Gottes, und seine warmen Tränen werden es uns ermöglichen, den Winter zu überleben.",
1439,,Fenek,"Was glaubst du, was es bedeutet?",
1440,,*,Dies scheint die Beschreibung eines natürlichen Phänomens zu sein.,
1441,,*,Die in Brand gesetzten Blätter könnten die roten Ahornblätter beschreiben.,
1442,,*,"Und die warmen Tränen könnten die heißen Quellen sein, aber...",
1443,,Fenek,Das Auge ihres Gottes wird im Detail beschrieben…,
1444,,Fenek,"Es gibt sogar eine Beschreibung der Bewohner, die es verwenden, um ihre Kräfte zu verbessern.",
1445,,*,Eine Antiquität...?,
1446,,Anastasia,Aber nach der Beschreibung der Legende...,
1447,,Anastasia,"Geschah es, bevor der Wald zu einem Ödland wurde.",
1448,,Anastasia,"Deshalb halten wir es für notwendig, dies zu überprüfen.",
1449,,*,Und der legendäre Stamm...?,
1450,,Anastasia,Es ist der Stamm der Jäger... Wir haben... während des letzten Krieges mit ihnen zusammengearbeitet...,
1451,,*,Das macht Sinn…,
1452,,Fenek,Huh? Das wusstest du also schon?,
1453,,*,"(Dies ist der Stamm, der unter dem Turinerpiel gelitten hat... Wie konnte ich das nur nicht wissen...?)",
1454,,*,Der Wald wurde zum schweigen gebracht... Ist hier das Feuer gemeint?,
1455,,Fenek,"Es ist schwer zu sagen... Ich denke, das Feuer war nur ein Unfall.",
1456,,Fenek,Vielleicht lag es an der Chaos-Invasion...,
1457,,Anastasia,"Ein Stamm, der Feuer liebt und der durch Feuer zerstört wurde, wie ironisch...",
1458,,*,Ich verstehe... Aber... warum sagen wir nicht allen die Wahrheit?,
1459,,*,Wenn dieser Ort gefährlich ist...,
1460,,Anastasia,DEF darf es nicht erfahren.,
1461,,*,"Nachdem das Siegel besiegt wurde, sollte DEF...",
1462,,Anastasia,"Ich habe ein wenig nachgeforscht, was während meiner Abwesenheit auf dem Campus passiert ist...",
1463,,Anastasia,Meiner Meinung nach wollte DEF nur gegen LI kämpfen.,
1464,,Anastasia,"Und was ""Li"" tat, war nicht gerade... freundlich.",
1465,,Anastasia,"Ich denke, es ist notwendig, DEF davon fernzuhalten und den Frieden auf dem Campus aufrechtzuerhalten.",
1466,,Anastasia,"Wenn DEF die Wahrheit über die Antiquität weiß, dann haben wir ein echt großes Problem!",
1467,,*,Deshalb hast du nach einer Ausrede für die Reise gesucht...,
1468,,*,Wurde Historia aus demselben Grund auf die Mission geschickt?,
1469,,Anastasia,"Ich wollte nur auf Nummer sicher gehen. Es war das beste, Historia zu beschäftigen.",
1470,,Anastasia,"Da der Campus immer noch in Gefahr ist, sollten wir vorsichtiger sein.",
1471,,Fenek,Anastasia kümmert sich mehr als jeder andere um die Sicherheit der Schüler!,
1472,,Fenek,"Natürlich, außer dir~",
1473,,*,"Ja, das wusste ich schon.",
1474,,Anastasia,"Kurz gesagt, das ist alles was wir haben.",
1475,,Anastasia,Bist du dabei?,
1476,,*,Bei was?,
1477,,Anastasia,"Ich hoffe, du kannst dich unserem Team als Kapitän anschließen, um nach der Antiquität zu suchen~",
1478,Unentschlossenheit,,"Am Abend des 20. Oktobers im Jahre 129 des neuen Kalenders, in der großen Bibliothek Ulbricht",
1479,,*,"Natürlich, ich hätte wissen müssen, dass es wieder Ärger gibt...",
1480,,Fenek,Sollte als Senpai die Teilnahme an dieser Art von Aktivitäten nicht normal sein?,
1481,,*,"Aber es ist einfach zu plötzlich... während des Trips habe ich so viel gehört, dass jetzt mein Kopf weh tut.",
1482,,*,Nichtmal die heißen Quellen konnte ich genießen,
1483,,Anastasia,"Na perfekt, dem Plan zufolge kommen wir auf dem Weg, um die Antiquität zu finden, nochmal an einer heißen Quelle vorbei und du kannst das Verpasste nachholen.",
1484,,*,"So ist es, einfach super... Wie kann das sein! Ist es möglich, dass es einfach so gut geplant wurde!?",
1485,,Anastasia,"Wer weiß das schon. Wie auch immer, lass mich deine Antwort wissen.",
1486,,*,…,
1487,,*,Muss ich dir jetzt sofort Bescheid sagen?,
1488,,Anastasia,"... ich versteh schon, dass das ein bisschen plötzlich kommt, aber die Zeit ist ziemlich knapp. Ich kann dir nur 3 Tage Überdenkzeit geben.",
1489,,*,Nur drei Tage?,
1490,,Anastasia,Am Abend des dritten Tages werde ich in der Nähe vom Wald außerhalb des Tors auf dich warten.,
1491,,Anastasia,"Wenn du bis Mitternacht nicht kommst, rechne ich nicht mehr mit dir.",
1492,,*,Oh... und was passiert wenn ich nicht mitkomme?,
1493,,Anastasia,"Das macht auch nichts. Ob du kommst oder nicht, wir werden fahren.",
1494,,Fenek,Aber ohne Senpai wird die Reise ein wenig einsam werden,
1495,,*,"(Das ist zwar schön gesagt, aber ich hab das Gefühl, dass sie nur meine Kräfte ausnutzen will)",
1496,,Anastasia,Ich werde Turin später Bescheid sagen. Für diese Aufgabe brauchen wir Leute denen wir vertrauen können.,
1497,,Anastasia,"Neben Stärke ist es aber am Wichtigsten, bereit zu sein, sich für die Li Akademie einzusetzen.",
1498,,Anastasia,"Wenn du noch passende Leute kennst, bring sie mit. Ich denke es wird viele geben, die bereits sind dir zu folgen.",
1499,,*,In Theorie ja... in der Realität verstehen nur wir die Situation wirklich.,
1500,,*,"Und auch noch der Einfluss von DEF, ich weiß nicht wie viele... außerdem...",
1501,,Anastasia,Das Mädchen Iron Fist scheint dir voll und ganz zu vertrauen.,
1502,,Anastasia,"Auch Ihre Performance beim Training in der letzten Zeit zeigt, dass sie die Fähigkeiten dazu hat.",
1503,,*,Iron Fist?... Ich mach mir ein bisschen Sorgen um ihre körperliche Konstitution.,
1504,,*,Ihre körperliche Konstitution ist nicht so gut. Das haben mir auch Isabella und KongMing berichtet.,
1505,,Anastasia,... Okay ich verstehe. Dann liegt die Entscheidung bei dir.,
1506,,Anastasia,"Aber denke dran, du hast nur drei Tage, um eine Entscheidung zu treffen. Danach kannst du deine Entscheidung nicht mehr ändern.",
1507,,*,Ich verstehe... lass mich darüber nachdenken.,
1508,,Fenek,Wenn Senpai kommen könnte wäre es echt gut.,
1509,,Anastasia,"Ja. Er und Turin als Supervisor, wären bei dieser Aufgabe besonders hilfreich.",
1510,,Fenek,"Na, sollten wir ihn dann nicht einfach zwingen? Dann würde er sicher zusagen.",
1511,,Anastasia,Ihn zu zwingen wollen wir ja gerade vermeiden.,
1512,,Fenek,"Ach, du bist einfach zu lieb.",
1513,,Anastasia,…,
1514,,Fenek,"Hey, hör auch mich anzustarren. Mit deiner Maske machst du einem richtig Angst...",
1515,Chaos an der Schule,*,"Uh... auf der Suche nach der Antiquität... ich fürchte es wird eine Weile nicht möglich sein, zur Akademie zurückzukehren.",
1516,,*,"Außerdem wissen wir noch nicht mal, was uns da draußen erwartet... Selbst mit Anastasia als Senior mit dabei muss man sich Sorgen machen.",
1517,,Joan,"Chaos-Kreatur in Sicht, macht euch bereit zu kämpfen!",
1518,,*,Ist das Joan? Leitet sie die Disziplinarkommission?,
1519,,Joan,Lockt sie zur festgelegten Position und umzingelt sie!,
1520,,*,"Sieht so aus, als bräuchten sie meine Hilfe nicht....",
1521,,*,"Aber ich hätte nicht gedacht, dass es auf dem Campus Chaos-Kreaturen gibt...",
1522,,Joan,"...! Im Falle, dass etwas unerwartetes passiert, ist die Kampftruppe bereit zu übernehmen!",
1523,,*,"Ähm, bin ich im Weg? Warum kommen die Chaos-Kreaturen auf mich zu...!",
1524,,*,Mir bleibt keine andere Wahl!,
1525,,Joan,"Senpai, was machst du da auf der Straße?",
1526,,Joan,"In letzter Zeit treiben sich einige Chaos-Kreaturen auf dem Campus herum, am Abend müssen die umliegenden Bereiche geschlossen werden.",
1527,,*,Achs... so ist das also. Davon habe ich noch nichts gehört.,
1528,,Joan,"... Das zeigt, dass das die Disziplinarskommision noch nicht genug gemacht hat. Ich werde das prüfen.",
1529,,Joan,Was ist eigentlich gerade in deinem Kopf auf der Straße vor sich gegangen?,
1530,,*,"Nichts weiter, betrifft nur mich selber.",
1531,,Joan,"So ist das also. Seit du von den heißen Quellen wieder gekommen bist, machst so ein deprimiertes Gesicht. Es ist schwer das nicht zu merken.",
1532,,Joan,Ist es weil etwas auf der Reise passiert ist?,
1533,,*,Mhm... meinst du...?,
1534,,Joan,"Ich hab gehört, dass du auf einen heißen Sturm getroffen bist?",
1535,,Joan,Aber es scheint als wäre alles okay bei dir. Wirklich super!,
1536,,*,"（... wie kommt es, dass es so bald ausgesetzt wurde?)",
1537,,*,"Puh, das war knapp, ohne Feneks Magie werden wir eventuell nicht zurückkommen.",
1538,,Joan,"Ich verstehe, das letzte was man von so einem Trip erwarten würde.",
1539,,*,Das war doch nichts. Außerdem muss deine Erfahrung schlechter als meine sein. Guan Yin und Sonya haben die ganze Reise von dir geredet.,
1540,,Joan,"Ich habe keine andere Möglichkeit, wenn es in Ordnung geht, würde ich gern mit euch mitkommen.",
1541,,Joan,Es ist nur in letzter Zeit ist so viel passiert. Und die Chaos-Kreaturen greifen den Campus auch immer öfter an...,
1542,,Joan,"Sie sind keine wirkliche Bedrohung, doch ich denke es ist notwendig, den Grund für ihr Kommen zu finden.",
1543,,*,(die Situation des Campus hat sich schnell verschlechtert...),
1544,,Joan,"Ach, du bist schon wieder in Gedanken versunken. Hast du etwa einen neuen Hinweis?",
1545,,*,"Was? Nein, ich bin immer noch total verwirrt.",
1546,,Joan,Ist das so? Deinem Ausdruck zufolge weißt du offensichtlich was.,
1547,,Joan,"Aber egal, es ist der Job der Disziplinarkommision.",
1548,,*,"Sieht so aus, als wäre Joan nun der Vorsitzende der Disziplinarkommision.",
1549,,Joan,Es ist nur vorübergehend... bis Michaela zurückkommt übernehme ich das Amt.,
1550,,Joan,"Sobald es Michaela besser geht, kann ich ihr das Amt jederzeit zurück geben.",
1551,,*,Ich dachte immer du wolltest Präsident werden.,
1552,,Joan,"Achja, nicht jeder ist so erhgeizig wie Historia und Bunny.",
1553,,Joan,Ich mache nur was getan werden muss.,
1554,,Athena,Bericht! Präsident Joan! Die Chaos-Kreaturen in der Nähe des Campus sind bereits auf dem Campus!,
1555,,Athena,Ich bin gerade auf dem Weg zur Patrouille in der Nähe der Sportplätze.,
1556,,Joan,"Gute Arbeit, ich komme bald rüber und unterstütze euch.",
1557,,Athena,Verstanden. Ich bringe die Truppe dorthin.,
1558,,*,"Es scheint, dass die Patrouillen häufiger geworden sind.",
1559,,Joan,Ja so ist es. Wegen der Sicherheit der Studierenden müssen wir auch über eine Ausgangssperre nachdenken.,
1560,,*,Das wäre ja schrecklich....,
1561,,Joan,"Okay, ich mach mich auf den Weg zur Patrouille.",
1562,,Joan,"Sieht so aus, als müsste Senpai morgen früh mal beim Dorm vorbeischauen, KongMing sucht dich.",
1563,,*,Mich?,
1564,,Joan,Sie wirkt ziemlich sauer. So sieht man sie nicht oft.,
1565,,*,"Oh, Wirklich?",
1566,,Joan,"Okay, ich mach mich auf den Weg zur Patrouille. Passt auch euch auf~",
1567,,*,"Warte, sag mir noch, um was es geht!",
1568,,*,Und sie ist weg...,
1569,,*,Worum geht es nur... das macht einem ja Angst...,
1570,Innere & äußere Konflikte,,——Am nächsten Tag,
1571,,*,…,
1572,,KongMing,…,
1573,,*,(Die Stimmung ist so schlecht... Wie ist da alles nur gekommen...),
1574,,*,(Sollte ich vielleicht zuerst reden...?),
1575,,*,Ähm...,
1576,,KongMing,Senpai.,
1577,,*,!? Ja... Ich bin da.,
1578,,KongMing,Weißt du warum ich diesen Trip erlaubt habe?,
1579,,*,Warum... damit wir uns ein bisschen erholen können?,
1580,,KongMing,Ja... damit sich jeder ein bisschen erholen kann.,
1581,,KongMing,"Und so ein Tripp sollte vor allem sicher sein, richtig?",
1582,,*,Ja du hast vollkommen Recht...,
1583,,KongMing,Aber warum musstest du dann Foehn angreifen und alle in Gefahr bringen?,
1584,,*,Huh…,
1585,,KongMing,"Ich verstehe, dass Anastasia und du andere Pläne haben,",
1586,,KongMing,"Die Reise als Vorwand zu nehmen kann ich nachvollziehen, aber ich dachte ursprünglich, dass alle in Sicherheit sein würden...",
1587,,KongMing,"Es ist unmöglich, dass Anastasia nichts von der Gefahr gewusst haben kann.",
1588,,KongMing,"Wenn sie wissendlich das Risiko auf sich nahm, muss es etwas wichtiges sein.",
1589,,*,(Sie hat alles gesagt...),
1590,,KongMing,"Also... was soll das für eine Sache sein, die es lohnt so ein großes Risiko auf sich zu nehmen?",
1591,,*,"(Sieht so aus, dass sie mich nicht in Ruhe lassen wird, wenn ich nichts sage)",
1592,,,"Also sage ich ihr was wir in der Höhle gefunden haben, aber ich behalte den Teil mit Anastasia für mich.",
1593,,,und ich habe die Antiquität nur als ein Werkzeug mit starken Kräften beschrieben.,
1594,,,"So gesagt, ist es auch keine Lüge",
1595,,KongMing,So ist das also. Ich verstehe.,
1596,,KongMing,"Also hat Anastasia gehofft, dass sie mit der Kraft der Antiquität die Schule beschützen kann?",
1597,,*,Genau... Obwohl auch ich erst gerade von dem Plan gehört habe.,
1598,,KongMing,Ah... das macht Sinn.,
1599,,*,"Wenn wir schon davon sprechen, da ist noch eine Sache, die ich dir sagen möchte. Anastasia plant auch...",
1600,,KongMing,"Warte, ich weiß schon was du sagen willst.",
1601,,KongMing,"Aber mein Kopf platzt schon, warte kurz, ich muss ich ausruhen bevor wir weiter reden.",
1602,,*,…,
1603,,KongMing,…,
1604,,*,…,
1605,,KongMing,"Okay, ich denke Anastasia möchte einen Trupp zusammenstellen und die Antiquität suchen oder?",
1606,,*,"Genau, so ist es.",
1607,,KongMing,"Wenn die Antiquität die Probleme, die wir mit den Chaos-Kreaturen auf dem Campus haben lösen kann.",
1608,,KongMing,vielleicht ist es dann einen Versuch wert....,
1609,,*,Du meinst also...?,
1610,,KongMing,"Aber leider, kann das Studentenwerk euch derzeit leider niemanden zur Verfügung stellen.",
1611,,KongMing,"Zu allererst, aufgrund der zunhemenden Anzahl der Chaos-Kreaturen, können wir es uns nicht erlauben alle Kräfte einzusetzen um die Sicherheit zu gewährleisten.",
1612,,KongMing,"Obwohl die Chaos-Kreaturen derzeit nicht so stark sind, wissen wir jedoch nicht, wie sie sich entwickeln werden, und ob sie früher oder später zu einer Bedrohung werden.",
1613,,*,"Das habe ich auch auf dem Weg hierher gesehen, selbst die Disziplinarskommission läuft Patroullie.",
1614,,KongMing,"Zudem, solange es die DEF gibt, haben die Studierenden keine Chance etwas auffälliges zu tun.",
1615,,KongMing,"Ich denke das ist auch der Grund, weshalb Anastasia die Reise als einen Vorwand genommen hat, um ihren Job zu erledigen.",
1616,,KongMing,"In der Tat, ist Historia nicht auf dem Campus und Lucifer hat ihre Erinnerung verloren, aber wir können dennoch einige versteckte Aktivitäten der DEF aufspüren.",
1617,,KongMing,"Derzeit wissen wir nicht, was ihr Ziel ist, aber wir müssen ein Auge auf sie haben.",
1618,,*,Es ist offensichtlich jetzt am Wichtigsten alle Kräfte zu vereinen.,
1619,,KongMing,"Zusammenfassend, verstehe ich natürlich wie wichtig die Antiquität ist, aber ich kann dir leider nicht helfen.",
1620,,*,Ich verstehe... ich danke dir für dein Verständnis.,
1621,,KongMing,Aber du wirst dennoch dabei bleiben oder?,
1622,,*,"Ja, ich bin immer noch Senpai.",
1623,,KongMing,"Na gut, dann lass mich dir aber noch einen Satz mitgeben.",
1624,,*,Was?,
1625,,KongMing,Wenn du die anderen Mädels auch mitmachen lassen willst...,
1626,,KongMing,kannst du alle außer Iron Fist mitmachen lassen ... sie darfst du auf keinen Fall mitfahren lassen.,
1627,,*,Obwohl ich letztes Mal das vage Gefühl hatte…,
1628,,*,Iron Fist Körper scheint einfach übermüdet zu sein oder?,
1629,,KongMing,"Ah... es wird einen Tag geben, wo wir es dir sagen müssen.",
1630,,KongMing,Deshalb sollte ich es dir gleich sagen.,
1631,,KongMing,Im Körper von Iron Fist....,
1632,,*,！？,
1633,Entscheidung,*,……,
1634,,*,……,
1635,,*,(Verdammt... wie konnte das passieren...),
1636,,*,(Ist das nicht Iron Fist...),
1637,,???,Wuhuu~Senpai!,
1638,,???,"Huh...A-, Aquaris...!?",
1639,,*,Aua...!,
1640,,,Es fühlt sich an als ob mir jemand einen kräftigen Schlag auf den Rücken verpasst hat...,
1641,,*,"Hustend... Macht das nicht nochmal, das ist echt nervig! Ich dachte schon es wäre ein neuer Angriff der Chaos-Kreaturen....",
1642,,Aquaris,Du willst deine niedliche Mitschülerin wirklich mit einer Chaos-Kreatur vergleichen! Senpai du bist wirklich unhöflich!,
1643,,*,"Auch wieder wahr, da kann man in dieser Situation nur noch sagen, dass du noch bizarrer als die Chaos-Kreaturen bist.",
1644,,Iron Fist,"Senpai, alles okay bei dir?",
1645,,*,"Iron Fist, wo du auch da bist, hättest du sie stoppen können...",
1646,,Iron Fist,Das wollte ich natürlich... aber ich kam einfach zu spät...,
1647,,*,"Sagt, was treibt ihr beiden hier?",
1648,,Aquaris,"Senpai, du scheinst vergessen zu haben, dass ich auch schon lange Disziplinarkomitee Mitglied bin?",
1649,,Aquaris,"Ich bin natürlich hier, um die Sicherheit des Campus zu gewährleisten.",
1650,,*,"Wenn ich mir dich so anschaue, machst du kein bisschen den Eindruck, dass du arbeitest...",
1651,,Aquaris,Normalerweise konnten wir immer nur mit den Seniors üben.,
1652,,Aquaris,"Aber dank der Chaos-Kreaturen, kann ich nun ganz offen den ganzen Tag draußen Spaß haben.... ich mein, patroullieren.",
1653,,Iron Fist,"Also, warum habt ihr mich hierher geschleppt...?",
1654,,Aquaris,Ist was falsch? Es ist viel interessanter als trainieren!,
1655,,Iron Fist,Ha... wenn das als Training verstanden wird...habe ich nichts einzuwenden.,
1656,,Aquaris,"Iron Fist du bist wirklich ein Scherzkeks, du kannst ruhig zeigen, wenn du glücklich bist, du musst deine Emotionen nicht verstecken.",
1657,,Iron Fist,Hab ich doch gar nicht...,
1658,,*,（……）,
1659,,*,"(Ein Trupp, um die Antiquität zu finden, sollte ich sie dazu einladen?)",
1660,,*,"(Auf dem Weg könnten uns Gefahren, mit denen wir nicht gerechnet haben, begegnen...)",
1661,,*,(Kann ich sie wirklich dieser Gefahr aussetzen...?),
1662,,*,(Ich kann es einfach nicht...),
1663,,Iron Fist,"...? Senpai, was ist mit dir los?",
1664,,*,Ähm... Nichts.,
1665,,Aquaris,Also wirklich! Wie kannst du so ein Gesicht ziehen!,
1666,,Aquaris,"Komm, sei ein bisschen fröhlicher und lass uns zusammen Spaß haben, ich meine natürlich patroullieren!",
1667,,Joan,"Aquaris! Was tust du hier? Jetzt ist Patroullienzeit, los wieder ab in die Linie!",
1668,,Aquaris,Verdammt.... sie haben mich bemerkt... schnell weglaufen!,
1669,,*,Natürlich bist du aus dem Unterricht abgehauen!,
1670,,Iron Fist,Warum muss ich mit hinterherlaufen...?,
1671,,*,(... so ist es gut),
1672,,*,(Solange ihr auf dem Campus bleibt ist alles gut),
1673,,*,(Um alles andere werde ich mich kümmern...!),
1674,Entschlossenheit,,"——Zwei Tage später am Abend, Yume Wald",
1675,,,"Nach der Ausgangssperre ist der Campus relativ verlassen, nur die Disziplinarkomitee Mitglied patroullieren.",
1676,,,"Außerdem scheinen sich außerhalb des Campus einige Personen, die zu dieser Zeit offensichtlich nichts dort verloren hatten, zu treffen.",
1677,,Fenek,"Puh... Senpai ist echt langsam. Kann es sein, dass er echt nicht kommt?",
1678,,Anastasia,"... Egal, dann gehen wir eben selber.",
1679,,Turin,"Ah... es scheint, dass Jemand kommt. Ist das Senpai? Aber...",
1680,,Fenek,Ist er allein?,
1681,,Anastasia,Dieser Idiot...,
1682,,*,"Hi, entschuldigt die Verspätung~",
1683,,Fenek,"Das ""Hi"" war sehr dumm!",
1684,,Fenek,"Senpai, hast du etwa vergessen Verstärkung mitzubringen?",
1685,,*,Mhm... also über diese Sache... hab ich mir eigentlich sehr lang den Kopf zerbrochen...,
1686,,*,"Aber am Ende hab ich entschieden, dass diese Reise zu gefährlich ist.",
1687,,*,Unter welchen Umständen auch immer... ich kann sie nicht so einer Gefahr aussetzen.,
