id,name,name2,desc
1,Geister,Geister,"Haus der Mystikern, die Kraft von den alten Legenden absorbieren können. Egal wie sich die Welt verändert, bleiben sie im Schatten und strecken ihre Finger im richtigen Moment aus, um die Welt in ihre Richtung zu ziehen."
2,Menschen,Menschen,"Haus der Macher, die Kampfkünste schätzen und Ruhm begehren. Selbst der Schmutz dieser weiten Welt kann ihre Rechtschaffenheit nicht erschüttern."
3,Monster,Monster,"Gegründet von den Pionieren, die so frei wie der Wind sein wollen. Von Generation zu Generation hat das Haus „Monster“ den Geist der Erforschung von Alberta  überliefert und im Laufe der Zeit die Macht erlangt, die Welt zu verändern und unzählige geniale Kreationen zu schaffen."
4,Feen,Feen,"Haus für diejenigen, die immer auf der Suche nach Wissen sind. Das grüne Blatt im Hauswappen symbolisiert ""Ein Blatt, ein Bodhi"" und ermutigt die Mädchen, die große Wahrheit in den kleinsten Dingen zu suchen."
5,Dämonen,Dämonen,"Haus der Lästerer, die die Dunkelheit tragen. Der helle Mond im Hauswappen steht für das Licht in der Dunkelheit, das die böse geborenen Mädchen dazu anleitet, nicht ihrer Geburt zu erliegen und ihre Zukunft aus eigenem Willen zu wählen."
6,Engel,,"Haus der Heiligen, die im heiligen Licht geboren sind, ist der hellste Ort der Akademie. Die Heiligen blicken stets mit einer mitfühlenden Geste auf das Leid der Welt herab."
7,Meteore,Meteore,"Haus für diejenigen, die mit den Sternen ""in Resonanz"" getreten sind. Die Sterne funkeln auf dem Hauswappen, am Himmel und im vorderen Teil der Geschichte. Sie sind wegweisend für die Welt."
