id,name,dialog,click_dialog1,click_dialog2,click_dialog3,click_dialog4,click_dialog5,battle_dialog,skill_dialog,cv_name,love_gift_dialog1,love_gift_dialog2,love_gift_dialog3,vow_dialog,login_dialog,lvlup_dialog,gradeup_dialog,shengxue_dialog,awake_dialog,equip_dialog1,equip_dialog2,hangteam_dialog,house_set_dialog,house_dialog,idle_dialog,dagong_dialog,daily_mission_dialog,new_stage_dialog,victory_dialog,failed_dialog,love_point_dialog1,love_point_dialog2,love_point_dialog3,love_point_dialog4
51006,Fencer,"Fechten ist eine Kunst. Es ist nicht schwierig, eine Klinge zu verwenden. Aber dies ellegant und schnell zu tun ist etwas anders.","Talent, Anstrengung und Glaube. Wahre Fechter sollten diese Begriffe verstehen.",Fein und elegant. Fechten ist eine Kunst!,"Ich nehme deine Herausforderung an! Mir gefällt alles, dass schön und kraftvoll ist.",Es gibt viele starke Menschen. Deshalb muss ich die Messlatte hoch legen.,"Wir dürfen uns niemals zurückziehen, wir müssen dem Tod ins Auge sehen! Schande ist schlimmer als der Tod.",Greife im Namen der Ritter an!,Zieh dein Schwert!,Hikasa Yōko,Ernsthaft??? So denkst du also über meinen Geschmack?,Haha~Du bist doch nicht so langweilig~,"Hmm~Ich gebe zu, du hast es gut gemacht..... Hmph, D-danke!","Ich bin immer noch nicht stark genug, aber du vertraust mir. Ich bin wirklich glücklich~Ich werde mein Bestes geben und weiter trainieren... Neben dem Fechten könnte ich auch andere Dinge ausprobieren.","Hallo! Senpai, hast du heute Fechten geübt?",Ein Exp Getränk nach dem Training ist einfach super~,"Mehr Leute können beschützt werden, wenn ich schneller bin. Außerdem bin ich stärker!","Neben dem Training, sollte man auch beim Lernen alles geben!","Auch wenn ich noch kein vollständiger Ritter bin, weiß ich doch, dass ich auf dem richtigen Weg bin!",Eine hervorragende Ausrüstung ist ein wichtiger Teil von Stärke.,"Du scheinst dir viele Gedanken gemacht zu haben, um diese wahnsinns Ausrüstung auszuwählen, vielen Dank! Ich werde sie nicht verschwenden und sie gut nutzen!","Für Jemanden der jeden Tag hart trainiert, ist das nichts.",Das scheint klein schlechter Ort zu sein~,"Bist du gekommen, um mit mir über Schwerttechniken zu diskutieren?","Ich habe erst letztens neue Techniken gelernt, wenn du Zeit hast könne wir uns mal austauschen~",Es ist fast Zeit für die Arbeit. Bei festgelegten Zeiten sollte man sich nicht verspäten~,"Es gibt noch Aufgabenbelohnungen, die du nicht eingesammelt hast, du hast sie dir verdient.","Auf dem Campus ist etwas neues passiert, willst du nicht nachschauen gehen?",Das ist das Ergebnis täglichen harten Trainings~So beginnen wir das Training für heute!,"Schade~wenn ich noch ein bisschen stärker geworden bin, werde ich es wieder versuchen!",填充,填充,填充,填充
51007,Diana,"Hey hey, gib mir etwas Fleisch! Es ist nicht für mich, es ist für die Elefanten!... Äh? Elefanten sind Pflanzenfresser?",Lass mich sie platt stampfen!,Gemüse? Das brauchst du nicht! Ohne Fleisch kann man nicht stärker werden!,"Breche die Knochen, um Suppe zu machen ♪",Hey! Du solltest auch Fleisch essen! Es ist das köstlichste auf der Welt. Fleisch ist Gerechtigkeit!,"Ich bin nicht sicher, ob es irgendetwas auf der Erde gibt, das besser schmeckt als Fleisch!",Kampf um Fleisch!,Geh nach Hause!,Takeuchi Junko,Es ist weder essbar noch macht es Spaß!,Was ist das? Ist es essbar?,Fleisch steht für Gerechtigkeit! Endlich verstehst du es~,"Auf Jemanden zu treffen, mit dem ich zusammen esen kann, ist eine große Freude! Wenn ich auf Jemanden treffe, der sogar bereit ist für mich zu kochen, dann will ich mein ganzes Leben mit ihm verbringen!",Master! Du bist zurück! Ich will Fleisch essen,"Wenn es noch ein bisschen Fleisch dazu gibt, würde ich mich noch mehr freuen!","Wenn ich mich nächtes Mal noch ein bisschen mehr beeile, kann ich den letzten Bissen vor Quinie klauen!",Was? Den Abschluss machen? Gibt es dann eine neue Mensa?,"Wenn du noch stärker werden willst, darfst du auf keinen Fall weniger essen!","Vergiss nicht auch dem kleinen Drachen, den du mir gegeben hast, eine Ausrüstung zu besorgen~",Gutes Essen~So lässt es sich leben!,Warte bis ich zurück komme und lad mich dann auch zu einem leckeren Essen ein~,"Solange ich nicht mit Sonya zusammen wohnen muss, ist alles okay für mich.",Senpai! Hast du heute Fleisch mitgebracht?,"Senpai, wie geht es dir? Soll ich dich zurück bringen damit du dich ausruhen kannst?",Senpai! Du solltest zur Arbeit gehen~,Es scheint als hättest du die täglichen Aufgabenbelohnungen noch nicht eingesammelt~,Was ist auf dem Campus passiert... Ich denke ich werde erstmal was essen~,Ich war dabei ein Steak vor dem Kampf zu essen! Ihr habt euch die falsche Zeit ausgesucht!,Ah~ich bin so hungrig und habe gar keine Kraft…,填充,填充,填充,填充
51008,Sakura,"Ich bin wie eine Kirschblüte, mein Schwert ist zu deinen Diensten wie auch die Blütenblätter...",Kirschblüten fallen früher oder später. Alles schöne ist nicht für die Ewigkeit.,Sei nicht traurig. Der kurze Moment der Blüte ist der Schönste.,"Mein Schwert ist leicht... Genau wie die Kirschblüten im Wind... Es ist weich, aber kraftvoll. Es gibt nichts, was ich nicht schneiden kann.",Hast du es gesehen? Der Moment in dem die Blütenblätter fallen ist einfach magisch.,"Wenn ich die Schönheit der Kirschblüten sehe, frage ich mich... Sollten wir nicht versuchen, auf ähnliche Weise zu leben?",Lasse Blumen auf dem Schlachtfeld wachsen!,"Blumen, versiegel sie!",Haruse Natsumi,"Sorry, aber ich habe keine Ahnung, wie ich das verwenden soll...",Danke,"Ich wusste nicht, dass es so großartige Dinge gibt... Vielen Dank!","Vergiss nicht, die Kirschblüten werden auf keinen Fall auf dich warten, um für dich zu blühen.","Die Kirschblüten öffnen sich im Handumdrehen, Senpai. Genieße jeden Moment, den wir zusammen verbringen.","Das sind die täglichen Übungen, nichts womit man angeben könnte.",Ich werde weiter gut auf alles aufpassen.,"Bald ist es Zeit in eine höhere Klasse zu gehen, das heißt es ist auch bald Zeit für die Kirschblüte auf dem Campus, oder?","Die Leute warten so sehnsüchtig auf die Kirschblüte, weil sie schnell zu Boden fallen.","Mach dir keine Sorgen, eine leichte Schutzausrüstung reicht mir.","Die Metallausrüstung fühlt sich kalt an, aber ich verstehe, dass sie notwendig ist.","Ich verstehe, danke dir.",Das ist ein friedlicher Ort.,"Ich bin gerade auf dem Weg zum Training, als Senpai plötzlich kommt. Willst du mit mir gehen?","Das ist das erste Mal, dass ich Senpai so ruhig sehe, vielleicht sollte ich das mit diesem mentallenen Gerät aufnehmen?","Senpai, was sind die Pläne für heute? Wenn icht richtig liege, ist es bald Zeit für die Arbeit.","Senpai, du wirst doch etwa nicht wie beim letzten Mal die Aufgaben abgeschlossen haben, aber vergessen haben die Belohnungen einzusammeln?","Senpai, es scheint, dass bei den Krischbäumen etwas vorgefallen ist, lass uns schnell nachschauen gehen!","Obwohl es sehr brutal ist anderen das Leben zu nehmen, werde ich nicht zögern, wenn ich den Feinden gegenüberstehe.","Ziehen wir uns erstmal zurück, lasst uns nichts tun, was keinen Sinn macht.",填充,填充,填充,填充
51009,Giana,"Master, ich bin deine persönliche Tänzerin!",Dieser Tanz wird dir Gottes Segen bringen.,Eines Tages werde ich über allem stehen und die Menschen werden mir dienen.,"Der Tanz, zeigt allen die Schönheit der Harmonie!","Egal wo die Bühne ist, du wirst mich dort finden.",Der Sinn des Lebens...? Anderen Harmonie durch meinen Tanz zeigen.,Tanz zu einem Kampflied.,Tanze mit mir!,Chihara Minori,Mach das nie wieder! Du störst mich beim Tanzen!,"Bist du da, um mich tanzen zu sehen? Oh! Ein Geschenk? Danke","Vielen Dank für das Geschenk, Master. Im Gegenzug werde ich dir das Tanzen beibringen.","Mir ist nicht so wichtig, für wen ich tanze, aber wenn es möglich ist, hoffe ich bist du ab nun immer mit dabei~",Master! Du bist gekommen. Willst du mit mir tanzen,Deinen guten Willen werde ich nicht zurückweisen~,Ist meine Tanzhaltung noch graziler geworden?,"Abschluss ohne Probleme, das sollte gefeiert werden~","Egal ob mir viele zuschauen oder niemand, ich werde weiter tanzen.","Du kennst dich mit der passenden Tanzkleidung aus, oder?",So ein wundervolles Kostüm! Lass es mich jetzt anprobieren und dir etwas vortanzen~,Es freut mich dir zu dienen~,"Ist das mein Zimmer? Kann ich eins haben, wo ich nicht beim tanzen gestört werde~",Ich habe einen neuen Tanz entwickelt! Willst du ihn sehen?,"Du siehst sehr müde aus, willst du dich auf meiner Schulter eine Weile ausruhen?","Du solltest zur Arbeit gehen, ich kann eine Weile alleine hier bleiben~","Du hast die Aufgabenbelohnungen noch nicht eingesammelt, vergiss es nicht.",Ist etwas Neues auf dem Campus passiert?,"Es ist schon genug für mich zu wissen, dass ich den anderen helfen konnte.","Mach dir keine Sorgen, nächtes Mal können wir sicher gewinnen~",填充,填充,填充,填充
51010,Minos,"Oh! Es sieht so aus, als hättest du ein Geheimnis, das du nicht preisgeben willst. Du willst es mir nicht sagen? Wenn du mir nicht sagst, werde ich dich essen.",Sonne? Am besten geht die Sonne nicht auf. Lass uns die Welt in völlige Dunkelheit hüllen.,Wie umwerfend... Diese Art von Person hasse ich am meisten.,Wen werde ich heute genießen? Dieses Kind hier? Aber das dort sieht auch lecker aus...,Traurig. Wütend. Melancholie. Ich kann nicht mehr essen.,Kleine Schwester. Kommst du mit mir Spielen? Ich liebe dich so sehr.,"Sag mir, warum hast du Angst? Huh?",Lass die Dunkelheit... alles verschlingen!,Tanaka Takako,"Willst du, dass ich dich aufesse?",Ich habe meine Appetit heute verloren!,Ich kann die Dunkelheit riechen~Ich liebe es!,"Ich muss zugeben, dass ich gerne Zeit mit dir verbringe... Möchtest du den nächsten Schritt in unserer Beziehung machen? Hmmm, mit dir bin ich einverstanden~","Wir treffen uns wieder, Mensch. Warum stehst du da noch?...",Das schmeckt gar nicht so schlecht~,"Die dunkle Macht ist stärker geworden, das fühlt sich gut an.",In der nächsten Klasse sehen alle gleich viel appetitlicher aus~,"Je stärker die Emotionen der Menschen sind, desto stärker wird meine dunkle Macht~",Meine dunkle Macht und die Lichtmacht der anderen sind eigentlich gar nicht so unterschiedlich.,Natürlich weißt du welche Ausrüstung mir gefällt.,Wen werde ich wohl heute fressen~,Gibt es keinen dunkleren Ort? Das Licht stört mich.,Willkommen zurück~,"Er gibt keinerlei Regung von sich... das muss daran liegen, dass er schläft.","Mensch, vergiss nicht, dass du arbeiten musst~","Wenn du deine Belohnungen nicht einsammelst, werde ich das für dich tun~","Ich bin nicht daran interessiert, was auf dem Campus passiert ist——aber wenn ich du wäre würde ich mal schauen gehen.",Ich will euch weiter zittern sehen!,Ah~Das glitzert zu sehr für mich…,填充,填充,填充,填充
52001,Hottie,"Hallo Master. Abends, wenn ich hier bin, wirst du nie mehr allein sein.","Mein Schatz, willst du essen? Ein Bad nehmen? Oder etwas süßes?",Ich könnte alles für dich tun.,"Du musst nicht so tun, als ob du es ernst meinst, wenn du mit mir zusammen bist. Ich weiß ALLES über dich.","Willst du mit mir spielen? Ich bin sicher, ich könnte dich zufrieden stellen!",Um dich glücklich zu machen? Ich würde ALLES akzeptieren~,Liebe mich!,"Oh, mir ist heiß~",Nakae Mitsuki,Was hast du? Das sieht nicht nach dir aus~,"Geschenke sind nie zu klein, danke~",Vielleicht... sollte ich mich dir als Gegenleistung anbieten?,"Wir haben noch nie groß Worte gebraucht, um zu kommunizieren. Komm näher...","Ich habe lange auf dich gewartet, Meister. Was sollen wir heute tun?","Mua~ein Kuss für ein Getränk, oder ist einer nicht genug? Haha~",Was starrst du mich so an? Ich bin sehr schüchtern~,"Du lernst nicht genug, soll ich dir Privatstunden geben?","Ich habe einen weiteren Schritt zum erwachsenwerden getan, Yay~","Es ist eine seltenen Möglichkeit, vielleicht sollte ich etwas besondereres tragen?","Diese Kleidung sieht echt schön aus~oder gefalle ich dir besser, wenn ich nichts trage?","Es ist selten, dass du bei mir bist, lass uns ein bisschen Spaß haben~",Dieser Ort ist echt nicht schlecht~,"Wie kannst du mich so lange allein lassen, da bin ich doch ganz einsam~","Es gefällt mir so sehr dich mit geschlossenen Augen, völlig unvorbereitet zu sehen...","Senpai, wie wäre es wenn du heute einfach bei mir bleibst anstatt zur Arbeit zu gehen... Ich mach nur Spaß, schnell geh~",Vergiss deine Aufgabenbelohnungen nicht~,"Auf dem Campus scheint etwas passiert zu sein, wollen wir zusammen nachschauen gehen~",Ah~ist das alles~,Stop! Das wird morgen echt weh tun~,填充,填充,填充,填充
52002,Aurora,"Ernsthaft? Mein Haar ist noch nicht trocken~Wenn du mich nicht gut behandelst, werde ich dir nicht vergeben.","Da du mein Master bist, musst du dich besser anziehen! Sei nicht so faul. Du solltest mehr auf deine Haare achten!",Dieser Föhn wird alle deine Probleme wegblasen ~,"Willkommen~Lass mich dir helfen, deinen Rücken zu waschen~",Soll ich ein Rosenbad oder ein Lilienbad nehmen~? Welches ist besser?,"Hehe~Ich habe Hunderte von Schlachten geschlagen, glaubst du mir nicht? Möchtest du es versuchen?","Okay! Ich werde dir helfen, deine Haare zu trocknen~",Wooaaa~,Tomatsu Haruka,Ich hasse dieses Ding... Ich will das wirklich nicht~,Ich akzeptiere~Aber lass mich das nächste Mal nicht im Stich~,"Du hast mich nicht im Stich gelassen~Lass mich darüber nachdenken, wie ich dich belohnen kann~","Ab heute kannst du meinen Rücken massieren, ist das nicht super~","Hey, willst du mit mir Baden gehen?","Ein eisgekühltes Getränk nach dem Baden, einfach himmlisch~","Beim Baden kann man stärker werden! Blubber Bad, Seifen Bad, Hot Springs... danach fühlt man sich jedes Mal wie ein neuer Mensch~","Natürlich ist lernen wichtig, aber man kann das auch nicht den ganzen Tag tun. Pausen sind auch wichtig. Komm und bade mit mir~","Ich habe einen neuen und besseren Föhn, willst du ihn mal probieren~","Kleidung, sollte vor allem gemütlich sein~","Diese Kleidung scheint man leicht ausziehen zu können. Sie ist bestimmt praktisch, wenn man baden gehen will.",Wie wäre es mit einem gemeinsamen Bad vor der Arbeit?,Ist es nicht ein bisschen eng für eine Badewanne hier?,"Master, wie geht es dir~",Du musst müde in letzter Zeit sein~ruh dich gut aus,Solltest du nicht zur Arbeit gehen~,"Es gibt noch Aufgabenbelohnungen, die du noch nicht eingesammelt hast~",Es scheint etwas Neues vorgefallen zu sein~ich hoffe du bist nicht zu müde~,Großer Profit~Hahaha!,Ah~Vor dem nächsten Kampf muss ich mal eine Dusche nehmen~,填充,填充,填充,填充
52003,Chevalier,"Wenn du mich besiegen kannst, werde ich dich Master nennen. Möchtest du es versuchen?","Selbst wenn ich einäugig bin, werde ich nicht gegen dich verlieren~","Es ist gut zu wissen, wie man seine Sprache benutzt. Die Männer in meinem Haus wissen nur, wie man ihre Hände benutzt~","Provozierst du mich Haha~Ich habe seit langer Zeit niemanden gesehen, der so selbstmordgefährdet ist ~","Oh~Du bist direkt, ich mag Leute wie dich~",Siehst du den Wolf? Genau den! Den Schaffe ich mit links!,Willst du das ich dich in Stücke schneide!,Angriff!,Yoshida Seiko,Das ist nicht dein Ernst oder?,"Oh, danke!","Ich wusste nicht, dass du mich so gut kennst~","Ich möchte mit dir in den Sonnenuntergang reiten... diese Kleidung zu tragen und so zu reden ist ein bisschen komisch oder, Haha, aber ich bin mir sicher es macht dir nichts aus","Senpai, geh nicht! Meine Faust juckt. Trainiere mit mir!","Was für ein exquisites Getränk! Vielen Dank, Master!","Seit ich mit Senpai zusammen bin, habe ich das Gefühl stärker geworden zu sein. Das ist alles seine Arbeit!","Das mit dem Lernen habe ich noch nicht so ganz verstanden. Ich werde dich weiter viel um Rat fragen, Master!","Ob ich stärker werde ist mir nicht so wichtig. Solange ich frei bin, bin ich schon zufrieden.",Kleider machen Leute~,"Du hast dich soviel um mich gekümmert in letzter Zeit, Master. Bitte aktzeptiere dieses Geschenk~",Willst du zusammen mit mir ausreiten?,"Dieses Zimmer ist ein bisschen klein, ich weiß nicht, ob mein Pferd hier rein passt...",Willkommen zurück!,"Der Master sieht so friedlich aus, wenn er schläft... Ah! Während ich sein schlafendes Gesicht betrachte, habe ich mich ihm unbewusst genährt, es hat hoffentlich niemand gemerkt...","Master, kommst du etwa zu spät zur Arbeit? Steh schnell auf, ich bringe dich!",Du solltest deine Belohnungen nicht vergessen!,Wo ist etwas auf dem Campus passiert? Ich mache mich sofort auf den Weg!,Zu gewinnen fühlt sich wirklich gut an!,"Ah, das tut weh, nächstes Mal sollten wir einen weiten Bogen schlagen.",填充,填充,填充,填充
52004,Historia,"Hallo, ich habe gehört, dass du nett bist. Wir brauchen Leute wie dich in meiner Akademie. Möchtest du uns nicht helfen?",Recht und Ordnung werden von den Starken geschaffen. Also bin ich das Gesetz.,"Egal welche Taktik du anwendest, du wirst verlieren!",Geschichte wird von den Gewinnern geschrieben. Die Schwachen haben kein Recht auf eine.,Ich will nur Ordnung halten. Ich möchte die Mächtigste in der Schule sein!,"Ich mag keine Dinge, die ich nicht kontrollieren kann. Um alles kontrollieren zu können, muss ich die Mächtigste werden.",Ich kontrolliere mein eigenes Schicksal.,Geh mir aus dem Weg!,Tanaka Rie,Es ist nutzlos.,"Ich muss zugeben, es ist ein freundlicher Austausch im Rahmen der Regeln.","Ich muss zugeben, ich mag dieses Geschenk sehr. Vielleicht solltest du mich auf diesem Abenteuer begleiten?","Ein Eid? Ich habe schon Ja gesagt. Du hast es einfach nicht gemerkt... Nun, das ist nur ein Teil der Regeln.",Willst du mit mir die Welt erobern? Großartig!,Wieso gibt es nur so wenig! Das ist doch niemals genug!,"Ich habe neue Energie, kann ich damit etwas machen?","Unter meiner Herrschaft wird zu wenig Wissen nicht geduldet. Als meine rechte Hand, kannst du nicht faulenzen!","Wer keine Kraft hat über Ehrgeiz zu sprechen, ist nur ein Idiot, der über schwache Träume spricht. Ich bin anders als diese!","Gib alle Ausrüstung mir, ich werde sie in bester Weise nutzen!",Eine tolle Ausrüstung! Es kann mir bei meiner Herrschaft behilflich sein~,Hören sie alle auf mich?,"Der Ort sieht so aus, als würde er sich als Anführer Quartier anbieten.",Willst du beim Kampftreffen zuhören?,"Ah, und schon schläfst du... wirklich unhöflich... Wechsel wenigsten deine Kleidung vorher...","Vergiss nicht, dass du arbeiten musst!",Vergiss nicht deine Aufgabenbelohnung einzusammeln!,"Geh zum Campus und schau was passiert ist, wenn du zurück bist erstatte mir Bericht.","Pff, verschwindet ihr Feiglinge! Dieses Schlachtfeld ist nicht passend für euch!",Meine Herrschaft wird hier nicht aufhören…,填充,填充,填充,填充
52005,Javelin,Ich bin ein Javelin und ich werde das Böse zerstören!,Töte den Dämon!,Ich muss alle Hindernisse zerstören!,"Ich gehe dorthin, wohin mich mein Weg führt!","Es ist mir egal, wie viele Truppen sie haben, sie können mich nicht aufhalten!","Ich brauche kein Pferd, ich habe schon meinen Speer und mein Schwert!",Ich bin Javelin,Angriff!,Park Romi,Nerv mich nicht damit!,Ich werde damit meinen eigenen Weg in die Zukunft gehen.,Dein Geschenk bringt wahrlich Frieden in mir~Danke~,"Ich schwöre, dass ich ab heute dein starkes Messer und dein schützendes Schild bin, bis zum Tod!","Master, wenn ich dich sehe, geht es mir gleich viel besser.",Tausend Dank~,"Danke, ich werde dich nicht enttäuschen!","Besser zu werden ist ein nicht endender Weg. Egal ob Kraft oder Intelligenz, beide sind gleich wichtig. Es gibt noch einen weiten Weg zu gehen.",Jedes Mal wenn ich mit Senpai zusammen bin kann ich so viel lernen.,"Egal wann, man sollte immer seine Eleganz bewahren~",Ich bin dir so dankbar für diese Ausrüstung~,Wo willst du heute hin? Ich folge dir~,Dein Zimmer ist so elegant~,Es war ein langer Tag~,"Du kannst hier nicht schlafen... Komm, lehn dich an mich an, ich bringe dich nach Hause...","Du solltest zur Arbeit gehen, lass mich mit dir gehen.","Es gibt Belohnungen, die noch nicht eingesammelt sind.","Es ist etwas auf dem Campus passiert, nimm mich mit, ich beschütze dich.","Gewonnen, nicht schlecht, aber auch nichts womit man angeben kann",Ich muss noch weiter trainieren…,填充,填充,填充,填充
52006,Geisha,Ah? Ich bin an der Reihe? Hetze mich nicht so. Ich bin noch nicht bereit!,"Die Leute erinnern sich nicht daran, was sie bekommen haben, sondern daran, was sie nicht bekommen haben.","Prinz Charming's Charme liegt nicht daran, dass er Prinz ist oder das er auf einem weißen Pferd sitzt, sondern an im SELBST.",Das wichtigste an einer Person kann mit dem bloßem Auge nicht gesehen werden. Den es ist im Inneren verborgen!,"Männer sind Kreaturen, die ihren Partner basierend auf deren Aussehen auswählen",Liebe kann nicht kontrolliert werden.,Bitte sei vorsichtig.,Wiedergeburt des Lebens...,Hanazawa Kana,"Versuchst du mich zu verspotten, indem du mir das gibst?","Danke, Master~","Du bist so schlau, Master... Ich kann dieser Versuchung nicht widerstehen... Du solltest verantwortungsbewusster sein~","Du solltest glücklich sein, dass du mein Herz gewinnen konntest!",Wird Senpai heute ein guter oder ein schlechter Mensch sein? Hahaha!,Ich nehme nur ein bisschen von deinem Exp Getränk.,"Bin ich noch schöner geworden! Nein?... Pff, wie kann ein Mensch wie du das verstehen?","Puh, Lernen macht einem echt Kopfschmerzen~wie wäre es, wenn du mir hilfst.","Gib zu, dass du dich von mir angezogen fühlst? Hahah~","Schnell hilf mir mit dem Reißverschluss~Endlich habe ich es an bekommen... habe ich etwa zugenommen??? Nein, das kann nicht sein~Die Kleidung muss zu klein sein!",Nur so eine Kleidung wird meiner Schönheit gerecht!,"Du musst wissen, es ist wundervoll mit mir zusammen spazieren zu gehen~","Huch, warum gehen alle nach draußen, wenn ich reinkomme??","Endlich bist du zurück! Wenn du nicht da bist, kann ich mit niemandem reden!","Hör auf zu schlafen, willst du denn gar nicht wissen, wie der Musikwettkampf vor zwei Tagen war?",Arbeiten! Arbeiten! Vergiss es nicht!,"Die Aufgabenbelohnungen kannst du auch gleich noch einsammeln, red erst noch ein bisschen mit mir~",Was ist das für ein Krach auf dem Campus?,"Pff, gebt euren Widerstand auf! Ich habt keine Chance gegen meine Schönheit!",Wie könnt ihr nur eure Hände gegen so eine Schönheit wie mich erheben…,填充,填充,填充,填充
52007,Sonya,"Hallo! Der Master ist hier, lass es mich tun! Sonst können meine beiden Schwestern es nicht sehen!",Angriff! Angriff! Angriff! Ich werde den Feind vernichten!,"Ich bin es leid, in Theorie und mit Argumenten zu sprechen! Wer kümmert sich um solche verbalen Müll.","Warum reden, wenn man kämpfen kann? Kämpfe! Und danach reden wir!",Essen! Essen! Es schmeckt wie der Himmel! Dieses ist auch gut! Und das hier erst! Essen ist so guuut!,"Ich bin Sonya die Mächtige! Und das hier ist mein Gebiet, schreib dir das hinter deine Ohren!",Mach sie fertig!,Ich bin wütend!,Kobayashi Yū,Ich brauche das nicht!,"Oh, danke sehr!","Aha, es ist eine Weile her, das ich so etwas leckeres gegessen habe! Das ruft Erinnerungen hervor!","Ähm, ich bin nicht gut darin über Gefühle zu sprechen, deshalb red du auch nicht davon... nimm einfach meine Hand...",Hey! Ist das nicht der Master! Morgen!,Ist das für mich?,"Meine Faust scheint mehr Kraft zu haben! Ich würde es am liebsten gleich ausprobieren... Master, wovor läufst du davon?",Wie kann dieses Buch immer noch nicht zuende sein! Jeden Tag im Klassenraum ist einfach so langweilig!,"Es gibt nichts, was meine Faust nicht lösen könnte! Du glaubst mir nicht? Willst du mal eine meiner Fäuste probieren?","Danke, Senpai! Nächstes Mal, wenn du in die Mensa kommst, lade ich dich ein!","Wenn ich das trage, werde ich beim nächsten Kampf sicher nicht verlieren!","Ich gehe spazieren, willst du mit mir kommen Master?",Dieses Zimmer ist so gemütlich! Ich will mich ein wenig hinlegen~,"Du kommst gerade richtig, ich wollte gerade kochen!","Ah, warum zeigst du keinerlei Regung, bist du etwa vor Hunger in Ohnmacht gefallen?",Geh schon zur Arbeit!,Aufgabenbelohnungen! Die solltest du nicht verschwenden!,Ist auf dem Campus schon wieder etwas vorgefallen? Nimm mich mit!,Wer traut sich noch?!,Wieso sind sie nur so stark~,填充,填充,填充,填充
