id,name,dialog,click_dialog1,click_dialog2,click_dialog3,click_dialog4,click_dialog5,battle_dialog,skill_dialog,cv_name,love_gift_dialog1,love_gift_dialog2,love_gift_dialog3,vow_dialog,login_dialog,lvlup_dialog,gradeup_dialog,shengxue_dialog,awake_dialog,equip_dialog1,equip_dialog2,hangteam_dialog,house_set_dialog,house_dialog,idle_dialog,dagong_dialog,daily_mission_dialog,new_stage_dialog,victory_dialog,failed_dialog,love_point_dialog1,love_point_dialog2,love_point_dialog3,love_point_dialog4
651003,Dracula,"Dein Blut... Es schmeckt gut. Du darfst in meinem Schloss bleiben, nur im Austausch vom Blut natürlich.","Mensch, dein Blut gehört mir!","Aus dem Weg. Wenn ich meine Beute verliere, stirbst du.",Sonnenstrahlen und ein Kreuz? Was für eine niedere Kreatur denkst du bin ich?,Komm heute Abend in mein Zimmer und gib mir dein Blut.,Wie alt denkst du bin ich?,Willst du sterben?,Willst du auch ein Vampir werden?,Horie Yui,"Menschen sind langweilig, nutzlos und uninteressant!","Hey! Du bist gar nicht so langweilig, Mensch!","Auch wenn ich Blut bevorzuge, ist das, was du mir hier gibst, nicht schlecht~Ich gratuliere dir.","Ich habe mich nur gefragt, wann du dieses Thema ansprechen wirst... Bist du nicht glücklich? Mach dir keine Sorgen, ich werde für immer an deiner Seite bleiben~","Ha! Mensch, gib mir einen ordentlichen Gruß!",Ab und zu ist es nicht so schlecht etwas normales zu trinken~,"Meine Energie hat zugenommen~Dein Blut ist gar nicht mal so schlecht, Mensch~","Eine Klasse überspringen? Für mich ist das nicht so wichtig, aber wenn ich dein fröhliches Gesicht sehe, kann es nicht so schlecht sein.","Zeige mir deine Loyalität, dann werde ich dir weiter meine Kräfte zur Verfügung stellen!","Wir Vampire brauchen nicht so eine nutzlose Ausrüstung, aber da du sie mir gegeben hast, werde ich sie dennoch tragen~","Diese Ausrüstung scheint selten zu sein~Mensch, du hast deine Loyalität bewiesen~","Ich gehe spazieren. Bleib hier stehen, ich erlaube dir nicht, wegzugehen!","Verglichen mit meinem Schloss, ist das hier so klein, dass man sich noch nichtmal umdrehen kann!","Hey, du lässt mich hier einfach in diesem winzigen Zimmer, was soll das bedeuten!","Wie langweilig, denk dir schnell etwas aus, was mich fröhlich macht!","Komm etwas früher von der Arbeit nach Hause, wage es nicht mich zu lange warten zu lassen!",Sammel deine Aufgabenbelohnungen ein~,"So ein Krach! Geh mal nachschauen, was auf dem Campus passiert ist~",Das war einfach~,"Ah, wie konnte es dazu kommen~",填充,填充,填充,填充
651004,Wu Kong,Ich bin kein einfacher Affe! Ich bin die Königin der Affen Wu Kong! Du solltest dich an mich erinnern!,Wu Kong ist da! Es ist Zeit für dich auf die Knie zu gehen!,"Die Göttin der Pfirsiche? Ha, das ist nur ein gewöhnlicher Pfirsich~",Kommt und schaut!.... Wer kommt da?,Die Königin der Affen ist da!,"Ich bin unbesiegbar! Ich bin mächtig, so mächtig das ich die Welt zerstören kann! Wow! Ein Pfirsich! Hey! Ich bin nicht so einfach zu überreden! Soll ich jemanden töten?",Reife Retro-Satanas!,Nimm das!,Kawanishi Mai,Ich mag es nicht!,Ich mag Pfirsiche lieber..,"Ich habe dir gesagt, wenn es kein Pfirsich ist, will ich es nicht... Ah, warte! So etwas habe ich noch nie gesehen. Danke dir~du bist wirklich ein interessanter Mensch!","Ich hätte nicht gedacht, dass ich eines Tages mit einem Sterblichen zusammen sein würde~aber für Senpai habe ich tiefe Gefühle!",Senpai! Senpai! Du bist zurück! Hast du mir Pfirsiche gebracht?,"Wenn es Exp Saft gibt, gibt es dann auch Exp Pfirsiche?","Senpai! Schau, mein Glodreifen ist größer geworden!",Ist es auch möglich mehr Pfirsische zu bekommen? Jeden Tag einen - oder sogar nur ein halber mehr wäre schön!,"Senpai, ich bin dem Titel des Affenkönigs einen Schritt näher gekomnmen, oder?","Danke Senpai! Wenn du das nächste Mal noch einige Pfirsiche mitbringen könntest, wäre ich dir noch dankbarer~",So eine Ausrüstung passt zu meinem goldenen Armreifen!,Du willst einen Ausflug machen? Lass uns gehen~,"Es ist echt nicht schlecht hier, es erinnert mich an Zuhause!",Senpai! Du bist gekommen!,"Hey, hör auch zu schlafen! Die Sonne scheint, lass uns einen Ausflug machen!","Senpai, musst du arbeiten?",Senpai! Hast du deine täglichen Aufgaben abgeschlossen?,Auf dem Campus scheint etwas interessantes passiert zu sein! Lass uns schnell gehen und nachschauen!,Hoho! Kein Dämon traut sich sich mir in den Weg zu stellen!,"Ah~ich gebe zu, du bist stärker~",填充,填充,填充,填充
651005,Diana,"Hey hey, gib mir etwas Fleisch! Es ist nicht für mich, es ist für die Elefanten!... Äh? Elefanten sind Pflanzenfresser?",Lass mich sie platt stampfen!,Gemüse? Das brauchst du nicht! Ohne Fleisch kann man nicht stärker werden!,"Breche die Knochen, um Suppe zu machen ♪",Hey! Du solltest auch Fleisch essen! Es ist das köstlichste auf der Welt. Fleisch ist Gerechtigkeit!,"Ich bin nicht sicher, ob es irgendetwas auf der Erde gibt, das besser schmeckt als Fleisch!",Kampf um Fleisch!,Geh nach Hause!,Takeuchi Junko,Es ist weder essbar noch macht es Spaß!,Was ist das? Ist es essbar?,Fleisch steht für Gerechtigkeit! Endlich verstehst du es~,"Auf Jemanden zu treffen, mit dem ich zusammen esen kann, ist eine große Freude! Wenn ich auf Jemanden treffe, der sogar bereit ist für mich zu kochen, dann will ich mein ganzes Leben mit ihm verbringen!",Master! Du bist zurück! Ich will Fleisch essen,"Wenn es noch ein bisschen Fleisch dazu gibt, würde ich mich noch mehr freuen!","Wenn ich mich nächtes Mal noch ein bisschen mehr beeile, kann ich den letzten Bissen vor Quinie klauen!",Was? Den Abschluss machen? Gibt es dann eine neue Mensa?,"Wenn du noch stärker werden willst, darfst du auf keinen Fall weniger essen!","Vergiss nicht auch dem kleinen Drachen, den du mir gegeben hast, eine Ausrüstung zu besorgen~",Gutes Essen~So lässt es sich leben!,Warte bis ich zurück komme und lad mich dann auch zu einem leckeren Essen ein~,"Solange ich nicht mit Sonya zusammen wohnen muss, ist alles okay für mich.",Senpai! Hast du heute Fleisch mitgebracht?,"Senpai, wie geht es dir? Soll ich dich zurück bringen damit du dich ausruhen kannst?",Senpai! Du solltest zur Arbeit gehen~,Es scheint als hättest du die täglichen Aufgabenbelohnungen noch nicht eingesammelt~,Was ist auf dem Campus passiert... Ich denke ich werde erstmal was essen~,Ich war dabei ein Steak vor dem Kampf zu essen! Ihr habt euch die falsche Zeit ausgesucht!,Ah~ich bin so hungrig und habe gar keine Kraft…,填充,填充,填充,填充
651006,Giana,"Master, ich bin deine persönliche Tänzerin!",Dieser Tanz wird dir Gottes Segen bringen.,Eines Tages werde ich über allem stehen und die Menschen werden mir dienen.,"Der Tanz, zeigt allen die Schönheit der Harmonie!","Egal wo die Bühne ist, du wirst mich dort finden.",Der Sinn des Lebens...? Anderen Harmonie durch meinen Tanz zeigen.,Tanz zu einem Kampflied.,Tanze mit mir!,Chihara Minori,Mach das nie wieder! Du störst mich beim Tanzen!,"Bist du da, um mich tanzen zu sehen? Oh! Ein Geschenk? Danke","Vielen Dank für das Geschenk, Master. Im Gegenzug werde ich dir das Tanzen beibringen.","Mir ist nicht so wichtig, für wen ich tanze, aber wenn es möglich ist, hoffe ich bist du ab nun immer mit dabei~",Master! Du bist gekommen. Willst du mit mir tanzen,Deinen guten Willen werde ich nicht zurückweisen~,Ist meine Tanzhaltung noch graziler geworden?,"Abschluss ohne Probleme, das sollte gefeiert werden~","Egal ob mir viele zuschauen oder niemand, ich werde weiter tanzen.","Du kennst dich mit der passenden Tanzkleidung aus, oder?",So ein wundervolles Kostüm! Lass es mich jetzt anprobieren und dir etwas vortanzen~,Es freut mich dir zu dienen~,"Ist das mein Zimmer? Kann ich eins haben, wo ich nicht beim tanzen gestört werde~",Ich habe einen neuen Tanz entwickelt! Willst du ihn sehen?,"Du siehst sehr müde aus, willst du dich auf meiner Schulter eine Weile ausruhen?","Du solltest zur Arbeit gehen, ich kann eine Weile alleine hier bleiben~","Du hast die Aufgabenbelohnungen noch nicht eingesammelt, vergiss es nicht.",Ist etwas Neues auf dem Campus passiert?,"Es ist schon genug für mich zu wissen, dass ich den anderen helfen konnte.","Mach dir keine Sorgen, nächtes Mal können wir sicher gewinnen~",填充,填充,填充,填充
651007,Chevalier,"Wenn du mich besiegen kannst, werde ich dich Master nennen. Möchtest du es versuchen?","Selbst wenn ich einäugig bin, werde ich nicht gegen dich verlieren~","Es ist gut zu wissen, wie man seine Sprache benutzt. Die Männer in meinem Haus wissen nur, wie man ihre Hände benutzt~","Provozierst du mich Haha~Ich habe seit langer Zeit niemanden gesehen, der so selbstmordgefährdet ist~","Oh~Du bist direkt, ich mag Leute wie dich~",Siehst du den Wolf? Genau den! Den Schaffe ich mit links!,Willst du das ich dich in Stücke schneide!,Angriff!,Yoshida Seiko,Das ist nicht dein Ernst oder?,"Oh, danke!","Ich wusste nicht, dass du mich so gut kennst~","Ich möchte mit dir in den Sonnenuntergang reiten... diese Kleidung zu tragen und so zu reden ist ein bisschen komisch oder, Haha, aber ich bin mir sicher es macht dir nichts aus","Senpai, geh nicht! Meine Faust juckt. Trainiere mit mir!","Was für ein exquisites Getränk! Vielen Dank, Master!","Seit ich mit Senpai zusammen bin, habe ich das Gefühl stärker geworden zu sein. Das ist alles seine Arbeit!","Das mit dem Lernen habe ich noch nicht so ganz verstanden. Ich werde dich weiter viel um Rat fragen, Master!","Ob ich stärker werde ist mir nicht so wichtig. Solange ich frei bin, bin ich schon zufrieden.",Kleider machen Leute~,"Du hast dich soviel um mich gekümmert in letzter Zeit, Master. Bitte aktzeptiere dieses Geschenk~",Willst du zusammen mit mir ausreiten?,"Dieses Zimmer ist ein bisschen klein, ich weiß nicht, ob mein Pferd hier rein passt...",Willkommen zurück!,"Der Master sieht so friedlich aus, wenn er schläft... Ah! Während ich sein schlafendes Gesicht betrachte, habe ich mich ihm unbewusst genährt, es hat hoffentlich niemand gemerkt...","Master, kommst du etwa zu spät zur Arbeit? Steh schnell auf, ich bringe dich!",Du solltest deine Belohnungen nicht vergessen!,Wo ist etwas auf dem Campus passiert? Ich mache mich sofort auf den Weg!,Zu gewinnen fühlt sich wirklich gut an!,"Ah, das tut weh, nächstes Mal sollten wir einen weiten Bogen schlagen.",填充,填充,填充,填充
651008,Javelin,Ich bin ein Javelin und ich werde das Böse zerstören!,Töte den Dämon!,Ich muss alle Hindernisse zerstören!,"Ich gehe dorthin, wohin mich mein Weg führt!","Es ist mir egal, wie viele Truppen sie haben, sie können mich nicht aufhalten!","Ich brauche kein Pferd, ich habe schon meinen Speer und mein Schwert!",Ich bin Javelin,Angriff!,Park Romi,Nerv mich nicht damit!,Ich werde damit meinen eigenen Weg in die Zukunft gehen.,Dein Geschenk bringt wahrlich Frieden in mir~Danke~,"Ich schwöre, dass ich ab heute dein starkes Messer und dein schützendes Schild werde, bis zum Tod!","Master, wenn ich dich sehe, geht es mir gleich viel besser.",Tausend Dank~,"Danke, ich werde dich nicht enttäuschen!","Besser zu werden ist ein nicht endender Weg. Egal ob Kraft oder Intelligenz, beide sind gleich wichtig. Es gibt noch einen weiten Weg zu gehen.",Jedes Mal wenn ich mit Senpai zusammen bin kann ich so viel lernen.,"Egal wann, man sollte immer seine Eleganz bewahren~",Ich bin dir so dankbar für diese Ausrüstung~,Wo willst du heute hin? Ich folge dir~,Dein Zimmer ist so elegant~,Es war ein langer Tag~,"Du kannst hier nicht schlafen... Komm, lehn dich an mich an, ich bringe dich nach Hause...","Du solltest zur Arbeit gehen, lass mich mit dir gehen.","Es gibt Belohnungen, die noch nicht eingesammelt sind.","Es ist etwas auf dem Campus passiert, nimm mich mit, ich beschütze dich.","Gewonnen, nicht schlecht, aber auch nichts womit man angeben kann",Ich muss noch weiter trainieren…,填充,填充,填充,填充
651009,Geisha,Ah? Ich bin an der Reihe? Hetze mich nicht so. Ich bin noch nicht bereit!,"Die Leute erinnern sich nicht daran, was sie bekommen haben, sondern daran, was sie nicht bekommen haben.","Prinz Charming's Charme liegt nicht daran, dass er Prinz ist oder das er auf einem weißen Pferd sitzt, sondern an im SELBST.",Das wichtigste an einer Person kann mit dem bloßem Auge nicht gesehen werden. Den es ist im Inneren verborgen!,"Männer sind Kreaturen, die ihren Partner basierend auf deren Aussehen auswählen",Liebe kann nicht kontrolliert werden.,Bitte sei vorsichtig.,Wiedergeburt des Lebens...,Hanazawa Kana,"Versuchst du mich zu verspotten, indem du mir das gibst?","Danke, Master~","Du bist so schlau, Master... Ich kann dieser Versuchung nicht widerstehen... Du solltest verantwortungsbewusster sein~","Du solltest glücklich sein, dass du mein Herz gewinnen konntest!",Wird Senpai heute ein guter oder ein schlechter Mensch sein? Hahaha!,Ich nehme nur ein bisschen von deinem Exp Getränk.,"Bin ich noch schöner geworden! Nein?... Pff, wie kann ein Mensch wie du das verstehen?","Puh, Lernen macht einem echt Kopfschmerzen~wie wäre es, wenn du mir hilfst.","Gib zu, dass du dich von mir angezogen fühlst? Hahah~","Schnell hilf mir mit dem Reißverschluss~Endlich habe ich es anbekommen... habe ich etwa zugenommen??? Nein, das kann nicht sein~Die Kleidung muss zu klein sein!",Nur so eine Kleidung wird meiner Schönheit gerecht!,"Du musst wissen, es ist wundervoll mit mir zusammen spazieren zu gehen~","Huch, warum gehen alle nach draußen, wenn ich reinkomme??","Endlich bist du zurück! Wenn du nicht da bist, kann ich mit niemandem reden!","Hör auf zu schlafen, willst du denn gar nicht wissen, wie der Musikwettkampf vorgestern war?",Arbeiten! Arbeiten! Vergiss es nicht!,"Die Aufgabenbelohnungen kannst du auch gleich noch einsammeln, red erst noch ein bisschen mit mir~",Was ist das für ein Krach auf dem Campus?,"Pff, gebt euren Widerstand auf! Ich habt keine Chance gegen meine Schönheit!",Wie könnt ihr nur eure Hände gegen so eine Schönheit wie mich erheben…,填充,填充,填充,填充
651010,Misty,"Master, ich bin wirklich einfach zufrieden zu stellen. Solange ich Essen und ein Schlafplatz habe ist alles gut. Und natürlich Internet, das ist das Wichtigste von allem. Ah, ich habe es beinahe vergessen, ich brauche auch die neusten Video-Spiele!","Ahh... nein.. ich möchte nicht aufstehen... ich sterbe, wenn ich mein Bett verlasse!","Draußen ist es so sonnig, sodass ich immer noch zu Hause spielen muss. Video-Spiele spielen beim guten Wetter, ist noch immer das Beste!","Egal wo, egal wie! Video-Spiele bleiben und sind das Beste!",Was möchtest du lieber kaufen? Ps Vita? Ich bevorzuge Switch.,Rauf runter runter links rechts links rechts Tada~ Ich bin so grausam.,Dieses Video-Spiel ist Müll...,MVP! Das bin ich!,Tanaka Rie,So was will ich nicht haben!,Wow~Danke Master!,"Das... ich wollte das schon so lange... Du bist der Beste, Master~","Obwohl ich diesen Moment schon hundertmal geübt habe, bin ich jetzt, wo es soweit ist, doch aufgeregt!","Es ist also der Master~Hör auf mich zu stören, ich spiele!","Ah, das ist ja gar nicht gekühlt... aber egal, es ist ganz okay~","Level up!!! Haha, jetzt bin ich so stark!",Was soll der Sinn beim Lernen sein... Spiele sind so viel interessanter~,"Ich habe schon wieder ein Spiel abgeschlossen, ich muss ein neues gutes suchen...","Ich will eine neue Spielkonsole, kannst du mir eine besorgen Master... Was es geht nicht?! Dann hör auch hier rum zu stehen und mich zu nerven...",OHHH! Ist das nicht die limitierte Edition?! Wo hast du sie gefunden Master?,"Solange ich meine Spielkonsole mitnehmen kann, folge ich dir überall hin...",Schnell~Wo ist die Steckdose~,"Was stehst du da so dumm rum?! Schnell, hilf mir bei dem Level!","Es gibt Menschen die spielen, bis ihnen die Augen zufallen...",Geh zur Arbeit! Wenn du zurück bist spiel mit mir~,Die wichtigste Regel beim Spielen ist es die Belohnungen einzusammeln!,"Auf dem Campus ist etwas passiert? Warte kurz, ich spiele diese Runde zuende, dann können wir los!","Puh, dieses normale Level ist einfach langweilig~","Ich hab von Anfang an gesagt, dass ich nicht herkommen will…",填充,填充,填充,填充
651011,Minos,"Oh! Es sieht so aus, als hättest du ein Geheimnis, das du nicht preisgeben willst. Du willst es mir nicht sagen? Wenn du mir nicht sagst, werde ich dich essen.",Sonne? Am besten geht die Sonne nicht auf. Lass uns die Welt in völlige Dunkelheit hüllen.,Wie umwerfend... Diese Art von Person hasse ich am meisten.,Wen werde ich heute genießen? Dieses Kind hier? Aber das dort sieht auch lecker aus...,Traurig. Wütend. Melancholie. Ich kann nicht mehr essen.,Kleine Schwester. Kommst du mit mir Spielen? Ich liebe dich so sehr.,"Sag mir, warum hast du Angst? Huh?",Lass die Dunkelheit... alles verschlingen!,Tanaka Takako,"Willst du, dass ich dich aufesse?",Ich habe meine Appetit heute verloren!,Ich kann die Dunkelheit riechen~Ich liebe es!,"Ich muss zugeben, dass ich gerne Zeit mit dir verbringe... Möchtest du den nächsten Schritt in unserer Beziehung machen? Hmmm, mit dir bin ich einverstanden~","Wir treffen uns wieder, Mensch. Warum stehst du da noch?...",Das schmeckt gar nicht so schlecht~,"Die dunkle Macht ist stärker geworden, das fühlt sich gut an.",In der nächsten Klasse sehen alle gleich viel appetitlicher aus~,"Je stärker die Emotionen der Menschen sind, desto stärker wird meine dunkle Macht~",Meine dunkle Macht und die Lichtmacht der anderen sind eigentlich gar nicht so unterschiedlich.,Natürlich weißt du welche Ausrüstung mir gefällt.,Wen werde ich wohl heute fressen~,Gibt es keinen dunkleren Ort? Das Licht stört mich.,Willkommen zurück~,"Er gibt keinerlei Regung von sich... das muss daran liegen, dass er schläft.","Mensch, vergiss nicht, dass du arbeiten musst~","Wenn du deine Belohnungen nicht einsammelst, werde ich das für dich tun~","Ich bin nicht daran interessiert, was auf dem Campus passiert ist——aber wenn ich du wäre würde ich mal schauen gehen.",Ich will euch weiter zittern sehen!,Ah~Das glitzert zu sehr für mich…,填充,填充,填充,填充
651012,Cynthia,"Ah~Du bist derjenige, der Schmetterlinge rekrutiert? Hmm~OK~Dann lass uns zusammen Spaß haben, oder?","Oh nein, meine schönen Schmetterlingskinder.","Uh~nein~OK~So etwas muss an einem Ort gemacht werden, an dem niemand ist.~",Entspann dich~Ich bin ja hier~,Meine Schmetterlinge können mich überall hin mitnehmen.,Shh! Beruhige dich~Oder jemand wird uns bemerken~,"Schmetterlinge, bringt mir den Sieg.",Sei mein Köder!,Tanaka Rie,Was ist das? Magst du mich nicht mehr?,"Oh? Was für eine tolle Überraschung. Ein Geschenk für mich, danke~","Ich mag es sehr~Lass mich nachdenken, was ich dir schenken soll...","Der Schmetterling, der im Wind tanzt, hat am Ende auch nach Hause gefunden~",Willkommen zurück~,Gib mir noch ein bisschen~ich hatte noch nicht genug~,Ahh~kannst du mich noch aushalten?,"Pass auch nächstes Semester gut auf mich auf, Senpai~",Willst du meine Veränderung nicht selber spüren~,"Sind Klamotten nicht dafür gemacht, um ausgezogen zu werden?",Du willst mich also in dieser Kleidung sehen?,Lass uns ein ruhiges Plätzchen suchen~,"Das Zimmer ist mir egal, aber das Bett ist zu klen, das geht so nicht~",Du lässt einen wirklich lange warten~,"Obwohl ich an deiner Seite liege, denkst du nur ans Schlafen, du bist mir wirklich einer~","Komm von der Arbeit schnell zurück, ich warte im Bett auf dich~",Vergiss die Aufgabenbelohnungen nicht~,Etwas neues? Ich hoffe nicht interessanter als ich.,"Pff, ihr Nutzlosen~",Ah~berühig dich! Du bist zu grob~,填充,填充,填充,填充
651013,Werwolf,"Mensch, ich bin hier, um dir im Namen der Natur zu helfen. Wenn du stärker sein willst, musst du eins mit der Natur sein.","Mein Bauch sagt mir, ich soll bei dir bleiben und stärker werden","Du kannst nicht mächtiger werden, wenn du dich nicht der Gefahr und deinen Ängsten stellst!",Niemand kann den Kräften der Natur widerstehen. Die Natur ist das mächtigste in dieser Welt!,"Es ist der Mensch, der sich selbst zerstört.","Wenn wir nicht mit der Natur koexistieren können, werden wir uns selbst zerstören.",Konzentration.,*Heul*,Takeuchi Junko,"Ich kann einfach nicht verstehen, warum so etwas existieren sollte.",Wow ist das für mich? Vielen Dank~,"Die wahre Kraft der Natur! Ich bin froh mit dir zu arbeiten, Mensch~","Wir werden von der Natur erschaffen und kehren eines Tage zu ihr zurück. Aber das Leben davor, gehört nur uns selber~","Willkommen zurück, Senpai!",Es ist nichts besonderes... aber es schmeckt nicht schlecht.,Die Schwachen ohne Kraft haben keine Chance unter natürlichen Bedingungen zu überleben.,"In meiner Heimatstadt ist alles mündlich übermittelt, deshalb weiß ich nicht ob ich so gut in der Lernweise der Schule bin, aber ich werde mich anstrengen.","Du willst nicht vernichtet werden, dann gib alles um am Leben zu bleiben.","So eine Kleidung habe ich noch nie gesehen... aber es schadet nichts, mal etwas neues auszuprobieren.",Diese Ausrüstung ist voller Energie~,Ab und zu muss man in die Natur zurück kehren~,Dieses Zimmer hat Senpais Stil...,"Du bist zurück, willkommen~",Es ist wirklich ruhig hier~,Um zu überleben ist es unmöglich nicht zur Arbeit zu gehen!,"Senpai, deine Belohnungen~",Hörst du den Lärm des Chaos nicht? Auf dem Campus muss etwas passiert zu sein!,Ihr habt der Kraft der Natur nichts entgegen zu setzen!,Ich wurde besiegt…,填充,填充,填充,填充
651014,Nona,Was ist die stärkste Figur im Schach? Die Königin. Sie macht was sie will. Ich möchte die Königin sein.,Alles ist unter meiner Kontrolle!,Aus mentaler Sicht kann mich niemand übertreffen!,Ich habe keine Zeit für diese trivialen Fragen. Andernfalls wird mein IQ beeinträchtigt!,Die Schachfiguren bewegen sich nach Regeln. Ich möchte diesen Regeln jedoch nicht folgen!,Nehmen wir ein einfaches Beispiel... Oh sorry. Das wird wahrscheinlich zu schwer für dich sein,Hmm! Der Unterschied zwischen unseren IQ muss groß sein!,Schachmatt!,Kugimiya Rie,Hey~neckst du mich?,"Du solltest dankbar sein, dass ich es überhaupt akzeptiere~",Ein Geschenk des Königs für seine Königin? Du enttäuscht mich wirklich nicht. Danke~,"Mhm.. ob ich deinen Antrag annehmen solllte? Denkst du ich falle auf deine Tricks so leicht rein... Ahaha~dein angespanntes Gesicht ist wirklich lustig~ich werde es dir versprechen, bleib ganz ruhig~","Willkommen zurück, Sterblicher~",Nur das gibts du mir? Scheint als hättest du noch nicht erkannt wie wichtig ich bin!,Der Unterschied zwischen den Sterblichen und uns wird immer größer~Hehe,Für mich ist das nur ein Stück Kuchen~,"Das stimmt mit meinen Erwartungen überein, sehr gut~","Kommst du damit zu mir, weil du auf mich herabsiehst?",Diese Ausrüstung ist wie für mich gemacht!,Ich hab keine Lust mit ein paar Dummerchen Zeit zu verbringen~,"Geh, ich will mich ausruhen~","Du kommst gerade richtig, mir ist echt langweilig!",So leicht wirst du müde? Aber natürlich bist du auch nur ein Sterblicher~,"Als Sterblicher musst du zur Arbeit, da gibt es kein Entrinnen. Schnell, beeil dich~",Du willst die Aufgabenbelohnungen alle nicht?,Es ist echt langweilig? Aber auf dem Campus scheint etwas passiert zu sein.,Ich habe bereits das Interesse an euch verloren~,"Pff, das ist nur die rohe Kraft von Wilden…",填充,填充,填充,填充
651015,Bunny,"Ah~Glückwunsch, das ist kein Peak König~Das ist die stärkste Karte. Du scheinst einige gut Dinge zu haben. Willst du mir dein Leben anvertrauen?","Ziehe eine Karte! Du hast eine 50%ige Chance, aber ich gewinne ganz sicher~","Was würdest du wählen? Gesundheit oder Geld? Was auch immer du wählst, du kannst nur verlieren!","Fass meine Hasenohren nicht übermäßig an, du handstoßender Idiot!","Woo~Wie gruselig~Wie gruselig~Habe ich richtig geraten, was deine Bestrebungen angeht?",Das Glück ist die mächtigste Kraft~Ah~Du glaubst mir nicht?,It's show time～,Ich bin dran~,Hikasa Yōko,"Ich denke du hast es nicht mit Absicht getan, ich vergebe dir diesmal.",Ist das für mich? Danke!,"Keine Spielkarten? Ist auch ok~ Dein Geschenk sieht ziemlich lustig aus, also lasst uns davon Gebrauch machen!","Du hast gewonnen, hol dir deinen Preis ab. Ab heute bin ich ganz deins~",Super~Senpai ist zurück!,Ah~kein schlechtes Gefühl~,"Die, die kommen sollten, sind gekommen~",Mein Feind scheint stärker geworden zu sein? Aber mach es nicht zu langweilig für mich~,"Willst du mir vielleicht etwas mehr zu trinken geben? Dann werde ich beim nächsten Kartenspiel darüber nachdenken, dich zweimal gewinne zu lassen~","Du gibst mir eine Ausrüstung und ich lasse dich fünf mal gewinnen, wie wäre das~","Diese Kleidung fühlt sich nicht schlecht an, ab heute ist sie meine!","Was spielen wir heute? Wie wäre es, wenn du eins auswählst~","Willst du das, was du beim letzten Mal verloren hast, gegen dieses Zimmer tauschen?",Willkommen~Heute hast du das Zimmer zurückgewonnen~Haha,"Du kannst hier nicht schlafen, es ist viel zu kalt. Wenn es dich nicht mehr gibt, wer spielt dann mit mir Karten?",Du solltest zur Arbeit gehen~,"Vor der nächsten Runde, solltest du zuerst deine Aufgabenbelohnungen einsammeln.","Unruhe? Mach die keine Sorgen, solange du mit mir zusammen bist, wird nichts passieren.","Tut mir leid, aber sieht so aus, als würde das Glück heute auf meiner Seite stehen~",Ah? Wie kann das sein? Das ist doch nicht möglich…,填充,填充,填充,填充
