id,name,dialog,click_dialog1,click_dialog2,click_dialog3,click_dialog4,click_dialog5,battle_dialog,skill_dialog,cv_name,love_gift_dialog1,love_gift_dialog2,love_gift_dialog3,vow_dialog,login_dialog,lvlup_dialog,gradeup_dialog,shengxue_dialog,awake_dialog,equip_dialog1,equip_dialog2,hangteam_dialog,house_set_dialog,house_dialog,idle_dialog,dagong_dialog,daily_mission_dialog,new_stage_dialog,victory_dialog,failed_dialog,love_point_dialog1,love_point_dialog2,love_point_dialog3,love_point_dialog4
752006,Librarian,"Hast du einen Traum? Ich möchte Schriftsteller werden. Ich möchte, dass die Geschichten, die ich schreibe, die Menschen glücklich machen.","Ich liebe es wirklich Bücher zu lesen. Ich kann die verborgene Seite der menschlichen Natur von den Autoren sehen, die sie geschrieben haben.",Bücher sollten niemals weggeworfen werden. Bücher sind niemals falsch.,"Wenn du mit dem Lesen eines Buches fertig bist, endet die Geschichte dann? Nein! Wir könnten sie in unseren Herzen fortsetzen.","Jeder kann das gleiche Glück fühlen, wenn er ein Buch liest! Das ist der Reiz von Büchern.","Wenn ich alleine bin, lese ich immer dieses Buch. Bücher können den Leser jederzeit in magische Welten entführen~",Willst du mit mir lesen?,"Du brauchst erst eine Erlaubnis, um zu gehen!",Hayami Saori,"Entschuldigung, dieses Geschenk passt nicht zu mir.",Danke.,Ich mag dieses Geschenk wirklich und ich werde dich nicht im Stich lassen~,"Ich will mir das was heute passiert ist gut merken. So werde ich mich in 10, 20, sogar 100 Jahren noch daran erinnern können wie glücklich wir waren und dieses Gefühl wird immer bleiben~","Guten Morgen, Hast du das Buch gelesen, dass ich dir letztes Mal gegeben habe?","Master, habe ich dir nicht gesgt, du sollst keinen Unfug machen, wenn ich lese... Ah, Exp Getränk? Danke~","Bücher geben mir Wissen, Wissen gibt mir Macht~",Im nächsten Schuljahr darfst du nicht wieder den Unterricht schwänzen~,"Jedes Mal, wenn ich gemeinsam mit dir lerne wird vieles klarer für mich, Danke! ich weiß nun bereits meine Forschungsrichtung~","Eine Rüstung... ich dachte es wäre das alte Buch, dass du mir geholfen hast zu suchen... Das war viel interessanter als diese Rüstung...",Mhm... die Rüstung hat keinen Platz für ein Buch... Echt schade...,"Wo du heute schon zusammen mit mir lernst, musst du auch bis zum Schluss bleiben!",Mir gefällt dieses ruhige Zimmer~,"Master, willst du meinen Leseraum besuchen?","Master, du solltest wegen der Klausur morgen nicht so hart lernen... Ich hol dir einen Mantel. Wenn du auf dem Boden schläfst holst du dir eine Erkältung.","Master, ich freue mich, dass du mit mir zusammen liest, aber es ist bald Zeit zur arbeiten!","Master, du hast noch Belohnungen, die du einsammeln musst!","Auf dem Campus ist etwas passiert, willst du mit mir nachschauen gehen, Master?","Senpai, diesen Kampf zu gewinnen ist leichter als das Problem gestern im Schulbuch zu lösen~","Misserfolg ist die Mutter des Erfolgs, Senpai, deshalb dürfen wir nicht einfach aufgeben~",填充,填充,填充,填充
752007,Aurora,"Ernsthaft? Mein Haar ist noch nicht trocken~Wenn du mich nicht gut behandelst, werde ich dir nicht vergeben.","Da du mein Master bist, musst du dich besser anziehen! Sei nicht so faul. Du solltest mehr auf deine Haare achten!",Dieser Föhn wird alle deine Probleme wegblasen ~,"Willkommen~Lass mich dir helfen, deinen Rücken zu waschen~",Soll ich ein Rosenbad oder ein Lilienbad nehmen~? Welches ist besser?,"Hehe~Ich habe Hunderte von Schlachten geschlagen, glaubst du mir nicht? Möchtest du es versuchen?","Okay! Ich werde dir helfen, deine Haare zu trocknen~",Wooaaa~,Tomatsu Haruka,Ich hasse dieses Ding... Ich will das wirklich nicht~,Ich akzeptiere~Aber lass mich das nächste Mal nicht im Stich~,"Du hast mich nicht im Stich gelassen~Lass mich darüber nachdenken, wie ich dich belohnen kann~","Ab heute kannst du meinen Rücken massieren, ist das nicht super~","Hey, willst du mit mir Baden gehen?","Ein eisgekühltes Getränk nach dem Baden, einfach himmlisch~","Beim Baden kann man stärker werden! Blubber Bad, Seifen Bad, Hot Springs... danach fühlt man sich jedes Mal wie ein neuer Mensch~","Natürlich ist lernen wichtig, aber man kann das auch nicht den ganzen Tag tun. Pausen sind auch wichtig. Komm und bade mit mir~","Ich habe einen neuen und besseren Föhn, willst du ihn mal probieren~","Kleidung, sollte vor allem gemütlich sein~","Diese Kleidung scheint man leicht ausziehen zu können. Sie ist bestimmt praktisch, wenn man baden gehen will.",Wie wäre es mit einem gemeinsamen Bad vor der Arbeit?,Ist es nicht ein bisschen eng für eine Badewanne hier?,"Master, wie geht es dir~",Du musst müde in letzter Zeit sein~ruh dich gut aus,Solltest du nicht zur Arbeit gehen~,"Es gibt noch Aufgabenbelohnungen, die du noch nicht eingesammelt hast~",Es scheint etwas Neues vorgefallen zu sein~ich hoffe du bist nicht zu müde~,Großer Profit~Hahaha!,Ah~Vor dem nächsten Kampf muss ich mal eine Dusche nehmen~,填充,填充,填充,填充
752008,Hottie,"Hallo Master. Abends, wenn ich hier bin, wirst du nie mehr allein sein.","Mein Schatz, willst du essen? Ein Bad nehmen? Oder etwas süßes?",Ich könnte alles für dich tun.,"Du musst nicht so tun, als ob du es ernst meinst, wenn du mit mir zusammen bist. Ich weiß ALLES über dich.","Willst du mit mir spielen? Ich bin sicher, ich könnte dich zufrieden stellen!",Um dich glücklich zu machen? Ich würde ALLES akzeptieren~,Liebe mich!,"Oh, mir ist heiß~",Nakae Mitsuki,Was hast du? Das sieht nicht nach dir aus~,"Geschenke sind nie zu klein, danke~",Vielleicht... sollte ich mich dir als Gegenleistung anbieten?,"Wir haben noch nie groß Worte gebraucht, um zu kommunizieren. Komm näher...","Ich habe lange auf dich gewartet, Meister. Was sollen wir heute tun?","Mua~ein Kuss für ein Getränk, oder ist einer nicht genug? Haha~",Was starrst du mich so an? Ich bin sehr schüchtern~,"Du lernst nicht genug, soll ich dir Privatstunden geben?","Ich habe einen weiteren Schritt zum erwachsenwerden getan, Yay~","Es ist eine seltenen Möglichkeit, vielleicht sollte ich etwas besondereres tragen?","Diese Kleidung sieht echt schön aus~oder gefalle ich dir besser, wenn ich nichts trage?","Es ist selten, dass du bei mir bist, lass uns ein bisschen Spaß haben~",Dieser Ort ist echt nicht schlecht~,"Wie kannst du mich so lange allein lassen, da bin ich doch ganz einsam~","Es gefällt mir so sehr dich mit geschlossenen Augen, völlig unvorbereitet zu sehen...","Senpai, wie wäre es wenn du heute einfach bei mir bleibst anstatt zur Arbeit zu gehen... Ich mach nur Spaß, schnell geh~",Vergiss deine Aufgabenbelohnungen nicht~,"Auf dem Campus scheint etwas passiert zu sein, wollen wir zusammen nachschauen gehen~",Ah~ist das alles~,Stop! Das wird morgen echt weh tun~,填充,填充,填充,填充
752009,Historia,"Hallo, ich habe gehört, dass du nett bist. Wir brauchen Leute wie dich in meiner Akademie. Möchtest du uns nicht helfen?",Recht und Ordnung werden von den Starken geschaffen. Also bin ich das Gesetz.,"Egal welche Taktik du anwendest, du wirst verlieren!",Geschichte wird von den Gewinnern geschrieben. Die Schwachen haben kein Recht auf eine.,Ich will nur Ordnung halten. Ich möchte die Mächtigste in der Schule sein!,"Ich mag keine Dinge, die ich nicht kontrollieren kann. Um alles kontrollieren zu können, muss ich die Mächtigste werden.",Ich kontrolliere mein eigenes Schicksal.,Geh mir aus dem Weg!,Tanaka Rie,Es ist nutzlos.,"Ich muss zugeben, es ist ein freundlicher Austausch im Rahmen der Regeln.","Ich muss zugeben, ich mag dieses Geschenk sehr. Vielleicht solltest du mich auf diesem Abenteuer begleiten?","Ein Eid? Ich habe schon Ja gesagt. Du hast es einfach nicht gemerkt... Nun, das ist nur ein Teil der Regeln.",Willst du mit mir die Welt erobern? Großartig!,Wieso gibt es nur so wenig! Das ist doch niemals genug!,"Ich habe neue Energie, kann ich damit etwas machen?","Unter meiner Herrschaft wird zu wenig Wissen nicht geduldet. Als meine rechte Hand, kannst du nicht faulenzen!","Wer keine Kraft hat über Ehrgeiz zu sprechen, ist nur ein Idiot, der über schwache Träume spricht. Ich bin anders als diese!","Gib alle Ausrüstung mir, ich werde sie in bester Weise nutzen!",Eine tolle Ausrüstung! Es kann mir bei meiner Herrschaft behilflich sein~,Hören sie alle auf mich?,"Der Ort sieht so aus, als würde er sich als Anführer Quartier anbieten.",Willst du beim Kampftreffen zuhören?,"Ah, und schon schläfst du... wirklich unhöflich... Wechsel wenigsten deine Kleidung vorher...","Vergiss nicht, dass du arbeiten musst!",Vergiss nicht deine Aufgabenbelohnung einzusammeln!,"Geh zum Campus und schau was passiert ist, wenn du zurück bist erstatte mir Bericht.","Pff, verschwindet ihr Feiglinge! Dieses Schlachtfeld ist nicht passend für euch!",Meine Herrschaft wird hier nicht aufhören…,填充,填充,填充,填充
752010,Sonya,"Hallo! Der Master ist hier, lass es mich tun! Sonst können meine beiden Schwestern es nicht sehen!",Angriff! Angriff! Angriff! Ich werde den Feind vernichten!,"Ich bin es leid, in Theorie und mit Argumenten zu sprechen! Wer kümmert sich um solche verbalen Müll.","Warum reden, wenn man kämpfen kann? Kämpfe! Und danach reden wir!",Essen! Essen! Es schmeckt wie der Himmel! Dieses ist auch gut! Und das hier erst! Essen ist so guuut!,"Ich bin Sonya die Mächtige! Und das hier ist mein Gebiet, schreib dir das hinter deine Ohren!",Mach sie fertig!,Ich bin wütend!,Kobayashi Yū,Ich brauche das nicht!,"Oh, danke sehr!","Aha, es ist eine Weile her, das ich so etwas leckeres gegessen habe! Das ruft Erinnerungen hervor!","Ähm, ich bin nicht gut darin über Gefühle zu sprechen, deshalb red du auch nicht davon... nimm einfach meine Hand...",Hey! Ist das nicht der Master! Morgen!,Ist das für mich?,"Meine Faust scheint mehr Kraft zu haben! Ich würde es am liebsten gleich ausprobieren... Master, wovor läufst du davon?",Wie kann dieses Buch immer noch nicht zuende sein! Jeden Tag im Klassenraum ist einfach so langweilig!,"Es gibt nichts, was meine Faust nicht lösen könnte! Du glaubst mir nicht? Willst du mal eine meiner Fäuste probieren?","Danke, Senpai! Nächstes Mal, wenn du in die Mensa kommst, lade ich dich ein!","Wenn ich das trage, werde ich beim nächsten Kampf sicher nicht verlieren!","Ich gehe spazieren, willst du mit mir kommen Master?",Dieses Zimmer ist so gemütlich! Ich will mich ein wenig hinlegen~,"Du kommst gerade richtig, ich wollte gerade kochen!","Ah, warum zeigst du keinerlei Regung, bist du etwa vor Hunger in Ohnmacht gefallen?",Geh schon zur Arbeit!,Aufgabenbelohnungen! Die solltest du nicht verschwenden!,Ist auf dem Campus schon wieder etwas vorgefallen? Nimm mich mit!,Wer traut sich noch?!,Wieso sind sie nur so stark~,填充,填充,填充,填充
753001,Nia,"Das ist keine Puppe. Diejenigen, die uns voneinander trennen wollen, werden von meinem Liebling getötet. Oder?","Liebling~Kannst du mich hören? Du weißt, ich habe an dich gedacht.",Auf diese Weise können wir immer zusammen sein~Wir können nie getrennt sein~,Du wirst dafür noch bezahlen!,"Liebling, du bist immer so schön.",Ich werde dich überall finden. Auch am anderen Ende der Welt.,Liebling~Willst du aufstehen?,Verwandle dich in meine Puppe~,Kobayashi Yū,Willst du mich damit bestechen?,"Ja, du bist der Beste, Liebling~",Haha~das ist ein tolles Geschenk~Was denkst du Liebling?,"Ich habe Liebling gefragt, ihr gefällt es auch sehr... sie scheint auch dich sehr zu mögen, deshalb vergiss nicht auch in Zukunft Zeit mit ihr zu verbringen!","Oh, mein Liebling wird von Tag zu Tag schöner!","Liebling, meine Stärke hat zugenommen!",Das ist noch nicht genug!,"Liebling, warte noch ein bisschen, dann habe ich die Macht, dich zurückzuholen!","Ich habe schon lange nicht mehr mit ihr geredet, aber diesesmal werde ich mir Zeit nehmen, um mit ihr zu reden.",Ist dies neue Kleidung für Liebling?,"Ich benötige diese neue Ausrüstung, um eine größere Hilfe zu sein~","Warte, ich komme mit Liebling zu dir!","Liebling, das ist unser neues Zuhause~","Senpai, endlich bist du gekommen. Liebling hat so lange gewartet!","Hör auf so zu tun, als wärest du auch eine Puppe.","Schnell, geh zur Arbeit!","Liebling, die heutigen Aufgabenbelohnungen warten auch dich, vergiss nicht sie einzusammeln!","Warte, nimm mich mit. Wer weiß ob es irgendwelche Hinweise zu Liebling gibt.","Liebling, wir sind die Besten!","Denk ja nicht, dass das das Ende war!",填充,填充,填充,填充
753002,Odanna,"Ich bin die Dämonenkönigin! Ich kann nicht schwach sein, richtig? Soll ich dich beschützen? Hahaha, überlassen es mir. Ich werde alle deine Feinde vernichten!",Der Honnoji-Tempel? Buddha kann dich nicht retten.,Ich bin die Dämonenkönigin des sechsten Himmels. Hast du Angst? Keine Gnade für dich! Selbst wenn du dich hinkniest und mich anbettelst.,Hideyoshi! Ah! Wo ist der Affe hin gelaufen?,Oh! Frauenkleider... Sie sind faszinierend... Klauen wir ein paar...,Verschwinde von hier! Verräter! Ich war aufrichtig mit dir. Ich hätte das nie von dir erwartet... Ah...,"Ich schicke dich dahin zurück, wo du herkommst!",Zieh das Schwert. Töte!,Park Romi,Was ist das... Nie zuvor gesehen. Das fasse ich nicht an...,"Oh, bittest du um meinen Schutz?","Emm, das ist sehr interessant, ich werde dir für das Geschenk danken.","Dieses Kleid fühlt sich wie Zuhause an, wo die Kirschblüten in voller Blüte stehen~Glaub mir. Du könntest dein Leben mit der Suche danach verbringen... Und es wäre kein vergeudetes Leben sein.","Wenn du mich fragst, zögere ich ein wenig, Hallo zu sagen.","So ein kleines Getränk, kann so viel Energie geben, das ist wirklich lustig~",Die Kraft fließt durch meine Adern.,"Hahaha, lass mich sehen, welches Geheimnis du versteckst!",Ich regiere mit Stärke!,Mein Rohr ist keine Dekoration!,"Dieses Design ist sehr besonders, kann ich es zerlegen, um zu sehen wie es funktioniert?",Los! Folge meinem Rythmus~,Du solltest dich gut ausruhen.,Du wirst doch wohl nicht schon wieder im falschen Zimmer sein?,"Wirklich selten, er ist nicht hier...","Auch wenn es ein Teilzeitjob ist, solltest du vollen Einsatz zeigen!","Da du die Aufgaben abgeschlossen hast, hast du dir die Belohnungen verdient.",Es gibt viel Wissenswertes über die Akademie.,Die Schwachen schlecht zu behandeln wird kein Gutes Ende für dich nehmen!,Bleib stehen! Ich kann es nicht ertragen zu verlieren!,填充,填充,填充,填充
753003,Silvia,"Beseitige die Dunkelheit dieser Welt. Das ist mein Schicksal. Ich werde nicht über deine Arbeit sprechen, also hoffe ich, dass du meine nicht störst.",Ich werde die ganze Dunkelheit dieser Welt vernichten.,"Licht und Dunkelheit sind verbunden. Ist es wirklich gut, die Dunkelheit zu zerstören?",Ich habe die Schreie meiner Feinde gehört. Auch sie haben ihre Güte nicht verloren. Aber... ich kann nichts machen.,"Ich bin nicht sicher, ob es möglich ist, die Dunkelheit dieser Welt loszuwerden.","Du glaubst an etwas nicht wahr? Ich wünsche, ich könnte an etwas so glauben wie du es tust. Eventuell könnte ich dann ein normales Leben führen.",Zerstören wir die Dunkelheit!,Verschwinde!,Saitou Chiwa,Ich habe dir nichts zu sagen...,In diesem Fall akzeptiere ich es.,"Dieses Geschenk passt zu mir, danke für deine sorgfältige Auswahl des wunderbaren Geschenks.","Ich zweifel viele Sachen an, aber dir vertraue ich bereits.",Grüße mich nicht. Deine Anwesenheit lässt mich zittern.,Dieses Produkt hat Zusatzstoffe.,"Das Essen ist für die Energiezufuhr, ich verstehe.","Du musst mir das nicht erklären, ich verstehe das schon.","Da ich mich schon entschieden habe, kann ich nur noch diesem Weg folgen.",Hilfssystem gestartet.,Waffen Kontrollsystem funktioniert normal.,Wem soll ich diesmal hier treffen?,"Na, dann lass uns ein wenig ausruhen.",Wilkommen Senpai.,Auch du wirst müde?,Bist du schon fertig mit der Arbeit?,"Es ist gut, dass du die Aufgaben beendet hast, aber vergiss nicht deine Belohnungen einzusammeln.",Wird uns die Dunkelheit erneut umgeben?,Chaos und Dunkelheit sind beides Kräfte die überschätzt werden!,"Sie haben geschummelt, nächstes Mal werden wir das nicht zulassen!",填充,填充,填充,填充
753004,Toyo,"Verrat ist unverzeihlich! Aber diejenigen, die anderen nicht vertrauen können, können keine Könige sein. Master, ich stehe hinter dir!","Es ist wichtig, positiv zu bleiben. Ansonsten können weder das Genie noch der Mächtige aus tiefstem Herzen lachen.","Wie Tau erscheinen, wie Tau verschwinden - so ist mein Leben. Sogar Osakas Pracht ist ein Traum im Traum. ""","Da ich schon spät angefangen habe, sollte ich besser schneller laufen, niemand wird mich fangen können.","Wie können wir große Dinge erreichen, wenn wir zögern, an den kleinen zu arbeiten?","Wir haben beschlossen, unser Bestes bis zum Ende zu geben!",Bist du bereit für einen Kampf?,Kombi Angriff!,Kayano Ai,Wendest du dich gegen mich?,Danke.,Ich mag es sehr~Danke~,"Neben dem Training gibt es noch viele Orte an die ich reisen will und viele Dinge, die ich erleben will. Ich hoffe, dass du bei allem an meiner Seite bist.","Wenn du erfolgreich sein willst, musst du an dir arbeiten!",Nichts ist so gut wie ein Getränk nach dem Training!,Unterschätze mich lieber nicht!,"Wenn du fleißig trainierst, kannst du dir unendlich viele Möglichkeiten im Leben schafffen!",Das ist erst ein Anfang. Nach der Hälfte aufzuhören ist nicht mein Stil!,"Treffe Sicherheitsmaßnahmen, damit du beim Training nicht verletzt wirst!",Willst du mit mir zusammen trainieren?,"Ein richtiger Kampf ist eine gute Möglichkeit, um zu üben!","Ein großes Zimmer, kann man hier noch ein paar Trainingsgeräte reinstellen?","Senpai, bist du hier um eine Trainingszeit auszumachen?",Hör auf so faul zu sein! Steh auf und trainiere!,Du musst deine Arbeit noch zu Ende bringen!,"Belohnungen sind ein wichtiges Geschenk, für die Erledigungen deiner Aufgaben~","Ein neuer Kampf, gib alles!",Den Feind zu unterschätzen ist der größte Grund zu verlieren.,"Tut mri leid, nächtes Mal werde ich nicht verlieren!",填充,填充,填充,填充
753005,Zoro,"Diese Klinge trennt den Kopf vom Haupt schneller als man Blinzeln kann. Du bist der erste, der dieser Klinge trotzt!","Wenn du anderen zu sehr vertraust, wirst du nur dich selbst verletzen.",Was können wir durch Moral erreichen? Fühlen wir uns damit besser?,"Verstrickt in Formalitäten, gebunden an das säkulare Leben... Ah, was für eine Langeweile.","Sprechen kann jeder! Doch das Gesprochene umzusetzen, das kann nicht jeder!","Geboren in dieser Welt, ich wünschte, ich hätte kein Bedauern.",Versuche es wenn du dich traust?,Die Schlacht beginnt!,Takeuchi Junko,Das passt mir nicht~,Danke sehr! Ich dachte nicht das auch Mörder beschenkt werden! Hahah!,"Danke, dass du meine Ungereimtheit tolerierst. Jetzt kann ich deine Liebe spüren~","Heißt das, dass wir eine Bündnis schmieden? Natürlich will ich. Mit dir gibt es nichts, was ich nicht schaffen könnte!",Ha! Erfolgreicher Überraschungsangriff! Sie waren auch dieses Mal nicht bereit~,Ich kann alles zerschneiden!,"Nur wenn du deine Limits überschritten hast, ist es ein Kampf!",Eine größere Bühne bedeutet noch bessere Möglichkeiten~,Entwickel eine starke Grundlage und die Möglichkeiten werden von ganz allein kommen.,"Haha, ist das ein neues Messer?","Taktik ist nur ein Hilfsmittel, Ausrüstung ist die wirkliche Kraft!","Es ist Zeit, Angriff!",Von heute ist das hier mein großer Palast!,"Senpai bist du heute gekommen, um etwas wichtiges zu verhandeln?",Ist das die Ruhe vor dem Sturm?,"Die Versorgung einer Armee sollte sicher gestellt werden, bevor die Armee mobilisiert wird!",Die Belohnungen einzusammeln ist sehr wichtig~,In letzter Zeit ist der Campus nicht besonders sicher. Sei vorsichtig Senpai~,Das ist der erste Schritt meiner Eroberung!,"Wir haben verloren, es ist Zeit sich zurück zu ziehen.",填充,填充,填充,填充
753006,Hexa,"Die Waffen in beiden Händen repräsentieren die Vergangenheit und die Zukunft. Ob in der Vergangenheit oder in der Zukunft, ich werde bis zum Ende standhaft bleiben.",Ich glaube an Gerechtigkeit... Was ist daran falsch? Also was soll ich tun?,"Ich werde dich gut belohnen, aber was soll ich tun, wenn du gegen die Gerechtigkeit verstößt?","Niemand kann mich kontrollieren, daran glaube ich.","Im Leben haben wir nur eine Chance, aus einer Niederlage zu lernen.","Die Waffe in meiner rechten Hand verfolgt die Vergangenheit. Was meine linke Hand betrifft, so gestaltet sie die Zukunft.",Soll ich meine Klinge oder mein Gewehr benutzen?,Lasst uns die Feinde vernichten!,Hirota Yuumi,Bist du für mich oder bist du gegen mich?,"Aus eigenem Willen, danke.",Du behandelst mich sehr gut... Danke~Ich werde immer an deiner Seite bleiben!,"Ich habe mich noch nie so gefühlt. Das Glück ist so sanft und berauschend, es fühlt sich fast surreal an. Vielen Dank, dass du mir dieses Gefühl näher gebracht hast.",Und schon wieder begegnen wir uns~,Dieses Getränk schmeckt gar nicht schlecht.,"Mein Körper fühlt sich anders an, ich weiß nicht was das bedeuten soll, aber meine Kraft hat zugenommen.","Ich werde meinem Willen stets treu bleiben, vertrau mir.","Ich habe das Gefühl meine Kraft hat zugenommen. Kannst du ein bisschen mit mir üben, wenn es dir nichts ausmacht?",Ein Visionsfinder? Das passt zu mir.,Und schon wieder eine neue Ausrüstung? Bin ich doch wohl nicht dein Versuchskaninchen für Ausrüstungen!,Ich werde jegliche Bedrohungen beseitigen!,"Es ist bald Zeit zum Schlafen, was machst du noch hier Senapi?","Ich habe ein großes Zimmer, willst du es dir mal anschauen?",Der einzige der auch tagsüber schlafen kann ist Senpai...,Es ist Zeit für die Arbeit.,"Wenn du deine Belohnungen nicht bald einsammelst, werden sie verloren gehen.","Chaos Kreaturen? Schnell, lass uns nachschauen gehen!",Unser Sieg ist garantiert! Ich werde sie nicht verstreichen lassen!,"Das ist ein taktischer Rückzug! Wenn wir die Situation analysiert haben, kommen wir zurück!",填充,填充,填充,填充
753007,Alice,In der Vergangenheit waren meine Handlungen durch meine Emotionen begrenzt. Ab heute werde ich dir gehorchen.,Ich werde all deinen Anweisungen befolgen.,"Das Gesetz? Können wir wirklich so einfach beurteilen, was gut und was schlecht ist?",Ich folge nur Befehlen.,Die Vorzüge und Nachteile werden von unseren Nachkommen kommentiert.,Ich werde dich in deinen Träumen verschwinden lassen. Dies ist mein letzter Akt der Nächstenliebe.,Im Namen des Mondlichts.,Eine Wahl entscheidet über das Ergebnis!,Sugiyama Riho,Das bist nicht du? Ist etwas passiert?,Vielen Dank für dein Geschenk~,Du hast meinen Gedanken bestätigt... Und mein Gefühl?,"Durch deine Existenz muss ich mir außer um Kampf und Maschinen keine Gedanken um irgendwas machen. Wir haben noch viel Zeit und ich hoffe, dass wir immer so glücklich bleiben werden!",Hey! Was kann ich für dich tun?,"Nur wenn man unaufhörlich besser wird, kann man verhindern vom Leben überholt zu werden!",Nach dem bisschen ist mein Limit noch nicht erreicht!,Ich würde niemals meine Ausrüstung wegen dem Lernen zurücklassen.,"Wenn ich noch mehr Wissen hätte, hätten meine Drohnen vermutlich noch mehr Funktionen~",Nur eine passende Ausrüstung kann mir im Kampf helfen.,"Hast du noch mehr Taler, die helfen meine Drohne zu kontrollieren?",Order erhalten!,Wieviel Uhr ist es? Ist es nicht bereits Schlafenszeit?,"Ich hätte nicht gedacht, dass meine Drohnen im Wohnheimzimmer so nützlich sind!",Wie kannst du so schnell einschlafen? Du hast mir noch nicht mal selber den Befehl zum schlafen gegeben~,"Arbeiten muss ganz schön anstrengend sein. Wie wäre es, wenn ich diesmal für dich arbeite?","Was ist mit den Belohnungen, wenn du sie nicht brauchst, kann ich sie dann mitnehmen, um meine Drohnen zu optimieren?","Senpai, die Chaos Kreaturen, ich warte auf deine Befehle!",Das war wirklich einfach!,"Mission kann nicht durchgeführt werden, zieht euch zurück.",填充,填充,填充,填充
753008,Puppe,"Ein neuer Master? Für mich ändert sich nichts, weil ich nur ein Spielzeug bin...",Spielzeuge müssen nicht reflektieren oder fühlen.,"Verzweiflung... Traurigkeit... Diese Puppen fühlen es nicht. Aber ich werde mich erinnern, was ich getan habe...",Glück? Was ist das? Bedeutet Lächeln und Lachen Glück?,Deine Gerechtigkeit wird nicht alle retten.,Mein Herz schlägt... ich lebe...,Ich zeige dir den Schmerz von Spielzeug!,Werde ein Spielzeug!,Toyosaki Aki,Ich brauche es nicht...,Ist es für mich... Wirklich...?,Ich habe... meinen eigenen Willen... mein eigenes Hobby? Das ist der... Der Anfang? Vielen Dank.,"Ich werde die Schnüre, die meine Aktionen kontrollieren, durchschneiden, aber die Schnüre, die uns verbinden werden bis in alle Ewigkeit bleiben~",Du schon wieder... Was machst du heute hier?,Ist ein Schluck genug?,Alles essen? Wie du wünscht.,"Neues Wohnheimszimmer, neue Freunde? Also eigentlich... brauch ich das nicht...","Ich verstehe, das ist dafür da, um ein besseres Werkzeug herzustellen...",Ausrüstung gewechselt.,Ist das... für mich?,Bitte... gib es mir. Du wirst es nicht bereuen.,Die Zimmerdekoration ist mir egal.,"Senpai, was machst du schon wieder hier?","Willst du schauen, wer es schafft sich länger nicht zu bewegen? Ich sage dir, ich verliere nicht!","Senpai, du hast die Arbeit noch nicht beendet!",Vergiss nicht deine Aufgabenbelohnungen einzusammeln!,Wie kann die Schule dich noch weniger als mich interessieren?!,Kommt dieses Gefühl vom Sieg?,Natürlich gefällt es mir nicht zu verlieren.,填充,填充,填充,填充
