type,desc
1,"Bitte zeige 1 {2} von Qualität ""{1}"" oder höher, um die Kartenaufgabe abzuschließen."
2,"Bitte zeige 1 {3} von Qualität ""{1}"" auf {2}-Sterne oder höher, um die Kartenaufgabe abzuschließen."
3,"Bitte zeige 1 Outfit-Teil, dessen Charme nicht weniger als {1} beträgt, um die Kartenaufgabe abzuschließen."
4,"Bitte zeige 1 Outfit-Teil, dessen Charme nicht weniger als {1} beträgt, um die Kartenaufgabe abzuschließen."
5,"Bitte zeige 1 Outfit-Teil, dessen Wissen nicht weniger als {1} beträgt, um die Kartenaufgabe abzuschließen."
6,"Bitte zeige 1 Outfit-Teil, dessen Gesamtwert der Attribute (Mut, Charme und Wissen) nicht weniger als {1} beträgt, um die Kartenaufgabe abzuschließen."
