id,sort,name,des
1,2,보상 2배,이번 탐색의 일반 보물 상자 보상이 2배로 됩니다.
2,3,확률 2배,이번 탐색의 고급 보물 상자 획득 확률이 2배로 됩니다.
3,1,고급 보물 상자 발견,해당 사건 촉발 시 이번 회의 고급 보물 상자를 획득하며 다음 탐색으로 진출합니다.(고급 보물 상자 획득 확률 0으로 초기화)
4,6,가위바위보,이번 탐색은 가위바위보의 진행 여부를 선택할 수 있으며 가위바위보를 선택하지 않으면 바로 일반 보물 상자 보상을 획득하고 가위바위보 선택 시 1/3의 확률로 승리할 수 있으며 추가로 일반 선택 팩 1개를 획득할 수 있습니다. 1/3의 확률로 무승부일 수 있으며 바로 일반 보물 상자 보상을 획득합니다. 또한 1/3의 확률로 패배할 수 있으며 이번 탐색의 일반 보물 상자 보상을 잃게 됩니다.
5,4,스페셜 만남,이번 탐색 및 이후 탐색에서 일반 보물 상자 보상이 대폭 증가됩니다.(자세한 출현 타이밍과 지속 시간은 화면 표시를 참고하세요.)
6,5,아무 사건도 발생하지 않음,"특별 사건 없음, 일반 보물 상자 보상만 획득합니다."
