id,fort_name,fort_name2,name,description,skill
89,튜린·초대 감시자,튜린·초대 감시자,재탄생,[기동완료]\n 아무것도 없는 어둠 속에서 소녀는 다시 눈을 뜬다. 이번에 그녀는 목적지에 도착할 수 있었다. 새로운 여행은 지금부터 시작하려고 한다.,
90,튜린·초대 감시자,튜린·초대 감시자,"재부팅, 재부팅, 재부팅","
재기동 --실패
 재기동 --실패
 재기동 --재기동 --
......
 소녀는 에너지 부족과 기능 손상 경고를 무시하고, 몇 번이고 계속 시도하고 있었다. 뚜렷한 목표가 있기에.",
91,이사우&야곱\n운명의 쌍둥이,이사우&야곱·운명의 쌍둥이,도망,3년 전 기원의 땅 사건 이후 동생 야곱의 몸이 점차 약해지고 있었다.\n카오스 세력을 피하기 위해 이사우는 야곱을 데리고 도망쳤다.\n하지만 도망중 그녀들은 몇번이나 카오스 병사에게 습격당했다……,
92,이사우&야곱\n운명의 쌍둥이,이사우&야곱·운명의 쌍둥이,구출,쌍둥이 자매는 카오스 병사에게 기습을 당했고 나서서 싸워온 이사우는 결국 힘이 다하고 말았다.\n그런 일촉즉발의 상황에서 두 사람은 운 좋게 임무 중의 유몽학원 학생들과 만나게 된다...,
93,이사우&야곱\n운명의 쌍둥이,이사우&야곱·운명의 쌍둥이,포위,곧 지금까지 본 적 없는 대규모 적 집단과 마주치고 말았다.\n혼란 속에서 이사우와 야곱은 적 때문에 떨어지게 되었다……,
94,이사우&야곱\n운명의 쌍둥이,이사우&야곱·운명의 쌍둥이,카운터 어택,"정신을 잃은 후, 눈을 뜬 이사우는 여동생이 구조되지 않았다는 것을 알게 되었다.\n팀 리더인 왈큐레의 은월과 상의한 뒤 이사우는 카오스를 토벌하는 부대에 가담했다.",
95,이사우&야곱\n운명의 쌍둥이,이사우&야곱·운명의 쌍둥이,대치,"야곱의 몸 속에 숨어있던 악이 마침내 이빨을 드러냈다.\n여동생을 돕기 위해 숲으로 들어갔고, 이사우에게는 어려운 선택이 찾아왔다……",
96,이사우&야곱\n운명의 쌍둥이,이사우&야곱·운명의 쌍둥이,계속해서,"
카오스 98년 유몽 군단은 카오스와의 결전을 맞고 있다.
이사우와 야곱은 왈큐레가 되었다.
하지만 그녀들은 야곱의 몸에 봉인된 카오스를 숨기고 있었다.
군단 후방 주둔지가 갑자기 적의 습격을 받았다.",
97,이사우&야곱\n운명의 쌍둥이,이사우&야곱·운명의 쌍둥이,분격,"적의 공격으로 이사우와 야곱은 떨어져 있었다.\n이사우가 다른 길을 찾고 있을 때, 야곱은 아군과 함께 적과 싸우고 있었다.",
98,이사우&야곱\n운명의 쌍둥이,이사우&야곱·운명의 쌍둥이,재림,"야곱이 피곤할 때에, 나이트메어는 봉인을 풀고 있었다.\n야곱이 흡수한 부정적 감정은 봉인된 나이트메어의 에너지로 바뀌었다.\n이제야 나이트메어는 완전히 부활하고 있었다……",
99,이사우&야곱\n운명의 쌍둥이,이사우&야곱·운명의 쌍둥이,잔혹,본연의 길을 발견한 이사우은 야곱에게 돌아갔지만\n그녀를 기다리고 있는 것은 동료의 시체와 나이트메어에 현혹된 야곱이었다.,
100,이사우&야곱\n운명의 쌍둥이,이사우&야곱·운명의 쌍둥이,깊은 수면,"현혹된 야곱에게 천사의 몸을 빼앗긴 이사우는 나이트메어의 뜻대로 팔란티르를 연성하기 위한 용기였다.\n나이트메어를 막기 위해서, 야곱은 마지막 힘을 다해 자기의 몸을 희생하고, 나이트메어를 쓰러뜨릴 수 있었다.\n여동생을 돕기 위해 이사우는 자신의 몸을 희생하여 두 사람의 영혼을 지킬 수 있었다. 영혼만이 남겨진 운명의 쌍둥이는 영원한 잠에 들었다......",
101,은월·인도의 달빛,은월·인도의 달빛,길을 가리키는 달빛,유몽 군단과 카오스 군단이 정면으로 충돌하던 중.\n뒤에서는 어둠 속에서 활약하는 부대가 있었다. 이들은 가장 위험한 곳으로 숨어들어 유몽 군단의 눈과 귀를 멀게 하였다.\n그리고 그 부대의 중심에 있는 인물은 매우 특수한 능력을 가지고 있었다.,
102,은월·인도의 달빛,은월·인도의 달빛,따뜻한 마법,"은월에게 메이드 복은 전쟁용 슈트이다. 메이드 복을 입으면 감지 능력 때문에 뇌에 울리는 소음도 견딜 수 있다.\n그녀는 자신의 고민을 다른 사람에게 털어놓지 않고 혼자서 견뎌내고 있었는데, 어느 날 한 소녀가 그것을 알아차렸다.",
103,은월·인도의 달빛,은월·인도의 달빛,미래의 계획,"카오스와의 전쟁도 마침내 막바지에 이르렀다. 여러가지 석연치 않은 점도 있지만,\n그 기쁜 상황에서도 은월과 바닐라는 무심코 전쟁 후의 미래를 그리기 시작했다.",
104,은월·인도의 달빛,은월·인도의 달빛,이상한 기색,아주 힘든 임무지만 몇 번이나 생과 사를 넘나든 은월에게는 대수롭지 않았다.\n그저 임무보다 한 가지 더 떠도는 이상한 기색이 마음이 쓰일 뿐이었다.,
105,은월·인도의 달빛,은월·인도의 달빛,불안의 씨앗,은월는 이상한 기운의 원인을 찾았다. 동정일까 아니면 경의일까.\n은월는 그녀에게 손대지 않았다. 다만 은월의 마음에 불안함이 피어났다.,
106,은월·인도의 달빛,은월·인도의 달빛,전쟁 종결?,"최후의 싸움이 끝나면, 전쟁도 드디어 결말이 난다.\n겨우 쉴 수 있다고 은월이 생각했지만...",
107,은월·인도의 달빛,은월·인도의 달빛,반딧불,큰 희생을 치루고 은월은 겨우 거점으로 돌아갔다.\n하지만 그녀를 기다리고 있던 것은 지옥 같은 참상이었다.,
108,은월·인도의 달빛,은월·인도의 달빛,새로운 세상,참혹한 현실을 외면할 시간은 없었다. 지금 해야 할 일은 앞으로 나가는 일 뿐이었다. 은월은 그 신비로운 소리를 받아들이기 위한 조건을 선택하고 새로운 세상의 달빛이 되겠다고 결심했다.,
109,은월·인도의 달빛,은월·인도의 달빛,여행,유몽 학원이 겨우 안정되었지만 은월은 마음 속 불안을 지울 수 없었다. 지금 유몽 학원에 자신이 필수적인 존재가 아니라고 생각되자 은월은 어떤 결정을 내린다.,
110,은월·인도의 달빛,은월·인도의 달빛,달빛 아래의 반딧불,"백년 후, 유몽학원이 위험에 빠진 지금, 하나의 그림자가 어둠 속에서 나타났다.",
111,크리스·기적과 크리스탈,크리스·기적과 크리스탈,크리스탈과 소녀,"염풍의 황야 부근, 백로사막의 가장자리.\n해가 뜨고 새로운 하루가 시작된다. 그리고 크리스탈에서 깨어난 소녀……",
112,크리스·기적과 크리스탈,크리스·기적과 크리스탈,소녀와 꼬리,"조각이 된 크리스탈 무더기는 이 사막을 이루는 하나의 풍경이다. 크리스탈에 응집된 에너지는 힘에 목마른 수많은 생명, 예를 들면 카오스 생물을 끌어들였다. 크리스탈에 가까이 다가선 소녀, 역시 많은 카오스 생물들이 뭉치고 있는 것을 발견한다……",
113,크리스·기적과 크리스탈,크리스·기적과 크리스탈,낯선 아침,"어느 날, 깨어난 크리스 앞에 낯선 풍경이 펼쳐졌다.\n……엄마? 크리스는 이러한 온기를 품은 단어를 들어본 적이 없는 것 같다.",
114,크리스·기적과 크리스탈,크리스·기적과 크리스탈,긴 수염,"동네를 어슬렁거리는데, 아침에 한 긴 수염 아저씨가 나타나 크리스와 한번 겨뤄보자고 제안한다.\n평범한 인간으로서 너무 잘난 척 하는 거 아닌가?",
115,크리스·기적과 크리스탈,크리스·기적과 크리스탈,재도전,"예상했던 대로, 전투가 시작된 첫 순간, 긴 수염 아저씨는 참패했다.\n두 번째 도전에서 경험 많은 긴 수염 아저씨는 마침내 크리스탈의 궤적을 예측했지만 크리스가 방출한 크리스탈은 예상보다 훨씬 더 강했다……","아군 소녀가 결정 상태일 경우, HP 회복 비율이 50% 감소된다."
116,크리스·기적과 크리스탈,크리스·기적과 크리스탈,사막에 묻힌 논밭,"오늘은 아줌마와 아이가 크리스를 데리고 논밭을 찾았다. 모래바람과 들짐승의 침투를 피하기 위해 농작물은 자갈밭에 파묻혀 있었다. 마을 사람들은 정기적으로 모래밭을 뒤집어 농작물이 지표에 있는 크리스탈의 에너지를 충분히 흡수할 수 있도록 해야 했다.\n그런데, 갑자기 몇 톤의 카오스 생물들이 느슨해진 땅에서 솟아나왔다……","전투 시작 시 랜덤으로 1명의 아군 소녀에게 결정 표식이 부여되며, 2라운드 후 결정된다.\n아군 소녀가 결정 상태일 경우 HP 회복 비율이 50% 감소된다."
117,크리스·기적과 크리스탈,크리스·기적과 크리스탈,"소녀는, 신이다(상)",이곳에서의 전투가 막 끝나자 마을 사람들은 계속해서 다른 곳에서 카오스 생물을 발견하였다. 긴 수염 아저씨는 전투 팀을 끌고 와서 도왔다.\n많은 이들의 노력으로 전투는 마침내 끝났지만 많은 농경지의 농작물들은 전투 중에 파괴되었다. 이 식량을 잃으면 마을 전체가 위기에 빠질 것이다……,"전투 시작 시 랜덤으로 2명의 아군 소녀에게 결정 표식이 부여되며, 2라운드 후 결정된다.\n아군 소녀가 결정 상태일 경우 HP 회복 비율이 50% 감소된다."
118,크리스·기적과 크리스탈,크리스·기적과 크리스탈,"소녀는, 신이다(하)",많은 마을 사람들이 흐느끼는 가운데 크리스는 어떤 촉감을 느끼는 듯했다. 눈을 감고 맨발로 논밭을 걸으며 생명의 소망을 느꼈다. 그녀의 꼬리 끝의 크리스탈이 뛰어 오르며 빛났다……,"전투 시작 시 랜덤으로 3명의 아군 소녀에게 결정 표식이 부여되며, 2라운드 후 결정된다.\n아군 소녀 결정 상태 시 HP 회복율 50% 감소. 피격 시, 에너지 획득 50% 감소."
119,크리스·기적과 크리스탈,크리스·기적과 크리스탈,여신의 일상,"길모퉁이, 회색 옷을 입은 소녀가 크리스에게 기도를 한다……\n여신으로 추앙받자 크리스는 기분이 좋았다.\n바로 이날, 예사롭지 않은 카오스 생물이 마을 근처에 나타났다.","전투 시작 시 랜덤으로 2명의 아군 소녀에게 결정 표식이 부여되며, 1라운드 후 결정된다.\n아군 소녀 결정 상태 시 HP 회복율 50% 감소. 피격 시, 에너지 획득 50% 감소."
120,크리스·기적과 크리스탈,크리스·기적과 크리스탈,"나는, 크리스!","맹렬한 화염이 마을을 휩쓸었다.\n여신의 칭호 때문인지, 보통 사람들의 나약함을 잊을 뻔했고, 회생할 힘을 잃었다.\n마을의 문 앞에서, 크리스는 다시 이 특수한 카오스 생물을 마주쳤다……","전투 시작 시 랜덤으로 3명의 아군 소녀에게 결정 표식이 부여되며, 1라운드 후 결정된다.\n아군 소녀 결정 상태 시 HP 회복율 50% 감소. 피격 시, 에너지 획득 50% 감소."
