id,title,name,dialog,select_text
250,,千鶴子,わーい！\nその後に呂蒙先輩の出し物を見てみたいな～！,
251,新しい友達？,イブ,ふふっ、これで私の勝ちだな。\n約束通り、私に一日付き合ってもらうぞ、呂蒙。,
252,,呂蒙,うぅ……何でこんなことに……\n自分を賞品にするんじゃなかったわ……,
253,,呂蒙,ね、ねぇ、イブさん？他の賞品にしない？\nほら、記念品とか、ヘルメスさんの商品券とか、\n新しい衣装とか、わたしより良いと思わない？,
254,,千鶴子,えっ、なになに？呂蒙先輩も賞品なの？,
255,,イブ,あぁ、簡単な大きさ比べのゲームでな。\n勝ったら賞品が貰えるようだ。,
256,,イブ,呂蒙を説得して、私が勝ったら\n一日付き合ってくれるという話になってな。\nこれで数日は確保できたな。,
257,,呂蒙,うぅ……イブさんずっとここから動かないし、\nもうず～っとやってて……\n何日どころか、1ヶ月分にはなりそう……うぅ……,
258,,イブ,ふっ、約束は破らないでくれよ？\n私はキミを気に入ってるのさ。,
259,,イブ,私といい友達になろうじゃないか？,
260,,呂蒙,うぅ……その言い方、断れないじゃない！,
261,,,……,
262,,イブ,やぁ、ヘルメス。ジュースはあるか？\n酒ばっかりで逆に喉が渇いてしまってな。,
263,,ヘルメス,勿論さ。ミックスジュースでいいか？,
264,,ヘルメス,それより、イブ嬢は何だか嬉しそうだな。\n呂蒙の所で何かいいことでもあったのかい？,
265,,イブ,ふふっ、分かるか？私は呂蒙のことが好きでな。\nついつい楽しんでしまったよ。,
266,,ヘルメス,ほぅ、その「好き」というのは、\n単純に人となりが気に入ったのか、それとも……,
267,,イブ,私が単純に人を気に入ってはいけないのか？\nそれとも、私が何か企んでいるとでも？,
268,,ヘルメス,いや、そういう意味じゃないさ。,
269,,イブ,キミは自分の商売にしか関心を持っていないように\n見えて、実は色々とよく見ているだろう？,
270,,イブ,人間という生き物は、自分が何が欲しいのか、\n何がしたいのか分からないものさ。\n私はただ、そんな人間を助けたいのさ。,
271,,ヘルメス,ふーん……と言うことは、イブ嬢が呂蒙に\n近づいたのも、ただ助けたいだけってことかい？\nまるで神が手を差し伸べているようだな。,
272,,イブ,ふふっ、まぁそうだな。そして私も、\n彼女に助けてもらうかもしれない……,
273,,イブ,ヘルメス、キミは賢い人だ。\n自分が欲しいモノをよく理解している。\nだが、普通の人間には無理だ。,
274,,イブ,普通の人間は、自分で考えて物事を決める力も、\n考え方も備わっていない。,
275,,イブ,そういう人間たちには、道を示す「神」が\n必要なのさ。ま、私は単純に呂蒙のことを\n気に入ってるだけだがな。,
276,,ヘルメス,ほぅ、つまり普通の人たちには\n「神」が必須と言いたいのか？,
277,,イブ,必須とまではいかないさ。だが、人間にはやはり\n心の支えが必要だ。それが「神」なのか、\n別のモノなのかは、人それぞれ。,
278,,イブ,私はそんな支えを見つけていない人間の\n「支え」になりたいと思っているだけさ。,
279,,ヘルメス,ある意味、誰かの「神」になりたい、\nと言うわけか……まあ呂蒙のような人に、\n「神」は必要ないと思うけどな。,
280,,イブ,どうだろうな、私には分からない。\nそれは本人だけが分かることさ。,
281,,ヘルメス,まっ、実際何を考えているのかは分からないが、\n楽しそうで何よりだよ、イブ嬢。,
282,,イブ,あぁ、ありがとう。,
283,,,……,
284,,ヘルメス,（人々は面白いな……神の信徒もいれば、\n神自身、さらには神ではないのに、\n神になろうとする者もいる……）,
285,,ヘルメス,（古の力は「神」となり、人々を従わせる。\n「政治」にも似たような力がある。「神」という\n概念はどう定義したらいいのだろうか……）,
286,,,……,
287,,諸葛亮,コホン、皆楽しんでくれたかな？\n楽しい時間は早いもので、\nそろそろお開きの時間だ。,
288,,諸葛亮,今年同様、来年も盛大に祝えるように、\n一年頑張っていこう！,
289,,ヘルメス,あぁ、実に楽しい時間だったな。\n一年か……あっという間だ。\nこの学園での生活も、案外悪くないな。ふふっ。,
