id,title,name,dialog,select_text
215,,ウリエル,ん？鶴ってあの鶴ですよね？\n千鶴子様の名前にもある……,
216,,千鶴子,うん！そして鶴華の鶴だよ！,
217,,*,なんで急にそんなことを？地名になるくらいだし、\nここにもたくさんいるんじゃないの？,
218,,千鶴子,実はここに鶴はいないんだ～。\n話によると、鶴は神様の使いであり、\n神様が降臨する時にしか現れないんだって！,
219,,千鶴子,神社のみんなは絵巻でしか鶴を見たことないんだ。\nチヅもね、子供の頃はずっと\n鶴は神話の中の生き物だと思ってたもん。,
220,,千鶴子,でも、偶然聞いた試練に参加する人の話で、\n鶴が実在することを知ってね。\nそれからずっと興味があるんだ～。,
221,,ウリエル,鶴は日常的に出会うような鳥ではないけど、\n地域によっては見れることもありますね。\n私も何度か見たことがあります。,
222,,千鶴子,へぇ～いいなぁ～。ねえ、鶴って本当に真っ白で、\n翼にちょっと黒い羽があって、頭は真っ赤なの？,
223,,*,言い方はちょっとあれだけど、\nまぁ、大体あってるよ。,
224,,千鶴子,わぁ～！絵と本当に一緒なんだ～！\nきっと昔、ここにも鶴が現れたから、\nちゃんと絵に残ったんだろうな～。,
225,,千鶴子,あーあ、チヅも自分の目で本物の鶴を見たいな～！\nちょっとだけなら、羽を触ってもいいのかな？,
226,,,楽しそうにピョンピョン飛び跳ねる千鶴子に、\n突然走って来た誰かがぶつかった。,
227,,？？？,ちっ、ジャマだ！どけ！,
228,,ウリエル,おい！その態度はなんだ！\nクッ、そのまま走り去るとは……,
229,,*,（あの人からなんか違和感を感じる……\n考えすぎかな？それより今は千鶴子ちゃんだ。）,
230,,*,千鶴子ちゃん、大丈夫？\nケガはない？起きれる？手を貸すよ。,
231,,千鶴子,いっててて、大丈夫！\nちょっと尻もち着いちゃっただけだから……,
232,,ウリエル,あの人の格好なら覚えています。\n私が捕まえて来ます！,
233,,千鶴子,いいよいいよ！ありがとう。\n私もちょっとはしゃぎすぎちゃったし、\n気にしないで。,
234,,千鶴子,それにあの格好、試練に参加するチームの\n制服だから、たぶん特定は難しいよ。,
235,,？？？,何やら騒がしいようですが、\n千鶴子さん、何かありましたか？,
236,,千鶴子,禰宜様！大丈夫です！\nさっきチヅにぶつかってきた人がいて、\nそれに対してお友達が怒っているだけです。,
237,,禰宜,うむ、最近試練に参加する者たちの行動が\n少し目に余るようになってきましたね……\nあとで誰かに注意させておきます。,
238,,禰宜,それはさておき、こちらがお友達ですか？,
239,,*,初めまして、僕は*。\nこちらはウリエルです。,
240,,玖月,ご丁寧にどうも、私は玖月と申します。\nこの鶴華神宮の禰宜を勤めさせております。,
241,,千鶴子,禰宜様、こちらの方々はみんないい人ですので、\nご安心ください！,
242,,玖月,うむ、千鶴子さんが友達だと言うのなら、\n問題はないでしょう。ですが千鶴子さん……,
243,,玖月,祭りの準備は終わりましたか？\n夜までに終わらせないと、\n今晩の泉恵様のお話を聞けませんよ？,
244,,千鶴子,あっ、ごめんなさい！今すぐ取り掛かります！,
245,七夜・其ノ三,泉恵,昨夜はたしか、鳶尾の命様が村人たちに\n裏切られて、青取の手に渡ってしまったところまで\nじゃったかのう……,
246,,泉恵,赤取の頭は鳶尾の命様が火に投げ入れた。だから、\n青取は鳶尾の命様にも同じ目に合わせるため、\n辺りに火をつけるよう、村人たちに命じたのじゃ。,
247,,泉恵,裏切られた鳶尾の命様じゃが、\n村人たちを助けられるなら……と、\n自ら火の中へと歩いたのじゃ。,
248,,泉恵,火に近づくにつれ、鳶尾の命様はふと\n妖怪の屋敷で見つけた絵巻の内容を思い出した。,
249,,,そこからは千鶴子も含め、その場にいる全員が\n泉恵と声を合わせてこう続けた。,
250,,巫女たち,鳶尾の命様の中に眠る久遠なる血脈が、\n絵巻の内容と共鳴した。,
251,,巫女たち,鳶尾の命様の体は自然と動き出し、\n絵巻に描かれた人と同じように、\n火の中で踊り始めた。,
252,,巫女たち,まるで昔から知っていたかのように、\n鳶尾の命様は流れるように踊った。,
253,,巫女たち,その舞に応えるかのように、\n空から黒と白、そして赤をまとった\n聖なる仙鶴の群れが現れた。,
254,,巫女たち,仙鶴が羽ばたくと、雨は止み、雲はかき消され、\n光が大地を照らした。,
255,,巫女たち,"
すると、我らが神――
御晷ノ炎大神（みひかげのほむらおおみかみ）が
仙鶴の群れの中から現れ、
鳶尾の命様を火の海から救い出したのだ。",
256,,巫女たち,御晷ノ炎大神は鳶尾の命様を抱え、\n空高く舞上がった。\n村人たちは後光が差す二人のその姿を仰いだ。,
257,,巫女たち,これが初めて神が澤祁の地に顕現した日のことだ。\n鳶尾の命様が踊った舞は、今の神楽となった。,
258,,泉恵,ふむふむ、皆ちゃんと覚えているねえ～。,
259,,*,（小声）\nいやいやいや、何回聞いたら\nここまで完璧に覚えられるんだよ……,
260,,泉恵,一方、鳶尾の命様が踊り始めたのを見て、\n青取は慌て始めた。,
261,,泉恵,鳶尾の命様を止めようと\n火の中に飛び込もうとした青取だったが、\nまるで火が自我を持ったかの如くその道を阻んだ。,
262,,泉恵,青取は涙を流し、雨で火を消そうと試みたが、\nどんなに雨を降らしても、\n火の勢いは一向に弱まらなかった。,
263,,泉恵,ヤツは神楽を舞う鳶尾の命様をただ見ることしか\nできず、御晷ノ炎大神が召喚されるのを\n青ざめた顔で見ていた。,
264,,泉恵,御晷ノ炎大神と青取の戦いは一方的だったが、\n逃げに専念した青取を追ったその戦いは、\n実に七日も続いた。,
265,,泉恵,戦いは苛烈を極め、地形をも変えるほどだった。\n最後は御晷ノ炎大神が陽の光で戦いを収束し、\n青取を灰にして、ようやく長い戦いが終わった。,
266,,泉恵,しかし、妖怪の消え去った澤祁も\n大きな代償を払った。,
267,,泉恵,かつての平原は、跡形もなく険しい山谷に変わり、\n黒ずんだ土地では植物も育たなかった。,
268,,泉恵,澤祁の民は神に土地が元に戻るよう願い、\n鳶尾の命様も祈祷を捧げた。,
269,,泉恵,すると神は仙鶴と共に澤祁の空を飛び回り、\n大地に生命力を宿した。,
270,,泉恵,ただ、村人が鳶尾の命様を裏切った罰として、\nかつてのような豊かさは与えてくれなかった。,
271,,泉恵,毎日きちんと田を耕し、ようやく一年に一度だけ\n収穫できる、そんな土地になってしまった。,
272,,泉恵,その後、鳶尾の命様は神の命により神社を建てた。\n神の真名を伏せるため、その使者たる仙鶴に\nちなんで、「鶴華神宮」と名付けた。,
273,,泉恵,これがこの神社の由来じゃよ。,
274,,ウリエル,なるほど！妖怪は倒され、鳶尾の命様も無事。\nハッピーエンドですよ、先輩！良かったですね！,
275,,*,そうだね～。でも、神の試練については\nまだ何も言われてないような……？,
276,,ウリエル,そう言えばそうですね……\n一言一句ちゃんと聞いていたはずなのに、\nそれについてのお話はありませんでした。,
277,,,二人の疑問に答えるかのように、\n泉恵はこう続けた。,
278,,泉恵,妖怪たちの脅威は、神によって暫く去ったが、\n不死身である妖怪のことだ、\nいつかきっと再びこの地を襲うだろう。,
279,,泉恵,そこから神の試練に続く伝説が始まるのじゃよ。\nさて、今日はここまでにしようかのう。\n明日もぜひ、聞きに来ておくれ。,
280,,*,あっ、まだ続きがあるんだね……,
281,,,……,
282,,イザナミ,ここで、あなたと手を繋ぎ、一緒に歩いた……\n今はもう、私一人……,
283,,イザナミ,どこにもイザナギが戻った痕跡がないわ……\nあなたはもう、故郷を完全に忘れたの……？,
284,,イザナミ,必ず、必ず見つけ出すわ……イザナギ……,
285,,高順,イザナミ様！,
286,,イザナミ,……高順？どうしてここに？,
287,,高順,鶴華神宮に幽夢学園の生徒が来るという情報が\n入ったので、呂布様からイザナミ様にお願いが……,
288,,イザナミ,私はただ、イザナギを探すためにここに来たの……\n故郷で手は出さないわ。,
289,,高順,ですが、呂布様が……,
290,,イザナミ,……帰ってそのまま伝えなさい。\n別にあの人に従わないといけない理由なんて、\n私にはないわ。,
291,,イザナミ,決して変な気を起こさないでね？\n鶴華神宮には、守護者が存在しているんだから……,
292,,高順,はっ。ただ……先ほど神社の周辺で\nカオスのエネルギーを発見しまして……,
293,,イザナミ,カオス……！,
294,,イザナミ,わかったわ。カオスを見つけたら、\n私がなんとかするわ……,
295,,イザナミ,ん？足音……？\nどうやらこの地の安寧を脅かす人が来るようね……\n他に用事がないのなら、私は行くわ……,
296,,高順,はっ、では私も呂布様に報告するため、\n帰還します。,
297,,*,ん……？,
298,,ウリエル,うむ、お話がここで終わっていないということは、\nまだ続きがあるのでしょう。\n鳶尾の命様には幸せになって欲しいですね。,
299,,ウリエル,ん？先輩？どうしたのですか？,
300,,*,あっ、いや、またあの気配を感じたんだけど……\n一体誰なのかな……なんで思い出せないんだろう？,
301,7キミも「子」,千鶴子,*～、こっちこっち！,
302,,千鶴子,あれ、今日は一人？\nウリエルのお姉ちゃんはいないの？,
303,,*,ウリエルは昨日、お話の結末を聞いたせいで\n興奮しちゃったみたいで、寝不足気味だから、\n仮眠させているんだ。千鶴子ちゃんは何してるの？,
304,,千鶴子,お祭りの準備だよ！\n明々後日の夜にやるんだけど、二人は来れる？,
305,,*,祭りと聞いちゃあ、来ない訳にはいかないね！\nウリエルと一緒に来るよ。,
306,,千鶴子,ホント！？じゃあ、チヅが案内してあげるね！\n屋台以外にも、神楽舞があるんだ～。,
307,,千鶴子,文献にあった神楽を再現するんだよ！\n実際にはどんな感じだったかわからないけど、\nすご～く素敵なんだよ！,
308,,千鶴子,チヅもいつか舞台に立ちたいな～。\nまだ巫女見習いだし、踊りもヘタなんだけどね……,
309,,*,千鶴子ちゃんならきっとできるさ！\nその時はぜひ僕も呼んでね。,
310,,千鶴子,もちろん！あっ、そうそう、\n今日は麻美姐もいるよ。ほらあそこ！,
311,,,千鶴子が指差す方を見ると、\n麻美ちゃんと泉恵おばあちゃん、そして玖月禰宜と\n前に椅子を持って来てくれた巫女ちゃんがいた。,
312,,,ふと、麻美ちゃんと目があった。,
313,,*,やべっ、千鶴子ちゃんと一緒にいるところを\n見られたら……,
314,,麻美,ちょっとあんた！\nなんで千鶴子と一緒にいるのよ！,
315,,*,あぁ、やっぱり……,
316,,千鶴子,あれ？麻美姐と*は\n友達じゃないの？,
317,,麻美,あんた、千鶴子に何吹き込んだのよ？,
318,,泉恵,麻美子や、お友達には優しくしないか。,
319,,？？？,おばあちゃん、麻美姐に子はついてないから。,
320,,泉恵,ん？渓子（けいこ）、どうしたのじゃ？\n麻美子は麻美子じゃろう？,
321,,渓子,だーかーらー！麻美子じゃなくて麻美だよ！,
322,,泉恵,おおー！そうじゃったそうじゃった。\n歳をとると記憶も耳も悪くなっていかんの～。\nホッホッホッ……,
323,,*,麻美子？それはそれで可愛いじゃないか、\n千鶴子ちゃんとおそろいみたいで……\nってイテ！？,
324,,渓子,ダメ！麻美姐の名前はそのままがいいの！\n（そう言ってポカスカ叩く）,
325,,麻美,いいぞ渓子、もっとやれ！それからおばあちゃん、\nこいつは友達なんかじゃないわよ！,
326,,玖月,ふむ、知らない人に対しては\nもっと警戒心持たないと……\n泉恵様は優しすぎますので。,
327,,泉恵,ホッホッホ……老体と言えど\n人を見る目だけは衰えてないから安心せい。\nこの子は悪い子ではないよ。,
328,,玖月,泉恵様がそうおっしゃるのなら……,
329,,*,さすがおばあちゃん、一生ついていきます！\nそれにしても、何で玖月さんはおばあちゃんのこと\n「様」付けで呼ぶのですか？,
330,,麻美,泉恵おばあちゃんは宮司なのよ。最近は禰宜様が\nほとんどのことをやってくれているけど、禰宜様は\n変わらずおばあちゃんのことを尊敬しているのよ。,
331,,*,へぇ、そうなんだ。\n話を戻すけどさ、渓子ちゃんは何でそんなに\n「麻美子」って名前が嫌なの？,
332,,渓子,だって神社にはね、名前に「子」がつく子が\nたくさんいるんだもん。だから、せっかく「子」が\nついていない麻美姐の名前は守らないとダメ！,
333,,*,へぇ、千鶴子ちゃんと渓子ちゃん以外に、\nどんな名前の子がいるの？,
334,,千鶴子,えっとね、玉子に恭子でしょ……\n桜子、好子、亜子……他にもたくさん！,
335,,渓子,泉恵おばあちゃんは名前をつける時、\n絶対に「子」をつけるのよ……,
336,,渓子,でも麻美姐はお父さんとお母さんから\nもらった名前だから、子を付けちゃだめなの！,
337,,麻美,ここにいる子の多くは拾われてきた子なの。\n私も両親を事故で亡くした後、ここに来たのよ。,
338,,麻美,渓子は親に憧れがあってね。\n名前に「子」がついていない子は、\n捨てられた子じゃないって思ってるのよ。,
339,,*,それは、その……無神経なことを言ってごめん……\nということは、千鶴子も……？,
340,,麻美,大体の人は、育てられない子をここに\n連れてくるんだけど、千鶴子はちょっと違うの。\nある寒い冬の日、神社の前に置かれてたのよ。,
341,,麻美,もしあの日、私が出かけていなければ、\n今頃千鶴子は生きていなかったかもしれないわ。\nあの子が体調を崩しやすいのも、その影響かも。,
342,,,……,
343,,*,みんな孤児だったんだね……でもそっか、\n千鶴子ちゃんを発見したのが麻美ちゃんだから、\nこんなに大事にしているのか……,
344,,*,神社の人たちが優しい人で本当に良かった……\nおっと、急いで戻ってウリエルを呼んでこないと、\nお話の時間に間に合わないな。,
345,,イザナミ,……,
346,,*,ん？そこにいるのは……あっ、待って！,
347,,*,えっと、イザナミ？,
348,,イザナミ,まさか、そっちから来るとは思わなかったわ……,
349,,*,（あっ、ヤバ！？ウリエルがいない時に……！）\nまさか、呂布も……？,
350,,イザナミ,安心しなさい……呂布はいないし、\n境内でやり合うつもりはないわ。,
351,,*,境内以外なら手を出すかも、ってこと？\n気を付けて帰るよ……,
352,,イザナミ,相変わらずの減らず口ね……,
353,,*,僕じゃ逆立ちしたって君には勝てないからね。\n君がその気じゃないのは分かっているけどさ……\n何か悲しいことでもあったの？,
354,,イザナミ,……勘が鋭い子は嫌いよ……\n「イザナギ」という人をさがしているの、\n会ったことあるかしら？,
355,,,そう言ってイザナミは、\n「イザナギ」の特徴を語った。,
356,,*,うーん……ごめん、印象にないや。\n君の大事な人なのかい？\nだったら、みんなにも聞いてみるよ。,
357,,イザナミ,……ええ、大事な……とっても大事な人よ。\nもし、イザナギを見つけてくれたら、学園側に\nつくことも考えるわ。あまり期待はしないけれど。,
358,,イザナミ,ほら、さっさと行きなさい……\n神社でお話を聞く時間でしょ？,
359,,*,いつから僕たちを観察してたんだよ……？,
360,8七夜秘,ウリエル,うっ、まさかこんな時間まで寝てしまうとは……\n騎士失格です……,
361,,ウリエル,明日はいつも以上に早起きして、\nその分鍛錬し直さないと……！,
362,,*,はっはっは、たまには息抜きをしてもいいだろ？\n物語が良い結末で良かったね。,
363,,ウリエル,ええ……鳶尾の命（えんびのみこと）様の物語を\n聞くと、かつての我が王も神の……,
364,,ウリエル,でもこれを言い訳にして怠けてはいけません！\n戒めとして、やはり明日は倍以上に鍛錬します！,
365,,泉恵,御晷ノ炎大神（みひかげのほむらおおみかみ）が\n青取を撃ち滅ぼし、鳶尾の命様が鶴華神宮を建て、\n御晷ノ炎大神を祀ったところまでじゃったかな。,
366,,泉恵,さて、悪は滅びたように見えたが、\n人々の恨み憎しみを糧とする妖怪どもは、\nいつかまた蘇り、澤祁に災いをもたらすだろう。,
367,,泉恵,ただ、妖怪は肉体の損傷が激しいほど、\n復活に有する時間も長くなる。,
368,,泉恵,やつらの復活をできるだけ伸ばすため、\n御晷ノ炎大神は赤取の肉体も\n灰になるまで燃やした。,
369,,泉恵,そして二匹の妖怪の遺灰を集め、\n神社の奥にある「神域の狭間」を神力で開くと、\n遺灰をその最奥に封印した。,
370,,泉恵,さらに肉体を滅ぼすだけでなく、ヤツらの怨念を\n具現化させ、その怨念を撃ち破ると、\n同じく復活を延ばすことができるのだ。,
371,,泉恵,その「神域の狭間」に行き、\n怨念を撃ち滅ぼすことが、\n今でも我ら鶴華神宮に伝わる「神の試練」じゃ。,
372,,泉恵,当時の人々は次々と神の試練に挑戦したが、\n成功する者はおらず、けが人と死者が絶えなかった。,
373,,泉恵,その状況を見て、鳶尾の命様は\n神に皆を守る手段を乞うた。,
374,,泉恵,神はその願いに応え、\n神力で二つの神器を作りだした。,
375,,泉恵,一つは神域の狭間の外にある池に沈められた。\nそこからは様々な宝が生み出されるようになった。,
376,,泉恵,あらゆる宝物を生み出すその池が、\n今の「千願の池」じゃ。,
377,,泉恵,千願の池から宝物を取り出すには、\n二つ目の神器「神様の凝望」が必要だ。,
378,,泉恵,この「神様の凝望」は鏡の形をしているが、\n普段は何も映し出すことはない。,
379,,泉恵,もしその鏡に自分の姿が映っていたならば、\nそれは神に見つめられている、\nという言い伝えがある。,
380,,泉恵,その鏡は鳶尾の命様が保管しておる。\n優しい鷲尾の命様は、試練に挑む者たちに\n鏡から宝物の鍵を出し快く渡していた。,
381,,泉恵,それが「折鶴」じゃ。,
382,,泉恵,当時の者たちは、「折鶴」は勇気ある者たちへの\n褒美だと思い、それを「神様の褒美」と呼んだ。,
383,,泉恵,そしてその褒美を手に、「千願の池」から\n怨念に対抗しうる宝物を手にいれられるように\nなったのだ。,
384,,ウリエル,なるほど……\nそれが試練とあの池の由来なのですね……,
385,,*,その理屈だと、折鶴を生み出す「神様の凝望」を\n手に入れたら、宝物が取り放題じゃない？,
386,,泉恵,最初の内は快く「神様の褒美」を\n皆に分け与えていた鳶尾の命様だったが、,
387,,泉恵,次第に宝物だけをくすねて帰る者が現れた。,
388,,泉恵,それに激怒した鳶尾の命様は、外部に流出した\n宝物を回収し、その後は神域の狭間に入る者にだけ\n与え、ここを去る時には回収するようにした。,
389,,ウリエル,この流れは……嫌な予感がします。,
390,,泉恵,そしてついにある夜――\n村のならず者たちが集い、鳶尾の命様を始末して、\n「神様の凝望」を奪おうとした。,
391,,泉恵,元々巫女の数は少なく、\nその上長年戦い続けていたため、ケガ人が多く、\nならず者たちを止めることはできなかった。,
392,,泉恵,鳶尾の命様は鏡を守りながら、多くのならず者と\n戦ったが、数には勝てるわけもなく、傷を負った。\nそして、狭間のとある部屋へと逃げ込んだ。,
393,,泉恵,そしてならず者たちに追いつかれる直前、\n鳶尾の命様は鏡を割り、神域の狭間に破片を\nばらまくと、静かに息を引き取った。,
394,,泉恵,目的を果たせなかったならず者たちは\nそれを見て、そのまま立ち去った。,
395,,泉恵,こうして、「神様の褒美」を手にいれたければ、\n狭間の中に行き、試練を通して、\n鏡の欠片から入手するしかなくなったのじゃ。,
396,,*,まさか……こんなの、あんまりだよ……,
397,,ウリエル,太陽のように光輝く人は皆、\n沈む運命なのですか……,
398,,泉恵,鷲尾の命様のご遺体は、朝を迎えたと同時に\n光に包まれ、やがて一羽の鶴となり、\n遠くへと羽ばたいていった。,
399,,泉恵,その様子は、きっと御晷ノ炎大神に召されて、\n天に昇ったんじゃと言われておる。,
400,,千鶴子,あっ、ここにいたのね。この話を聞いたら、\nきっとウリエルさんはまた泣くだろうな～って、\n様子を見に来たよ。,
401,,*,千鶴子ちゃんは意外と大丈夫なんだね。\n君もあんなに鳶尾の命様が大好きなのに。,
402,,千鶴子,だって泉恵おばあちゃんが言ってたじゃない。,
403,,千鶴子,鳶尾の命様はただ姿を変えて、\n天界に行っただけよ。\nきっと、そこで幸せに暮らしているわ！,
404,,ウリエル,だがそれは、鳶尾の命様を惜しむ人たちが\nそう思いたいだけなのでは……,
405,,千鶴子,でもでも、神様は本当にいたのよ？\nあんなに鳶尾の命様を大事にしていた神様が、\nあのまま死なせる訳ないじゃない！,
406,,千鶴子,きっと見かねた神様は、鳶尾の命様を\nもっと良い所に住ませたいと思ったのよ！,
407,,千鶴子,鳶尾の命様の数々の祈りに応えた神様だもの。\nきっとそうするに違いないわ。,
408,,千鶴子,少なくとも、チヅはそう信じてるよ！,
409,,*,そうだな～。神様に愛されている人なら、\n何か奇跡が起きてもおかしくないよな！,
410,,ウリエル,そう、ですね……ただ、やはり悔しいです。\n皆のために頑張っていた人が、\nなぜこのようなことに……,
411,,ウリエル,悪い予感はつくづく当たるものですね……\nもっといい方法があったはずなのに……,
412,,千鶴子,《鶴華異聞》によると、当時の鳶尾の命様は\nまだ16～17歳ぐらいで、より良い方法を\n考える余裕がなかったのかもしれないわ……,
413,,*,でも「神様の凝望」が手に入ったら、\n宝物が取りたい放題だしな。\n変な気を起こす人がいない方がおかしいさ。,
414,,千鶴子,ふふ～ん！もちろんそれ目当てで\n試練に参加する人もたくさんいたけど、\nみ～んな返り討ちにあって帰ったわ！,
415,,,……,
416,,？？？,「神様の凝望」か……,
417,9破鏡,,僕は昨日聞いた話を、\n諸葛亮とシルバー先輩に通信で伝えた。,
418,,*,今知っている情報はこれぐらいかな。,
419,,諸葛亮（投影）,ふむ、伝説の真偽についてはともかく、\n現状宝物を手に入れるには、\n試練をクリアするしかないようだな。,
420,,シルバー（投影）,いや、これはあくまで宝を守るために、\n対外的に作った話の可能性もなくはない。,
