id,title,name,dialog,select_text
421,,シルバー（投影）,もしかすると、神社のどこかに\nまだ秘密が隠されている可能性もある。,
422,,ウリエル,考えすぎではないでしょうか、シルバー先輩……\n私はこれが真実だと思っています。,
423,,諸葛亮（投影）,うむ……例え秘密があったとしても、\n一般の巫女は知る訳がないか……,
424,,諸葛亮（投影）,秘密を握っているとしたら、宮司か禰宜だろう。\nしかし、貴殿の話からして、この二人から\n情報を引き出すのは難しそうだな。,
425,,*,でも、僕たちもカオスの侵攻を止めるため――\nすなわち世界を守るために戦っている訳だし……,
426,,*,それをあの人たちにちゃんと伝えれば、\nちょっとは味方してくれたりするんじゃ……,
427,,諸葛亮（投影）,秘密は外に出た瞬間、秘密ではなくなる。\n本当に秘密があったとして、彼女たちはきっと、\n誰にも教えないだろう。,
428,,シルバー（投影）,とは言え、我々にもあまり余裕はない。,
429,,シルバー（投影）,やはり宝物を直接手に入れられる方法が\n何か欲しいな……,
430,,*,シルバー先輩、それだと僕らが宝を狙う\nならず者たちと一緒になってしまうよ……,
431,,*,神社の人たちは皆いい人だし、\n何とか融通を利かせることができないか、\n頑張って説得してみるよ。,
432,,ウリエル,私も先輩と同意見です。巫女たちは試練に\n詳しいですし、味方につけた方が今後のためかと。\n実際、麻美様から少しアドバイスを頂きました。,
433,,シルバー（投影）,……そうか、現場の状況を知っている\nあなたたちに任せよう。,
434,,*,はい！ありがとうございます！,
435,,麻美,ん？*とウリエルさんじゃない。\nあんな隅っこで何してるのかしら？,
436,,麻美,宝物……秘密？\n神社の人といい関係……！？,
437,,麻美,どういうこと！？\nあんたたちなら信じられると思ってたのに！,
438,,*,えっ！？麻美ちゃん、いつからそこに……！？,
439,,麻美,うるさい！あんたたちが神社の秘密を探るため、\nわざと私たちに近づいてきてたなんてがっかりよ！,
440,,麻美,まだ何かしたわけじゃないから、\n神社の掟に倣って何もしないけど……,
441,,麻美,少しでもおかしなことをしたら、\n容赦なく叩き出してやるから！覚悟なさい！,
442,,*,あっ、ちょっと麻美ちゃん！誤解だよ！,
443,,ウリエル,麻美様、決してそんなつもりは……！\n私たちの話を……！,
444,,*,あっ……行っちゃった……\nどうしよう、やっと少し歩み寄れたのに……,
445,,*,通信する場所を選ぶべきだった……,
446,,千鶴子,あれ？*とウリエルさん！\nどうしたのこんなところで？……頭抱えて、何かあったの？,
447,,千鶴子,ほらほら、元気を出して！毎日楽しまないと！\n悩み事ならチヅが聞くよ？,
448,,*,あはは……実はさっきちょっとした誤解で\n麻美ちゃんを怒らせてしまってね……,
449,,ウリエル,きちんと説明したいので、どこに行けば\n麻美様に会えるか教えてもらえませんか？,
450,,千鶴子,うーん……こういう時の麻美姐って、\n探すの結構大変なんだよね……難しいかもなあ。\n伝言で良ければしようか？,
451,,*,ありがとう、千鶴子ちゃん。\nでも、できればちゃんと自分たちで言いたいな。,
452,,*,千鶴子ちゃんからも麻美ちゃんに言って\nもらえないかな？一回話し合えないかって。\nやっぱりダメなら、その時は伝言をお願いするよ。,
453,,千鶴子,うーん、難しいけど分かった！\n全力で麻美姐を説得してみるよ！,
454,,千鶴子,麻美姐もせっかく外のお友達ができたのに、\nこのままじゃダメだよね！,
455,,*,本当に申し訳ないけど、お願いね！,
456,,,……,
457,,ウリエル,うまく麻美様を説得できるでしょうか……,
458,,*,まぁ無理だったら千鶴子ちゃんに\n伝言をお願いするだけさ。\n何がともあれ、誤解されたままじゃまずい。,
459,,イザナミ,……また会ったわね。,
460,,ウリエル,なっ、呂布の仲間がなぜここに！？\n先輩、お気をつけください。,
461,,イザナミ,……まさかこの子に私のことを言わなかったの？,
462,,*,安心してウリエル！この前も会ったんだ。\nもし本当に何かする気があるのなら、\nその時に手を出してきたさ。,
463,,ウリエル,えっ！？いつのことですか！？,
464,,*,ほら、君が寝てたあの日……,
465,,ウリエル,なっ……！？やはり怠惰は大敵……\n先輩にもしもの事があったら、私は……私は……！,
466,,*,そんなに思いつめなくても。\n僕は無事だった訳だし。,
467,,イザナミ,コントはそれぐらいにしなさい……\nところで、この時間はお話の時間でしょ？\nなぜ今日はここにいるの？,
468,,*,僕たちが神社の秘密を狙ってる悪人だと、\n巫女さんに誤解されてしまってね……,
469,,*,それであんまり行く気になれなくてさ……\n麻美ちゃん、おばあちゃんやみんなに\n変なこと言ってないといいな……,
470,,イザナミ,神社の秘密……\n「神様の凝望」のこと？,
471,,ウリエル,知っているのですか？,
472,,イザナミ,知っているも何も、実物も見たことあるわ……\nそうね、今日は気分がいいし……,
473,,イザナミ,その後のこと、私が教えてあげるわ。,
474,10七夜・美,イザナミ,鳶尾の命が神に連れて行かれたところからで\nいいわよね？その後……具体的にどれくらい\n経ったかは覚えていないけど……,
475,,イザナミ,当時の巫女は、よく神のお告げが聞こえていて、\n神はそれなりに力を示してくれていたわ……,
476,,*,詳しいね、もしかして実体験？,
477,,イザナミ,そうだと言ったら、信じる？,
478,,ウリエル,では、鳶尾の命様は、\n本当に神様に連れて行かれただけで、\n実際は生きていたのですか！？,
479,,イザナミ,そうかもね。,
480,,ウリエル,そ、そんな適当な……,
481,,イザナミ,でもある日、\nついに赤取と青取が復活してしまった。\nまだ怨念も時間も足りていないはずなのに、ね……,
482,,イザナミ,しかも、復活した二匹は、\n以前よりも強くなっていたわ。,
483,,ウリエル,なっ！なぜそのようなことが……！？,
484,,イザナミ,カオスよ……\nヤツらはカオスの力を吸収したの……,
485,,*,そんなあっさりと……\nもう少しこう、聞く人を引き付けるような\n言い方した方がいいんじゃない？,
486,,イザナミ,……私はただ事実を言っただけよ。\n物語なら、おばあちゃんの所に行きなさい。,
487,,*,でも、まさかカオスがね……\n一体いつの時代から存在してたんだろう？,
488,,イザナミ,さあね……言い伝えでは、妖怪が復活する時、\n「神様の凝望」も現れると言われていて……,
489,,イザナミ,実際、妖怪の復活と共に、\n一枚の鏡が狭間から飛び出し、\n当時の宮司の手に収まったそうよ。,
490,,イザナミ,宝の力で怨念を抑えることはできても、\n妖怪の本体には無力だった……,
491,,イザナミ,時に洪水、時に干ばつと災害を起こしては、\nカオスと共に澤祁をめちゃくちゃにし、\n人々の命を奪っていったの……,
492,,イザナミ,でも、人々はそこまで恐れていなかった……\nだって、ここには守ってくれる神がいると\n皆信じていたから。,
493,,イザナミ,だけど、たとえどんなに巫女たちが\n祈りを捧げても、神は返事をしなかったわ。,
494,,イザナミ,それに焦った人々は、次々と神社の方へ逃げた。\n神社なら、妖怪を退治する術がある。\n神社だけが、唯一安全な場所だったわ。,
495,,イザナミ,でも、逃げ遅れた人もいた……,
496,,,そこでイザナミの話が止まった。,
497,,,彼女は、カオスに浸食され結晶化した顔の一部を\n撫でながら、一筋の涙を流した。,
498,,イザナミ,あぁ……イザナギ、み、見ないで……,
499,,イザナミ,私、治すから……この醜い顔を、治すから……,
500,,イザナミ,私のそばから、離れないで……,
501,,ウリエル,せ、先輩、これは一体……？,
502,,ウリエル,（小声）つまり、イザナギという人が、\nイザナミの顔が浸食されたことにより、\n彼女から離れたということですか？,
503,,*,（小声）\nどうだろうね……\nイザナギはイザナミの大事な人らしいけど。,
504,,*,落ち着いて、イザナミ！\nイザナギはここにいないから！,
505,,イザナミ,い、いない？なぜ？\nどこに行ったの……？イザナギ……,
506,,ウリエル,大事な人が大変なことになっているというのに、\nそばから離れるなんて……！,
507,,ウリエル,いや、もしかしてこれも誤解かもしれない……\n私たちが麻美様に誤解されているように……,
508,,ウリエル,事実ではあるが、真実ではないかもしれない……！,
509,,ウリエル,もしかして、そのイザナギという人は、\nあなたを元通りにする方法を探しに、\n急いで旅立ったのでは？,
510,,ウリエル,だけど方法がなかなか見つからず、\nそれでも諦めきれずに探している……あなたとの\n再会をハッピーエンドにするために……！,
511,,イザナミ,そう、なのかしら……\nイザナギはまだ、私を思っていてくれるの……？,
512,,*,確かにその可能性は十分あるね！,
513,,*,（小声）\nちょっと！勢いでフォローしたけど、\nその推測、どれぐらいの自信がある？,
514,,ウリエル,（小声）\n分かりません。でも、心から愛し合っていた\n者たちならば、可能性はあるでしょう？,
515,,ウリエル,（小声）\nそれに、少しでも希望があった方が、\n彼女も幸せなのではないでしょうか……？,
516,,ウリエル,千鶴子様の考え方をお借りしますが、\n誰だって何事も良い最後を迎えられる可能性を\n信じたいと思うのです。,
517,,イザナミ,ふぅ……取り乱してしまったわ……\n慰めの言葉だと分かっていても、\n少しだけ、ほんの少しだけ気が楽になったわ……,
518,,イザナミ,もし今後、あなたたちと敵対することになっても、\n一度だけ見逃してあげるわ……,
519,,*,それはありがとう。\nできれば敵対しないことを願うよ。,
520,,イザナミ,ふっ、では続きを……\n返事はなくとも、巫女たちは希望を捨てずに、\n祈りを捧げ続けたわ……,
521,,イザナミ,そしてある日、\n闇夜に包まれた澤祁の空に鶴の一声が響き渡り、\nようやく日差しが差し込んできた……,
522,,イザナミ,眩しい日差しが澤祁を照らし、\n妖怪とカオスは光を浴びた途端、灰燼と化したわ。,
523,,イザナミ,噂では、その日輪が御晷ノ炎大神の本体で、\nその傍で飛び回っていたのが、\n鳶尾の命という話よ。,
524,,イザナミ,そして、巫女たちは再び妖怪の灰をかき集め、,
525,,イザナミ,「神様の凝望」と共に、\n神域の狭間に封じ込めたわ。,
526,,イザナミ,その後、\n神社は神に感謝を捧げる儀式を行ったけど、\n神から何か返事が来ることはなかった。,
527,,イザナミ,それどころか、\n以来、神からの声を聞いた人は誰一人いないわ……,
528,,イザナミ,それでも澤祁の人々は、\n神がいると信じ続けている……\n千願の池が神の力を示し続けているからね。,
529,,*,えっと、何度も聞いて悪いけど、実体験なの？,
530,,イザナミ,……一部は、ね。全部じゃないわ。\nそれ以外は人伝に聞いたもの。\n私は、少しもその神を尊敬していないもの……,
531,,イザナミ,あれはただ、人々から尊敬されたい、\n神を騙ったまがい物よ……,
532,,イザナミ,最初からカオスと妖怪を滅ぼしていたら、\nたくさんの悲劇を免れたわ……！,
533,,ウリエル,えっと、 後付けのようで申し訳ないのですが……\n実は騎士団の先輩から聞いた話で、,
534,,ウリエル,とある地域のカオス殲滅作戦と、\nその地にまつわる「神」の討伐、\nという話があって……,
535,,ウリエル,当時、作戦のためにその地に向かうと、\nカオスは既に殲滅された後で、\n村の人々は皆、神の奇跡だと言っていた、と……,
536,,ウリエル,先輩たちが後に色々と調べてみると、\n恐らくその「神」がカオスを道連れにした形で、\nその地を守ったようなのです。,
537,,ウリエル,その地の名は――「澤祁」。\nこんな大事なことを、今思い出しました。,
538,,ウリエル,きっと、最初から滅ぼさなかった訳ではなく、\n滅ぼせるほどの力がなかったのではないかと、\n私は思います……,
539,,イザナミ,道連れ……？そ、そんなはずは……,
540,,,……,
541,,？？？,妖怪が復活すれば、\n「神様の凝望」が現れる、か……ひひっ……,
542,11「幽夢学園」,,カーン、カーン、カーン――,
543,,*,ん……？この音は……！？,
544,,ウリエル,先輩、警報です！早く来てください！,
545,,*,ああ、今すぐ行く！,
546,,,……,
547,,*,一体何があったんだ？\n皆、同じ方向に逃げているようだが……,
548,,玖月,（大声）皆さん注意してください！\n狭間から妖力の荒波が発生しています！\nすぐに撤退してください！,
549,,玖月,今すぐ、撤退してください！\n絶対に狭間に近づかないでください！,
550,,ウリエル,妖力の荒波……？\n物語の妖怪たちと関係あるのでしょうか……？,
551,,ウリエル,しかも、撤退と言っているのに、巫女たちは\n神の試練の方に向かっているようです……\n危険なのでは……！？,
552,,*,あっ、麻美ちゃんだ！僕たちもついて行こう！,
553,,玖月,君たち、ここから先、命の保証ができません。\n速やかに離れてください。,
554,,*,でも、巫女たちは\n神の試練の方に向かってますよ？,
555,,玖月,彼女たちには彼女たちの使命があります。,
556,,*,僕たちにも何か手伝わせてください！\n何度も試練をクリアしているので、\nそれなりに力になれると思います！,
557,,ウリエル,麻美様は私たちの友達です。何か協力できる\nことがあれば、力になりたいのです。\n何なりと申しつけてください！,
558,,玖月,……泉恵様の目は確かなようですね。そこまで\n仰るのならば、力を貸していただけますか？,
559,,*,もちろんです！,
560,,玖月,狭間の中に封印されていた妖怪に、復活の兆しが\nあります。麻美たちはこの神社の防衛を担う\n「鳶燔（えんはん）隊」に所属しています。,
561,,玖月,彼女たちは妖怪が復活した際、\n他の人を避難させるための\n最終防衛ラインになります。,
562,,玖月,妖怪は普通の人では手に負えません。\n神様の力がなければ、\n我々に勝ち目はないでしょう。,
563,,玖月,しかも今回厄介なのは、妖怪だけでなく、\n古書に記された「カオス」という生物まで\n現れたことです。,
564,,玖月,今ならまだ引き返せますよ？,
565,,*,ははっ、ご冗談を。妖怪はどうか分かりませんが、\nカオスに関しては僕らはエキスパートです！,
566,,ウリエル,ええ、「幽夢学園」の力をお見せします！,
567,,*,ウリエル、ここに来ている他の生徒を集めて、\nカオス討伐にあたってくれ。,
568,,*,僕は麻美ちゃんの方に向かうよ！,
569,,ウリエル,ですが、狭間の方が危険なのでは……？\nそこは私に任せた方が……,
570,,*,機動力は君の方が上だ。素早く皆を集めた方が、\n被害も少なく済む。迷う暇はない、頼んだぞ！,
571,,ウリエル,了解です。先輩もお気をつけて！,
572,,イザナミ,……*の方は私に任せなさい。\n命の保証ぐらいはするわ。,
573,,*,イザナミ！？,
574,,,……,
575,,麻美,この妖怪どもめ！\n神様が与えてくれた箒の力を食らいなさい！,
576,,*,麻美ちゃん！やっと見つけた……！,
577,,麻美,あんた、何でここにいるのよ！\n構ってる暇はないわ、さっさと逃げなさい！,
578,,麻美,ってか、隣にいる女、また変わってるじゃない！\nこのケダモノが！,
579,,イザナミ,私？いや、私と監視者のこと……？ふふっ。,
580,,*,イザナミとはそういう関係じゃないから！\n僕らは手伝いに来たんだ！,
581,,麻美,手伝い？い～い？\nこれは宝物目当てのお遊びとは訳が違うの！\n私たちは文字通り、命を張っているのよ！,
582,,麻美,宝物目当てのヤツは\nさっさと遠くに逃げなさいよ！,
583,,*,僕はこれでも「幽夢学園」の先輩だぞ。\n討伐したカオスの数はもう数えきれないほどさ！,
584,,*,今だけでもいい、僕たちを信じてくれ！\n麻美ちゃんも他の巫女さんたちも、\n絶対に誰一人死なせたりしない！,
585,,*,誤解されたまま、\nお別れできる訳ないだろ？,
586,,麻美,ああもう、分かったわ！\n生きて戻れるなら、話ぐらい聞いてあげる！,
587,,*,おぅ、約束だからな！,
588,,イザナミ,ねぇ、恋人と生き別れた人の前でイチャつくのは\nそれぐらいにしてくれないかしら……？,
589,,イザナミ,二人を守りながら戦うのは、\nさすがに疲れるわ……,
590,,麻美,ごめん、すぐ行くわ！,
591,,幽夢学園の生徒達,応援に来たわよ！,
592,,ウリエル,先輩、皆を集めてきました！,
593,,*,ああ、助かる！,
594,,*,んじゃ、「幽夢学園」の力、\n見せてやろうじゃないか！,
595,12七夜・禍,*,カーヴェ、バルディ、\nあっちの巫女が押されている。援護を頼む！,
596,,カーヴェ&バルディ,うむ、我輩たちに任せるがよい！\nうん、私たちに任せて！,
597,,*,ヘルシング、後ろ……っ！,
598,,ヘルシング,吾が気付いていないとでも？,
599,,*,后羿、西側二時方向に敵影が！,
600,,后羿,ああ、狙いは定めている。,
601,,*,ミスルト、ケガ人の回復は間に合っているか？,
602,,ミスルト,安心してください……大丈夫です。,
603,,麻美,ふ～ん、意外と様になっているじゃない？,
604,,*,だろ？学園の力はすごいんだぞ？,
605,,麻美,そこまで言うなら勝負しない？,
606,,麻美,先に言っとくけど、こっちは怨念専門だからね？\n負けても文句言わないでよ？,
607,,*,ま、こっちはカオス専門なんでね～。,
608,,麻美,ふん、ならおあいこじゃない。,
609,,？？？,チッ、巫女だけなら簡単だったのに、\nこいつらどこから湧いてきやがった……,
610,,？？？,待てよ……\nまさか、ナイトメアと虐炎をやったって言う\nあの「幽夢学園」か？,
611,,？？？,チッ、青取と赤取のクズどもめ……\nオレ様からあんなにカオスエネルギーを\n吸収したというのに、まだ復活しねぇ……,
612,,？？？,「神様の凝望」を手に入れるためじゃなきゃ、\n力を分けたりしねぇのによ……,
613,,？？？,あいつら、あれをただ宝と交換できる物だと\n思いこんでいるようだが、\nあれの価値はそんなもんじゃねぇ……,
614,,？？？,ふんっ、火をもう一本つけておくか……\nさっさと復活しやがれ、ゴミどもが！,
615,,,……,
616,,*,どういうことだ？さっきまで抑えられていたのに、\n急に敵の数が多く……！？,
617,,麻美,はぁ……はぁ……\n怨念は元々そう簡単に消えるものじゃないわよ！,
618,,麻美,しかも今回は怨念濃度だけじゃなく、\nカオスの影響によって荒波が起こっているから、\n以前よりももっとひどいわ……,
619,,麻美,あんた達の協力があれば、\n何とかなると思っていたけど……,
620,,麻美,どうやら、ここまでのようね……,
621,,*,怨念に関しては詳しくないけど、\nカオスの様子もおかしい……何か裏があると思う。,
622,,イザナミ,確かに……カオスは本能でエネルギーを\n入手しようとするはず……でも今回は違う……\nむしろエネルギーを多く消耗しているわ……,
623,,イザナミ,きっともっと強い何らかの存在が、\n裏で操っているに違いないわ……,
624,,*,まさか……魔神レベルのヤツがいるのか……！？,
625,,麻美,魔神レベルってなに？なんかヤバそうな響きなんだけど？,
626,,*,いや、例え魔神レベルのヤツがいても大丈夫だ！\n僕たちはすでに2回もヤツらを倒している、\n3回目だって負けないさ！,
627,,*,カオスを操っているってことは、\nきっと近くにいるに違いない！\n誰か怪しいヤツを見かけていないか？,
628,,カーヴェ&バルディ,東と南には特に見当たらなかったな。,
629,,后羿,西も問題ない。,
630,,ウリエル,先輩！北の方角でコソコソと動く怪しい影を\n目撃したという報告があります！,
631,,*,それだ！行こう！,
632,,,……,
633,,？？？,チッ、見つかったか……,
634,,*,お前は……人間？\nいや、しかしカオスの気配も……,
635,,？？？,人間？はっ、この肉体のことか？\n確かに神社ではスゲー役に立ったな、こいつ。,
636,,？？？,でも、バレちまった今、この体も用なしさ……\nよく聞くがいい、凡人ども！,
637,,道無,吾はカオスの神が一柱――道無（みちなし）様だ！,
638,,*,なっ、まさか本当に魔神レベルが……！,
639,,イザナミ,でもおかしいわ……\n魔神レベルの脅威が感じられないわね……,
640,,イザナミ,変装や隠蔽に長けたタイプかしら……？\n少なくとも、勝算は高そうね。,
641,,ウリエル,鳶尾の命様が\n命を張って守ったこの地を害するカオスよ……,
642,,ウリエル,――日の光と共に灰燼となれ！！！,
643,13七夜禦·臨,道無,可惡！可惡！！,
644,,道無,要不是那兩個廢物妖怪吸走了我太多力量，我怎麼會連你個小丫頭也打不過！,
645,,道無,但一切都已經晚了，哈哈哈！他們已經活過來了，就算我倒下，你們也都將死在這裡！,
646,,道無,就是可惜「神明的注視」，要便宜不知道哪個傢伙了……,
647,,麻美,喂，你們有沒有聽到……腳下好像有聲音？,
648,,,麻美話音剛落，地面就突然劇烈地震動了起來。,
649,,烏列爾,學長，你看神隙試煉那裡！,
650,,,神隙試煉入口處，正在瘋狂地湧出大片怨念化形。,
651,,,在如沼澤般向外漫延的怨念泥潭中，兩個幽邃而巨大的身影矗立在那裡。,
652,,青取,弟弟，我們又活過來了……啊，聽你的，我們就大鬧一通吧。,
653,,麻美,真的……沒有希望了嗎……,
654,,*,不，還是有的——你看！,
655,,,在被污穢而扭曲的怨念充滿的神隙入口，突然亮起了璀璨耀眼的光芒。,
656,,,那是一面鏡子，更像是一輪冉冉升起的太陽，染亮了大片的夜空。,
657,,,在完整地向眾人展現了它不似凡俗的華美後，鏡子如一道流星般，飛向了神社更深處。,
658,,青取,那是……那個神的東西！這次我們一定不能讓人類拿到它！,
659,,烏列爾,那就是——「神明的注視」嗎？,
660,,麻美,如果還有希望，那一定就是它了吧……我要和鳶燔隊的大家一起戰鬥，可以拜託你嗎，*？,
661,,*,你不怕我拿了寶物就跑了？,
662,,麻美,事到如今還說這些幹什麼——我相信你！,
663,,,……,
664,,*,「神明的注視」，按照剛才的軌跡，是到這邊……看到了，前方天空在發光。,
665,,千鶴子,……,
666,,*,千鶴子？千鶴子你怎麼在這裡，你不是應該跟著其他人一起撤離了嗎？,
667,,千鶴子,……,
668,,,怨念化形圍了上來。,
669,,*,這裡很危險，我要去取「神明的注視」，你可以一個人先跑嗎？,
