id,string,explanation
1,L'Armée Défensive de {1}{2} a été vaincue ! Nous avons obtenu {3} Points d'Expédition !\nMVP：{4}\nFaction：{5},"任意地块（包括中央冰川）的守军被首次清空时，并且自身阵营有参与挑战时推送。{3}中显示玩家所属阵营因此分到的积分。地块坐标需要显示为（x,y)的形式"
2,Nous avons occupé {1}{2} !\nOccupant：{3},原本属于其他玩家阵营的非普通格地块，被我方阵营占领时推送
3,Tous les objectifs de l'ère - {1} ont été complétés ! Nous avons obtenu {2} Points d'Expédition !,某时代的远征任务全部完成后推送。{2}中显示玩家所属阵营通过该时代的远征任务所获得的积分总和
4,Une nouvelle ère：{1} commence !\n{2},新时代开启时推送
5,"Cher {1}, votre appel de Raid sur {2}{3} a pris fin, {4} équipe(s) a/ont rejoint votre Raid.",集结指令结束之后推送。*需要替換為學長名
6,"J'ai lancé un Raid sur l'ennemi, rejoignez-moi !",在非己方阵营的地块上集结时推送
7,Rejoignez-moi et défendons notre territoire !,在己方阵营的地块上集结时推送
