id,desc
1,"Senpai, ici c'est le dortoir des Filles, laisse-moi te montrer les alentours~"
2,Touchez ici pour utiliser les pièces de meubles pour acheter des meubles.
3,Touchez ici pour modifier l'espace du dortoir. Yuki espère que Senpai sera capable de faire du dortoir un endroit agréable pour les Filles.
4,"Ici c'est le confort du dortoir. Touchez ici pour récupérer les récompenses. Plus les meubles sont confortables, plus les récompenses obtenues seront élevées !"
5,"Senpai, ici, vous pouvez modifier le nom de votre dortoir à tout moment~"
6,Touchez ici pour savoir plus !
7,"Touchez ici pour choisir la Fille que vous voulez faire emménager dans ce dortoir. Senpai, vous pourrez interagir avec les Filles ici !"
