id,title,name,dialog,select_text
410,,Uriel,"Vous avez bien raison, mais je ne peux pas croire qu'après tous les efforts et sacrifices que Déesse Kagura a fait pour sauver Sawagi et ses habitants... qu'elle ne puisse pas échapper à la mort..",
411,,Uriel,"Mais quand j'y repense, la décision qu'a pris Déesse Kagura de disperser les fragments du mirroir, ne manquera pas d'attirer les plus avides.",
412,,Chizuko,"Selon les Chroniques de Tsuruga, Déesse Kagura n'avait que 16 ou 17 ans à l'époque, ce n'était pas une décision facile à prendre pour son âge non plus...",
413,,*,C'est dommage que l'on ait plus accès au Regard Divin aujourd'hui. Je ne peux même pas imaginer le nombre de trésors que nous pourrions avoir !,
414,,Chizuko,"Eh bien, tu n'es sûrement pas le premier à penser de la sorte. Mais sache que quiconque osera s'en prendre au sanctuaire, sera très sévèrement puni !",
415,,,……,
416,,？？？,Hum... Le Regard Divin ?... Il me le faut !,
417,Miroir Brisé,,"Le lendemain, je transmis alors les informations que j'ai obtenues à Ithil et Kong Ming.",
418,,*,Voici les informations que nous avons collectées.,
419,,Kong Ming (Projection),"Hmm, je vois. Bien que cela reste à prouver, il semblerait que le seul moyen d'obtenir les trésors divins soit de passer les épreuves.",
420,,Ithil (Projection),Il ne faut pas oublier que pour l'instant c'est la seule source d'information que nous avons. Il est probable que ça soit juste une histoire inventée pour protéger leurs trésors des autres.,
421,,Ithil (Projection),Il est aussi possible que le secret du trésor soit toujours caché quelque part dans le Grand Sanctuaire de Tsuruga.,
422,,Uriel,"Ithil, tu réfléchis trop loin. Je pense que Madame Mizue dit la vérité...",
423,,Kong Ming (Projection),"Quelque soit la vérité derrière tout ça, je doute fort que les mikos soient au courant.",
424,,Kong Ming (Projection),"Les secrets du sanctuaire sont probablement entre les mains de Madame Mizue et Guji Kugatsu. Mais d'après ce que nous a décrit Senpai, il sera difficile de leur soutirer des informations.",
425,,*,"Mais nous, étudiants de l'Académie Yume, ne sommes pas les méchants dans l'histoire. Nous voulons seulement connaître le secret des trésors divins afin de combattre le Chaos.",
426,,*,"Peut-être pourrions-nous discuter avec eux et leur demander directement de nous soutenir en partageant les trésors, non ?",
427,,Kong Ming (Projection),"Il s'agit d'un secret, qu'il existe vraiment ou non, elles ne le partageront à personne afin de protéger le sanctuaire.",
428,,Ithil (Projection),"Mais l'acquisition des trésors par le biais des épreuves est bien trop longue, nous avons besoin de plus de soutien pour les trésors.",
429,,Ithil (Projection),Le mieux serait de trouver un moyen de produire ses trésors de façon plus abondantes.,
430,,*,"À t'entendre parler, on dirait que nous sommes les méchants qui tentent de voler les trésors du sanctuaire.",
431,,*,"Asami et Chizuko sont toutes les deux très gentilles. Nous pourrions développer un peu plus nos relations avec les mikos et leur demander de rendre nos épreuves un peu plus faciles, non ?",
432,,Uriel,"Tu as sûrement raison, Senpai. Après tout, ces mikos gardent le sanctuaire depuis si longtemps. Elles savent sûrement certaines choses, comme la fois où Asami m'a aidé pour une des épreuves de combat !",
433,,Ithil (Projection),"Tu es le Senpai ici, c'est ta décision et on la suivra.",
434,,*,"Merci beaucoup, Ithil !",
435,,Asami,Ah ? Ça ne serait pas * et Uriel ? Pourquoi se cachent-ils dans un coin ? Sont-ils en train de discuter avec quelqu'un ?,
436,,Asami,Le secret des trésors... relation avec les mikos... De quoi parlent-ils ?,
437,,Asami,"Je me suis bien faite avoir... Je pensais que vous étiez différents des autres participants, mais vous êtes tout autant avares !",
438,,*,"Attends, Petite Asami ! Laisse-moi t'expliquer...",
439,,Asami,Il n'y a rien d'autre à expliquer ! J'ai tout entendu à l'instant. Vous vous êtes délibérément rapprochés de nous pour nous voler les trésors !,
440,,Asami,"Étant donné que vous n'avez causé aucun mal, selon les règles du sanctuaire... je ne peux pas agir.",
441,,Asami,"Mais je vous ai à l'œil ! Si je m'aperçois de quoique ce soit, je vous ferai regretter d'être venu ici !",
442,,*,"Asami, attends ! Ce n'est pas ce que tu crois !",
443,,Uriel,"Asami, c'est pas ça du tout, nous pouvons expliquer...",
444,,*,Asami est partie sans écouter ce qu'on avait à dire...,
445,,*,Elle qui était finalement prête à m'accepter en tant qu'ami.,
446,,Chizuko,* et Uriel ? Que faites-vous dans le coin ? Vous n'avez pas l'air bien...,
447,,Chizuko,Quelque chose s'est passé ? Dites-le moi et je pourrais vous aider～,
448,,*,Asami s'est mise en colère... Je ne sais pas comment faire...,
449,,Uriel,C'était un malentendu mais elle est partie sans que je puisse m'expliquer... Saurais-tu où je pourrais la trouver ?,
450,,Chizuko,"Hmm, si Asami ne veut pas qu'on la trouve, je peux t'assurer qu'il sera difficile de la trouver... Mais je peux lui passer ton message.",
451,,*,"Merci Chizuko, mais je pense qu'il est préférable que je m'explique en personne afin qu'il n'y ait pas plus de malentendu...",
452,,*,"Chizuko, tu penses qu'il serait possible que tu nous aides à arranger un rendez-vous en personne avec Asami ? Si elle n'accepte pas, alors nous te transmettrons le message.",
453,,Chizuko,"Euh... ça sera compliqué mais pas impossible. Asami m'aime beaucoup, j'essaierais de la convaincre, elle cédera peut-être.",
454,,Chizuko,"Ce n'est pas facile pour Asami de faire ami avec des personnes extérieures au sanctuaire. Mais je pense que vous rencontrer a été bénéfique pour elle, j'espère que vous réussirez à mettre les choses au clair～",
455,,*,"Je ne t'en remercierais jamais assez, Chizuko.",
456,,,……,
457,,Uriel,J'espère que Chizuko pourra nous aider à convaincre Asami...,
458,,*,"Si Asami ne veut vraiment pas nous voir, alors nous devrons demander à Chizuko de transmettre le message pour nous. Quoi qu'il en soit, je ne peux pas laisser Asami penser que je suis juste une mauvais personne qui souhaite voler les trésors.",
459,,Izanami,"Tiens donc, nous nous rencontrons à nouveau, Senpai.",
460,,Uriel,"Senpai, attention ! Elle est de mèche avec Kratos.",
461,,Izanami,"Ah, tu n'as pas encore informé ton garde du corps que j'étais là ?",
462,,*,"Uriel, relaxe. Je l'ai déjà croisée. Si elle voulait réellement m'attaquer, elle l'aurait déjà fait.",
463,,Uriel,Hein ? Quand ?,
464,,*,Le jour où tu as dormi toute la journée.,
465,,Uriel,"J'en étais sûre ! Je n'aurais jamais du me laisser-aller ce jour-là. Si quelque chose t'étais arrivée, je ne m'en serais pas remise...",
466,,*,"Ce n'est pas si grave, Uriel. Comme tu peux le voir que je vais bien.",
467,,Izanami,"Mais, n'êtes-vous pas censé écouter l'histoire de la vieille miko à cette heure-ci ? Qu'est-ce que vous faites encore là ?",
468,,*,À ce propos... Il semblerait que nous soyons vus comme étant des profiteurs qui voulions voler les trésors du sanctuaire... Asami en a sûrement déjà parlé à Madame Mizue...,
469,,*,Oui il est préférable que nous n'y allions pas aujourd'hui...,
470,,Izanami,Le secret des trésors du sanctuaire... tu veux parler du Regard Divin ?,
471,,Uriel,Tu es au courant de ça aussi ?,
472,,Izanami,"Je l'ai même déjà vu. Puisque vous n'allez pas écouter l'histoire de la vieille miko, je vais vous la raconter.",
473,,Izanami,"Après tout, je suis au courant de certaines choses qui arrivent par la suite...",
474,Histoire du Soir IV,Izanami,"Je ne me souviens plus exactement de combien de temps, mais une longue période s'est écoulée après que Déesse Kagura ait été emmenée par le dieu Amaterasu-Omikami au paradis.",
475,,Izanami,"Les mikos de l'époque étaient encore capable d'envoyer des messages au dieu, et voir des miracles se produire.",
476,,*,"Hmmm, c'est un peu bizarre, tu parles comme si tu l'avais vécu...",
477,,Izanami,Et si c'était le cas ?,
478,,Uriel,"Vraiment ? Donc est-ce que c'est vrai que Déesse Kagura a juste été emmenée par le dieu, et est en fait toujours en vie ?",
479,,Izanami,Peut-être.,
480,,Uriel,Pourquoi n'es-tu pas sûr non plus...,
481,,Izanami,"Un jour, Ao Oni et Aka Oni réapparurent, entièrement régénérés. Les prédictions de la miko de l'époque ne prévoyait pas cela pour si tôt car les énergies malveillantes n'étaient pas suffisantes.",
482,,Izanami,"Malgré cela, ils se sont non seulement régénérés, mais en plus, plus forts que jamais.",
483,,Uriel,Encore ces deux monstres ! Comment ont-ils pu se régénérer aussi vite dans ce cas ?,
484,,Izanami,C'est parce qu'ils avaient absorbé l'énergie du Chaos.,
485,,*,"... Tu n'as vraiment laissé aucun suspense, tu l'as dit tout simplement.",
486,,Izanami,"Je ne suis pas là pour te raconter une histoire, mais pour te dire ce qui s'est passé à ce-moment là.",
487,,*,"Donc si c'était le Chaos... Alors, il était présent depuis bien longtemps déjà...",
488,,Izanami,"Personne ne sait quand le Chaos est apparu. Après que les deux monstres aient quitté le Dojo, un miroir s'est également envolé du Dojo, dans les mains de la Miko en chef du sanctuaire.",
489,,Izanami,Il y avait une rumeur à l'époque qui stipulait que le Regard Divin n'apparaissait que lorsque Ao Oni et Aka Oni étaient régénérés.,
490,,Izanami,"Les trésors divins peuvent briser la forme des énergies malveillantes, mais ne peuvent pas détruire le corps des monstres. Les deux monstres unirent alors leurs forces à celles du Chaos pour se venger des habitants de Sawagi, qui ont empêché leur régénération.",
491,,Izanami,"Durant cette période-là, Sawagi était tantôt submergée d'inondations, tantôt anéantie par la sécheresse. Sans oublier que le Chaos massacrait ses habitants.",
492,,Izanami,"Au début, les habitants de Sawagi n'étaient pas effrayés par la menace des monstres et du Chaos car le dieu protégeait Sawagi.",
493,,Izanami,"Malheureusement, bien que les mikos aient continué à prier jour et nuit, dieu ne leur répondait plus. Les habitaient, paniqués, se réfugièrent alors au sanctuaire.",
494,,Izanami,"Car ils savaient que seules les mikos du sanctuaire, celles qui ont participé aux épreuves du Dojo étaient capables de les protéger.",
495,,Izanami,La plupart ont pu être sauvés... sauf les derniers arrivants...,
496,,,Izanami s'arrêta brusquement et leva sa main vers son visage pour toucher son masque.,
497,,,Elle se remémora de vieux souvenirs et une larme coula le long de son visage.,
498,,Izanami,"Izanagi, Izanagi, ne me regarde pas.(marmonna-t-elle)",
499,,Izanami,Je ne suis pas rongée par le Chaos... Malgré ce visage... je suis toujours la même... Je trouverais un remède à cela.,
500,,Izanami,Ne me quitte pas...,
501,,Uriel,"Sen-Senpai, quelque chose ne va pas avec elle ?",
502,,Uriel,(en chuchotant)Qui est Izanagi ? Cette personne est-elle partie parce que le visage d'Izanami est déformée et qu'elle a un masque ?,
503,,*,(en chuchotant)Elle m'avait déjà dit qu'Izanagi était son amoureuse.,
504,,*,"Izanami, calme-toi, Izanagi n'est pas là !",
505,,Izanami,"Elle n'est pas là... Izanagi, où étais-tu ? Je te retrouverai...",
506,,Uriel,Quoi ? Elle est partie juste parce que son amoureuse a été déformée à cause du Chaos... C'est ridicule !,
507,,Uriel,"Attends, ça pourrait aussi être un malentendu ? Comme le malentendu entre nous et Asami, et Ithil a aussi dit---",
508,,Uriel,Il est possible que le secret soit toujours caché quelque part...,
509,,Uriel,"Izanami, est-ce que ton amoureuse est partie pour trouver un moyen de t'aider à guérir ? Elle n'a juste pas eu le temps de te dire au revoir.",
510,,Uriel,"Comme elle n'a jamais trouvé de remède, elle n'est pas encore revenue ? Mais lorsqu'elle en aura trouvé un, vos retrouvailles ne seront que meilleures !",
511,,Izanami,C'est vrai...? Izanagi... tu n'es pas revenue car tu m'aimes...,
512,,*,"Oui, c'est bien possible !",
513,,*,"(en chuchotant)Uriel, tu es sûre de cette supposition ?",
514,,Uriel,"Pas du tout, mais ça reste une possibilité, n'est-ce pas ?",
515,,Uriel,"(en chuchotant) Et puis, si Izanagi l'a vraiment abandonnée, elles ne se reverront pas de toute façon, donc il vaut mieux lui donner un peu d'espoir...",
516,,Uriel,"La positivité de Chizuko a changé ma façon de voir les choses. Elle m'a inspiré à chercher une fin heureuse dans toutes les histoires, et même dans la tienne, Izanami.",
517,,Izanami,"Je sais que tu essaies juste de me réconforter, mais il est vrai que tu m'as ouvert la porte vers une tout autre possibilité.",
518,,Izanami,"Si nous venons à nous croiser sur le champ de bataille, je vous laisserai la vie sauve.",
519,,*,Hmm... merci beaucoup... mais ce serait bien que tu ne sois jamais notre ennemie.,
520,,Izanami,"Bon, je continue. Les mikos ne perdirent pas espoir et continuèrent à prier le dieu jour et nuit.",
521,,Izanami,"Un jour à l'aube, un grand cri de grue résonnait et le soleil s'est leva à l'est.",
522,,Izanami,"Les rayons du soleil matinal éclairèrent la terre de Sawagi, le soleil frappa le Chaos et les deux monstres et ils partirent en fumée.",
523,,Izanami,"On dit que le soleil était le dieu Amaterasu-Omikami, et la grue qui vole autour de lui était Déesse Kagura.",
524,,Izanami,"Le Chaos disparut, et les cendres de Ao Oni et Aka Oni furent recueilllis et furent scellés dans une urne, qui fut placée dans le sanctuaire.",
525,,Izanami,"À ce-moment là, les mikos re-scellèrent les cendres des monstres et le Regard Divin dans le Dojo.",
526,,Izanami,"Après une longue période de rénovation, le sanctuaire organisa une cérémonie pour exprimer leur gratitude envers le dieu, mais Il ne leur répondit pas.",
527,,Izanami,"Et à vrai dire... Depuis ce jour-là, il ne répondit plus jamais aux oracles des mikos.",
528,,Izanami,"Cependant, les habitants de Sawagi croyaient toujours en Lui et sa protection, puisque le Bassin aux Vœux était toujours présent.",
529,,*,As-tu vécu tout ça ?,
530,,Izanami,"Non, c'est en partie ce que j'ai entendu des autres quand je suis revenue ici.",
531,,Izanami,"Je ne crois pas en ce dieu, il a juste besoin des habitants de Sawagi pour le vénérer.",
532,,Izanami,"Sinon, pourquoi n'aurait-il pas détruit le Chaos en premier lieu ? C'est lui qui a causé ces marques sur mon visage !",
533,,Uriel,"Attends, je crois t'avoir entendu parler de ces choses avant que je n'arrive à l'Académie Yume.",
534,,Uriel,"Lorsque je faisais partie des Chevaliers du Soleil, une chevalière m'a dit que son équipe et elle était censées aider une région à résister au Chaos et à détruire le dieu qui ne protégeait pas ses habitants.",
535,,Uriel,"Mais lorsqu'elles sont arrivées, elles ont appris que le Chaos présent avait été détruit et que c'était un miracle de dieu.",
536,,Uriel,"Après avoir enquêté, elles ont découvert que le dieu et le Chaos étaient tous morts.",
537,,Uriel,"Maintenant que j'y pense, il me semble qu'elle avait mentionné que l'endroit s'appelait Sawagi.",
538,,Uriel,"Quant à savoir pourquoi le dieu n'a pas complètement détruit le Chaos au tout début, je n'en ai aucune idée... Peut-être se croyait-il capable de les combattre.",
539,,Izanami,Ils sont morts ensemble...? Comment ça se fait...?,
540,,,……,
541,,？？？,"La régénération d'un monstre peut faire réapparaître le Regard Divin, je vois... hehehe",
542,「L'Académie Yume」,,Bong-- Bong-- Bong--,
543,,*,Qui a fait sonner l'alarme ? C'est bruyant...,
544,,Uriel,"Senpai, réveille-toi ! C'est une alerte danger !",
545,,*,J'arrive tout de suite !,
546,,,……,
547,,*,Qu'est-ce qu'il s'est passé ? Tout le monde court dans la même direction...,
548,,Kugatsu,"Attention à tous, une forte énergie a été détectée en provenance du Dojo. Veuillez évacuer immédiatement ! Je répète, évacuez immédiatement !",
549,,Kugatsu,Ne vous approchez pas du Dojo ! Évacuez immédiatement !,
550,,Uriel,Une forte d'énergie ? Qu'est-ce que c'est ? Serait-ce lié à l'histoire d'Aka Oni et Ao Oni ?,
551,,Uriel,"Tout le monde devrait être en train d'évacuer, pourquoi ces mikos courent-elles en direction du Dojo ? C'est dangereux là-bas !",
552,,*,"Regarde, même Asami, rejoignons-la !",
553,,Kugatsu,"Vous deux, sortez d'ici au plus vite !",
554,,*,"Mais Asami et les autres mikos, elles vont toutes dans la direction du Dojo !",
555,,Kugatsu,C'est leur mission.,
556,,*,"Nous pouvons les aider ! Nous avons passé de nombreuses épreuves du Dojo, vous savez de quoi nous sommes capables.",
557,,Uriel,"Asami est notre amie, donc s'il y a quelque chose que nous pouvons faire, nous le ferons !",
558,,Kugatsu,"Vous... Madame Mizue a raison, vous êtes des gens bien. Je peux vous faire confiance, non ?",
559,,*,Bien sûr !,
560,,Kugatsu,Les monstres scellés dans le Dojo montrent des signes de régénération. Asami et les autres mikos ont toutes été formées par le sanctuaire pour spécifiquement participer aux épreuves. Elles forment les Flamboyantes.,
561,,Kugatsu,"Elles sont notre dernière ligne de défense contre ces monstres, pendant que les autres s'échappent.",
562,,Kugatsu,"Une fois régénérés, ces monstres ne peuvent pas être vaincus par des gens ordinaires, et sans la présence du Dieu, nous n'avons aucune chance de gagner.",
563,,Kugatsu,"Et, cette fois, comme l'indique la légende, le Chaos apparaît.",
564,,Kugatsu,"Si vous voulez faire demi-tour maintenant, il n'est pas trop tard...",
565,,*,"Je ne sais pas si on peut vaincre ces monstres, mais je sais que contre le Chaos, on est plutôt bon.",
566,,Uriel,"Après tout, nous sommes de l'Académie Yume !",
567,,*,"Uriel, vas informer les autres étudiantes qui ont participées aux épreuves et dis leur de se réunir. Nous allons éliminer le Chaos.",
568,,*,"De mon côté, je vais d'abord aller aider Asami et les autres mikos.",
569,,Uriel,"Mais c'est plus dangereux d'être près du Dojo ! Laisse-moi aller les aider et toi, tu vas informer les autres étudiantes.",
570,,*,"Il n'y a pas de temps à perdre, on s'en tient à mon plan, vas-y !",
571,,Uriel,"D'accord... Senpai, fais attention à toi !",
572,,Izanami,"Laisse-moi protéger *. Ne t'inquiète pas, je garderai Senpai en sécurité.",
573,,*,Izanami ?,
574,,,……,
575,,Asami,"Maudits monstres, du balai ! C'est une arme qui m'a été donnée par le Dieu !",
576,,*,"Asami, Asami, je t'ai finalement rattrapé...",
577,,Asami,"Encore toi ? Je n'ai pas le temps de t'écouter, ne me dérange pas et va-t'en vite !",
578,,Asami,Et pourquoi il y a une nouvelle fille avec toi !,
579,,Izanami,"Tu parles de moi ? Moi et le représentant de Yume, hehe...",
580,,*,"Izanami et moi ne sommes pas le genre de relation que tu penses, nous sommes là pour vous aider !",
581,,Asami,"Nous aider ? Ce n'est pas une bataille pour remporter le trésor, tu sais ? Nos vies sont en jeu !",
582,,Asami,"Les gens comme toi qui n'ont de yeux que pour le trésor, devraient plutôt s'échapper au plus vite pour sauver leur vie.",
583,,*,"Je suis le représentant de l'Académie Yume, et j'ai auparavant déjà combattu contre le Chaos, alors fais-moi confiance !",
584,,*,"Je ne te laisserai pas te battre seule, Asami !",
585,,*,"Nous devons nous serrer les coudes, notre malentendu n'est certes pas encore résolu mais je te donnerai mes explications après cela.",
586,,Asami,... Voyons d'abord si nous nous en sortons vivant...,
587,,*,D'accord.,
588,,Izanami,"Excusez-moi, si vous avez fini de bavarder à côté de moi...",
589,,Izanami,Peut-être pourriez-vous m'aider à éliminer ces satanées créatures ? Combattre seule est épuisant.,
590,,Asami,On arrive !,
591,,Tout le monde,Nous sommes là aussi !,
592,,Uriel,"J'ai amené les autres, Senpai. J'espère que je ne suis pas en retard ?",
593,,*,"Non, tu tombes à pic !",
594,,*,"Maintenant que tout le monde est en position, donnons une bonne leçon à ces monstres qui détruisent notre monde !",
595,Catastrophe,*,"Carmen, Bianca, allez aider la miko là-bas !",
596,,Carmen & Bianca,"D'accord ! Ô papillons, battez des ailes !",
597,,*,"Vanessa, derrière toi !",
598,,Vanessa,"Je l'ai, c'est l'heure de la Chasse !",
599,,*,"Angélina, à 10 heures !",
600,,Angélina,"Je m'en charge, Senpai ! Mes flèches sont symboles d'honneur !",
601,,*,"Lys, tu t'en sors ? Peux-tu t'occuper d'autant de blessés ?",
602,,Lys,"Ne t'en fais pas, la forêt me donnera la force～",
603,,Asami,Je ne peux pas croire que tu maîtrises si bien la situation.,
604,,*,"Je te l'ai déjà dit, ne me sous-estime pas.",
605,,Asami,Voyons de nous deux qui peut vaincre le plus de créatures du Chaos et de mauvaises énergies ?,
606,,Asami,"Tu sais, j'ai beaucoup d'expérience contre ces mauvaises énergies, alors ne te plains pas si tu perds contre moi.",
607,,*,"Eh bien, j'ai aussi de l'expérience contre le Chaos.",
608,,Asami,Nous verrons bien !,
609,,？？？,"Mince, ces quelques mikos n'étaient pas grande menace... Mais qui sont ces autres personnes à leurs côtés... ?",
610,,？？？,Seraient-elles de l'Académie Yume qui a vaincu le Cauchemar et le Golem de Lave ?,
611,,？？？,"Aka Oni et Ao Oni, ces deux boulets qui ont absorbé une grande partie de mon énergie de Chaos mais qui n'ont pas encore régénéré...",
612,,？？？,Je n'aurais jamais renoncé à tant d'énergies si ce n'était pas pour le Regard Divin.,
613,,？？？,"Ces personnes ne savent utiliser le Regard Divin que pour des trésors provenant du Bassin aux Vœux, mais ont négligé le fait que le Regard Divin est la source du réel trésor.",
614,,？？？,Je vais pimenter un peu tout ça pour que ces deux monstres puissent sortir du Dojo au plus vite.,
615,,,……,
616,,*,Qu'est-ce qu'il se passe ? Nous venons de les dépourvoir de toutes leurs mauvaises énergies... mais pourquoi augmentent-elles soudainement à nouveau ?,
617,,Asami,"Les mauvaises énergies sont inépuisables, et continuent d'augmenter malgré nos efforts...",
618,,Asami,Ces mauvaises énergies n'ont pas suffi à ramener les monstres à la vie mais... ce n'est qu'une question de temps maintenant...,
619,,Asami,"Je pensais qu'avec votre aide contre le Chaos, nous aurions pu changer notre destin...",
620,,Asami,Mais il semblerait que nous ne puissions pas échapper à la mort après tout...,
621,,*,"Ce n'est pas normal, bien que je ne connaisse rien aux mauvaises énergies, je trouve que le Chaos est différent...",
622,,Izanami,"Exactement, le Chaos aurait en profiter et absorber cette énergie, mais au contraire libère de l'énergie d'une manière inhabituelle.",
623,,Izanami,Il y a sûrement quelqu'un de plus puissant derrière et manipule le Chaos.,
624,,*,Ne me dites pas qu'il s'agit du Seigneur du Chaos...,
625,,Asami,Qu'est-ce que... le Seigneur du Chaos ?,
626,,*,"Ne t'inquiète pas, nous l'avons déjà vaincu deux fois ! Jamais deux sans trois !",
627,,*,"Puisqu'il a l'air de manipuler le Chaos, il devait être dans les parages. Tout le monde, jetez un œil autour de vous !",
628,,Carmen & Bianca,RAS du côté Est et Sud.,
629,,Angélina,RAS du côté Ouest.,
630,,Uriel,"Senpai, il y a un homme qui se cache là-bas, côté Nord !",
631,,*,On arrive tout de suite !,
632,,,……,
633,,？？？,Je n'arrive pas à croire que vous m'ayez trouvé.,
634,,*,Tu... as l'apparence d'un être humain...? Mais je peux ressentir le Chaos.,
635,,？？？,Humain ? Tu parles de ce corps ? Ce corps m'est en effet très utile pour mes déplacements dans le sanctuaire.,
636,,？？？,"Mais puisque j'ai été découvert, laissez-moi vous montrer ma vraie forme et vous donner mon vrai nom.",
637,,Michinashi,Je suis le Seigneur du Chaos - Michinashi !,
638,,*,C'est vraiment le Seigneur du Chaos !,
639,,Izanami,"C'est un peu bizarre, il n'a pas l'air aussi fort dans sa forme de Seigneur...",
640,,Izanami,"Mais comme il a utilisé une partie de son pouvoir pour cacher sa véritable identité, il ne lui reste probablement pas beaucoup de pouvoir pour combattre avec nous, nous avons nos chances de gagner !",
641,,Uriel,Cette terre que Déesse Kagura essaie désespérément de protéger... Je ne te permettrai jamais de la détruire !,
642,,Uriel,Repens-toi devant la lumière du soleil !,
643,La Danse de Kagura,Michinashi,Quelle plaie !,
644,,Michinashi,"Si ces deux monstres n'avaient pas absorbé une grande partie de mon énergie de Chaos, j'aurais pu tous vous vaincre !",
645,,Michinashi,"Mais bon, il n'est pas trop tard... Hahaha ! Ils ont déjà régénéré, donc même si j'ai perdu, vous allez tous mourir ici !",
646,,Michinashi,C'est tout de même dommage que je n'ai pas pu mettre la main sur le Regard Divin... Je ne sais pas qui l'aura...,
647,,Asami,Hey ! Est-ce que vous avez entendu ce bruit ? Ça a l'air de venir de... sous nos pieds...?,
648,,,À peine Asami avait prononcé ces mots que soudainement le sol se mit à trembler violemment.,
649,,Uriel,"Senpai, regarde le Dojo là-bas !",
650,,,Le Sanctuaire était submergé de mauvaises énergies.,
651,,,"Des vagues de mauvaises énergies s'étendaient vers l'extérieur du sanctuaire tel un vaste marécage, au bout duquel se tenaient deux silhouettes.",
652,,Ao Oni,"Aka Oni, nous sommes de nouveau en vie ! Hahaha, on commence à tuer.",
653,,Asami,Est-ce... qu'on va mourir...?,
654,,*,"Non, pas encore, regarde !",
655,,,"Soudain, l'entrée du Dojo s'illumina d'une lumière éblouissante.",
656,,,"Un miroir apparut, reflétant un soleil levant qui illuminait le ciel sombre.",
657,,,"Après avoir attiré l'attention de tous, le miroir s'envola telle une étoile filante au fin fond du sanctuaire.",
