id,title,name,dialog,select_text
658,,Ao Oni,Là-bas ! C'est ce truc... divin ! Cette fois nous ne pouvons pas laisser les humains s'en emparer !,
659,,Uriel,Est-ce que c'est réellement le Regard Divin ?,
660,,Asami,"C'est sûrement notre dernier espoir. Peux-tu joindre tes forces aux côtés des Flamboyantes, * ?",
661,,*,Tu n'as pas peur que je m'enfuis avec le Regard Divin ?,
662,,Asami,Regarde où est-ce que nous en sommes maintenant ! Cesse de dire des absurdités ! Bien-sûr que te fais confiance !,
663,,,……,
664,,*,"Le Regard Divin... Il avait l'air d'être de ce côté... Oui, c'est bien ça ! Je peux voir une lumière scintillante dans le ciel là-bas !",
665,,Chizuko,……,
666,,*,Chizuko ? Que fais-tu là ? Je pensais que tu avais évacué avec les autres !,
667,,Chizuko,……,
668,,,"Peu à peu, les mauvaises énergies se rapprochèrent d'eux.",
669,,*,"C'est dangereux ici ! Je dois aller récupérer le Regard Divin, tu devrais sortir du Sanctuaire. D'accord ?",
670,,Chizuko,……,
671,,,"Chizuko ne répondit pas à Senpai, et un pas après l'autre, s'avança droit devant elle.",
672,,*,"Chizuko avait l'air étrange... Je me demande ce qui lui est arrivé... Michinashi est mort... et je n'ai pas ressenti l'aura du Chaos, donc elle ne devrait pas être possédée...",
673,,*,"Quoi qu'il en soit, il faut protéger Chizuko.",
674,,,"Sous l'œil vigilant de *, Chizuko se dirigea tout droit vers le Regard Divin.",
675,,,"Le Regard Divin descendait lentement du ciel en direction de Chizuko, puis devint un rayon de lumière qui fusionna avec son corps.",
676,,Chizuko,……,
677,,*,Chizuko... est en train de danser ? Des grues sont apparues autour d'elle !,
678,,Mikos,Elle dansa avec une telle légèreté et une telle habileté que cette danse semblait lui être innée.,
679,,Mikos,"Pendant qu'elle dansait, une volée d'oiseaux mystiques aux couleurs noire, blanche et dorée volèrent en sa direction. C'était les grues.",
680,,*,Est-ce que Chizuko serait en train de danser la Kagura ?,
681,,Chizuko,……,
682,L'éclosion,,Un peu plus tôt dans la journée...,
683,,Chizuko,"Ne vous bousculez pas, évacuez en ligne !",
684,,Chizuko,"Ne poussez pas, vous n'avancerez pas plus vite de cette manière-là !",
685,,Chizuko,......,
686,,Chizuko,"Tout le monde a évacué, il est sûrement temps pour moi d'évacuer désormais.",
687,,Chizuko,"Je me demande comment est-ce que ça se passe pour les mikos en ce moment. Si seulement mon corps n'était pas aussi faible, j'aurais pu les aider à combattre... sans être un fardeau...",
688,,Chizuko,"Non, je dois leur faire confiance, les Flamboyantes sont bien plus puissantes qu'on ne le pense, elles vont s'en sortir.",
689,,Chizuko,"Je dois surtout me protéger, pour pas qu'elles soient inquitètes...",
690,,Chizuko,Elles ne doivent pas s'inquiéter...,
691,,Chizuko,……,
692,,Chizuko,Où... suis-je... où... dois-je... aller...,
693,,Chizuko,Mon corps est si... léger...,
694,,？？？,♪~♪~♪~,
695,,Chizuko,Qui... êtes-vous...,
696,,Chizuko,C'est toi... qui m'appelle...,
697,,？？？,♪~♪~♪~,
698,,Chizuko,Je suis... Chizuko...,
699,,Chizuko,Je suis...,
700,,Chizuko,"Mais, qu'est-ce qu'il s'est passé ? Pourquoi suis-je comme ça ?",
701,,*,"Chizuko ! Tu parles enfin, tu vas bien ?",
702,,Chizuko,* ? Qu'est-ce qu'il vient de se passer ? Comment suis-je arriver jusqu'ici ?,
703,,*,"Tu devrais le savoir mieux que moi. Depuis tout à l'heure j'essayais de t'appeler, mais tu ne me répondais pas. Puis, tu t'es mise à danser et tu as pris cette nouvelle forme.",
704,,*,"Ah et, le Regard Divin a fusionné en toi, est-ce que tu ressens quelque chose en toi ?",
705,,Chizuko,En moi ? Non je ne ressens rien.,
706,,,"Soudain, une mauvaise énergie se dirigea vers Chizuko.",
707,,*,Chizuko ! Attention !,
708,,Chizuko,Ah ! Ne t'approche pas de moi !,
709,,,"Sous l'effet de la peur, Chizuko agita violemment sa longue manche et un éclair d'énergie flamboyant surgit, réduisant les mauvaises énergies en cendres.",
710,,*,"Wow, tu as des yeux de lynx, Chizuko ! Je ne m'attendais pas à ce que tu sois aussi habile !",
711,,Chizuko,Qu'est-ce qu'il s'est passé à l'instant... C'est moi qui ai fait ça ?,
712,,Une Miko au loin,Sakurako ! Ça va aller ?,
713,,Aka Oni,"Hahaha ! Mourrez, tous !",
714,,Chizuko,"Là-bas... C'est la voix de Asami, elle a l'air d'être en danger...",
715,,Chizuko,Tout ça parce que j'étais faible... incapable de les aider...,
716,,Chizuko,"Mais maintenant, les choses ont changé... Je peux les aider !",
717,,,......,
718,,Asami,Ce sont... des grues... Elles se dirigent vers nous !,
719,,Sakurako,Serait-ce le dieu Amaterasu-Omikami...?,
720,,Ao Oni,"Bien que tu sois beaucoup plus petit qu'avant, tu es sans aucun doute, Amaterasu...",
721,,Ao Oni,Mais... c'est impossible ! Comment peux-tu être encore en vie...?,
722,,Chizuko,"(Respire, je ne dois pas céder face à eux, je dois me concentrer sur l'énergie qui es dans mon corps.)",
723,,Chizuko,"(Je dois protéger tout le sanctuaire, je ne peux pas reculer.)",
724,,Chizuko,"Vous deux là-bas ! C'en est assez, je vais vous détruire aujourd'hui !",
725,,Asami,"(en chuchotant) Cette voix... c'est Chizuko ? Mais non, où est-...",
726,,*,"Oui, c'est bien Chizuko. Tu vas bien, Asami ?",
727,,Asami,"Bien sûr, je tiens le coup !",
728,,Asami,"(en chuchotant) À propos de Chizuko... N'en parle à personne pour le moment, d'accord ?",
729,,*,"D'accord, mais tu étais déjà au courant ?",
730,,Asami,... Je te ferai part des détails quand j'aurai le temps par la suite.,
731,,Ao Oni & Aka Oni,"Amaterasu-Omikami ! Tu ne nous vaincras pas, pas une seconde fois !",
732,,Chizuko,"Tu peux toujours essayer, mais tu échoueras encore une fois ! Repens-toi de tes péchés !",
733,Nouveaux Alliés,,"La veille à la tombée de la nuit, le ciel s'éclaircit et les monstres et leurs mauvaises énergies avaient disparu.",
734,,,"Suite au combat, Chizuko s'effondra inconsciente au sol et fut ramenée au Sanctuaire par Asami.",
735,,Chizuko,"J'ai entendu dire que c'est * qui a aidé tout le monde à combattre le Chaos et les monstres. Merci beaucoup, Senpai !",
736,,Chizuko,"C'est vraiment dommage que je me sois endormie, j'ai manqué l'apparition du Dieu Amaterasu-Omikami...",
737,,*,"Chizuko, hier soir c'était toi qu-",
738,,Asami,Hum hum !,
739,,,Asami fit un clin d'œil à Senpai.,
740,,*,"Oh oui, c'est dommage !",
741,,Chizuko,Asami m'a promis de me raconter ce qu'il s'est passé hier soir.,
742,,Chizuko,"J'aurais tellement aimé voir le Dieu Amaterasu-Omikami... Mais s'il ne se montre que lorsque les monstres apparaissent, alors je ne préfère ne pas le voir pour le reste de ma vie !",
743,,Kugatsu,"Chizuko, j'aimerais discuter avec Senpai en privé. Peux-tu nous laisser un instant ?",
744,,Chizuko,"Serait-ce des secrets ? Bon, je vous laisse tranquille alors～",
745,,Kugatsu,Une fille appelée Kong Ming m'a déjà tout expliqué hier.,
746,,*,Kong Ming est venue ici ?,
747,,Asami,"Non, c'est ton communicateur qui est tombé dans le Dojo, je l'ai trouvé en nettoyant le terrain.",
748,,Asami,"Elle te rejoignait à ce moment-là et nous avons parlé pendant un petit moment... J'ai compris que c'est moi qui t'avais mal compris, désolée.",
749,,*,"C'est compréhensif, après tout nous avions d'autres objectifs au début...",
750,,*,À propos d'hier... Tu penses que nous devons encore nous inquiéter que cela se reproduise ?,
751,,Kugatsu,"Nous les avons tous éliminés, les cendres des monstres ont été scellées dans le Dojo et le Regard Divin a été placé avec eux.",
752,,Kugatsu,"Et au fait, à propos de Chizuko, il vaut mieux garder cela secret pour le moment.",
753,,*,Donc Chizuko ne se souvient de rien du tout ?,
754,,Kugatsu,Chizuko a un physique spécial qui permet au pouvoir du dieu de s'attacher à son corps de par la prière.,
755,,Kugatsu,"Elle est jeune et a des pouvoirs spéciaux. Nous avions peur qu'elle ne soit pas capable de se contrôler, alors nous ne lui avons rien dit et l'avons traitée comme une miko ordinaire.",
756,,Kugatsu,"Quant à la perte de mémoire, elle devrait être due aux conséquences de son manque de capacité de résistance à la puissance divine. Mais peut-être c'est une bonne chose pour elle.",
757,,*,"Je vois, ne t'en fais pas, je vais garder le secret.",
758,,Kugatsu,Hm... bien que je ne sois toujours pas complètement rassurée avec vous...,
759,,Kugatsu,J'ai tout de même pu voir combien vous nous avez aidé. Asami et Madame Mizue pensent que nous pouvons vous faire confiance.,
760,,Kugatsu,"J'ai donc discuté avec Kong Ming hier soir, Chizuko rentrera avec vous à l''Académie Yume.",
761,,*,Ah ? Chizuko vient à l'Académie ?,
762,,Kugatsu,"Nous avons certes de l'expérience dans la lutte contre les monstres, mais nous en savons trop peu sur le Chaos... et il se trouve que vous êtes doués pour combattre le Chaos.",
763,,Kugatsu,"Chizuko sera la prochaine Miko en chef du sanctuaire sans surprise, elle aussi a besoin de plus de pratique, il serait donc très bénéfique pour elle qu'elle aille à l'académie.",
764,,Kugatsu,"J'ai confirmé à Kong Ming, et Chizuko répond à vos conditions d'admission.",
765,,*,"Tout le monde à l'académie est très sympathique, tu n'as pas à t'en faire pour Chizuko !",
766,,Kugatsu,"En échange, le sanctuaire vous apportera un soutien matériel.",
767,,Kugatsu,"Nos mikos ont toujours obtenu le pouvoir divin nécessaire, et jusqu'à maintenant, l'Approbation Divine a toujours été remise au Dojo.",
768,,Kugatsu,"Par la suite, je leur demanderai de garder l'Approbation Divine et de vous la donner pour votre usage.",
769,,Kugatsu,"En attendant, nous vous donnerons également quelques conseils pour participer aux épreuves, et nous espérons cela vous aidera à lutter contre le Chaos.",
770,,*,"C'est une grande aide de votre part, je vous remercie pour votre coopération.",
771,,Kugatsu,"C'est juste une entre-aide, et puis, vous nous avez beaucoup aidés.",
772,,Kugatsu,"Si tu n'as pas d'autres questions, je te laisse, j'ai encore quelques affaires à régler.",
773,,*,"Pas de problème, je vais y retourner aussi alors.",
774,,Asami,"Attends *... Malgré la bataille d'hier avec les monstres et le Chaos, la cérémonie aura lieu comme prévu ce soir.",
775,,Asami,"Chizuko m'a demandé de te dire qu'elle aimerait être votre guide à Uriel et toi, elle vous dit de l'attendre à l'entrée de la cérémonie ce soir.",
776,Une Fin Heureuse,Chizuko,Senpai ! Uriel ! Je suis là~,
777,,*,Tu m'appelles déjà Senpai ?,
778,,Chizuko,"Je ne suis peut-être pas encore à l'Académie Yume, mais il faut bien que je m'y habitue !",
779,,Uriel,"Chizuko, tu es toujours aussi énergique.",
780,,Chizuko,"Bien sûr, quoi de mieux que d'être heureux tous les jours～ Venez, je vais vous faire visiter, je connais très bien les lieux !",
781,,,……,
782,,Chizuko,"Ici, Sakurako fait les meilleurs takoyaki.",
783,,Chizuko,"Et ici, cette variété de poissons rouge de Haruko peut vivre pendant très longtemps.",
784,,Chizuko,"Ah, il y a déjà du monde ! Allez, on se faufile, c'est le meilleur endroit pour voir les feux d'artifice !",
785,,*,"Regarde, Chizuko s'amuse plus que quiconque.",
786,,Uriel,"Tout ce qu'elle recommande est aussi très bon, ce takoyaki est délicieux.",
787,,*,"Huh, ce masque...",
788,,Chizuko,"Ah, c'est un masque basé sur les images légendaires d'Ao Oni et d'Aka Oni.",
789,,Chizuko,"Mais l'année prochaine, le style du masque devrait être changé, après tout, tout le monde a déjà vu le vrai visage des monstres～",
790,,Uriel,"J'avais pensé que vous seriez si effrayé par ces deux monstres, mais je ne pensais pas que vous feriez leurs masques pour vous amuser.",
791,,Chizuko,"Je me souviens d'une ancienne Miko en chef qui disait que, plus une chose nous effraie, plus nous devons l'affronter.",
792,,Chizuko,"Si un simple masque peut nous effrayer, nous n'aurons peut-être même pas le courage de nous enfuir en cas de danger.",
793,,Uriel,Elle a bien raison.,
794,,Chizuko,"Au fait, je ne pense pas que vous ayez entendu le tout début de l'histoire, mais je vais vous la raconter maintenant.",
795,,Uriel,Déesse Kagura est-elle impliquée dans le début de l'histoire ?,
796,,Chizuko,"Uriel, tu es devenue une vraie admiratrice de Déesse Kagura~ Mais non malheureusement, c'est lié à Ao Oni et Aka Oni.",
797,,Chizuko,"Ao Oni et Aka Oni viennent d'un village appelé Tsuyuoka, qui est très éloigné de nous. Ils n'ont pas de père et leur mère est juste une personne ordinaire.",
798,,Chizuko,"Un soir, une vision est apparue dans le ciel et des monstres marchaient à côté d'une femme. Cette dernière est soudainement tombée enceinte et a donné naissance à deux enfants après dix jours de grossesse.",
799,,Chizuko,"La femme vivait avec ses deux enfants. Ils avaient le visage vert, des crocs et des cornes sur le front, l'apparence exacte d'un monstre qui aurait dû être tué dès la naissance.",
800,,Chizuko,"C'étaient ses enfants après tout, elle ne pouvait pas songer à les tuer. Elle éleva alors Ao Oni et Aka Oni chez elle en secret.",
801,,Uriel,"Bien qu'ils aient fait beaucoup de mal par la suite, il est vrai qu'ils n'étaient que des enfants à ce-moment là.",
802,,Uriel,"S'ils avaient grandi comme des êtres ordinaires, si j'étais à la place de cette femme, je ne pourrais probablement pas supporter de les tuer non plus.",
803,,Chizuko,"Après avoir découvert leurs pouvoirs, la femme empêcha ses deux enfants de les utiliser librement, afin qu'ils puissent grandir en sécurité.",
804,,Chizuko,"Mais depuis leur naissance, Tsuyuoka avait de fréquentes sécheresses... C'était parce qu'Aka Oni riait pendant l'absence de sa mère.",
805,,Chizuko,"C'est ainsi qu'ils ont été découvert. La femme essaya de s'enfuir avec eux, mais en vain, elle fut rattrapée par les habitants du village.",
806,,Chizuko,"Les habitants de Tsuyuoka tuèrent la femme et tentèrent de capturer les deux monstres pour les brûler au feu, car selon la légende, le feu est connu pour purifier les péchés.",
807,,Chizuko,"Ao Oni cria lorsqu'il vit sa mère mourir devant lui, et une pluie torrentielle tomba sur la ville, qui provoqua une inondation.",
808,,Chizuko,"Lorsque les deux monstres découvrirent que les habitants qui avaient tué leur mère étaient en fait très faibles, ils prirent le contrôle de l'endroit et les réduisirent à l'esclavage.",
809,,Chizuko,"Il demandèrent aux habitants de non seulement leur remettre leurs trésors, mais également de leur offrir une petite fille le jour de l'anniversaire de la mort de sa mère.",
810,,Chizuko,"Après avoir eu la petite fille, ces monstres la lapidèrent jusqu'à son dernier souffle avant de la brûler.",
811,,*,Les habitants de Tsuyuoka les ont traités de la même manière au début...,
812,,Uriel,"C'est compréhensible de vouloir se venger d'un ennemi qui a tué sa mère, mais de là à sacrifier une petite fille innocente, une telle cruauté... c'est trop.",
813,,Chizuko,"Eh bien, c'est la nature de ces monstres. Déesse Kagura a également été traitée injustement, mais elle, a toujours été gentille avec le monde.",
814,,Uriel,Déesse Kagura !,
815,,Chizuko,"Lorsque notre Miko en chef nous enseignait l'histoire, elle nous apprenait à prendre Déesse Kagura comme exemple, et de ne pas devenir des monstres.",
816,,Chizuko,"Et après, comme le raconte Madame Mizue, les habitants de Tsuyuoka ont prié le dieu, qui a ensuite vaincu les monstres.",
817,,Chizuko,"Ces deux monstres ne moururent pas, et pour échapper au dieu, ils se sont réfugièrent chez nous.",
818,,Chizuko,"Et même en s'enfuyant chez nous, ils ont encore été vaincus par le dieu.",
819,,Uriel,Tout est bien qui finit bien !,
820,,Chizuko,Voilà !,
821,,,Boum-----Boum-----Boum----- Trois énormes feux d'artifice explosèrent dans le ciel.,
822,,Uriel,Ce spectacle est à couper le souffle !,
823,,Chizuko,Les feux d'artifice indiquent qu'il est temps pour les mikos de danser la Kagura !,
824,,Chizuko,"Allons-vite ! Si nous arrivons trop tard, nous ne pourrons rien voir !",
