id,title,name,dialog,select_text
1,Prologue,,La légende raconte qu'un pouvoir mystérieux réside dans le Dojo se trouvant au fond du Grand Sanctuaire de la ville de Tsuruga.,
2,,,"Selon la légende, quiconque réussira à passer les épreuves du Dojo, recevra une récompense de la part d'une divinité.",
3,,*,Cela faisait combien de temps que je rêvais de me rendre au Grand Sanctuaire de Tsuruga ! Et me voici enfin ! Le trésor du Dojo sera mien !,
4,,,"Une jeune femme, gardienne du sanctuaire, couramment appelée une miko, se trouvait en face du Dojo, balayant ses alentours.",
5,,Miko,Encore des gens qui viennent tenter d'emporter les trésors divins du Dojo... Pourriez-vous vous déplacer ? Je suis en train de balayer cet endroit.,
6,,*,"Oh excusez-moi. Mais je me permets de vous reprendre là-dessus, je suis venu au Dojo de Tsuruga, non pas pour tenter mais avec la détermination que je mettrai la main sur ces trésors divins !",
7,,Miko,"Oui, j'ai déjà entendu cela un million de fois... Eh bien, je vous souhaite bonne chance.",
8,,*,"Attendez mademoiselle miko, vous m'avez l'air d'avoir croisé un grand nombre de courageux déjà... peut-être auriez-vous une astuce qui pourrait m'aider ?",
9,,Miko,"Je n'ai aucune astuce, mais s'il y a bien une astuce qui vous sauvera la vie... C'est quitter ce sanctuaire immédiatement et retourner à votre paisible vie quotidienne.",
10,,*,"Je ne baisserai pas les bras si facilement ! Bon, si vous n'avez pas d'astuce, alors peut-être que vous pouvez me donner des talismans de chance !",
11,,Miko,"Ce genre de talisman n'existe pas. Si tu as pris ta décision, je ne peux que te souhaiter bonne chance.",
12,,Miko,Chizuko me dit toujours d'essayer de dissuader les gens d'y entrer. Mais la plupart qui viennent ici ne reviennent pas sur leurs décisions...,
13,,*,Attends... Chizuko ?,
14,,Miko,"Je ne sais pas ce que tu veux, mais Chizuko est douce et gentille... Sûrement pas une personne qui a besoin de te rencontrer.",
15,,*,Attends que je passe les épreuves et je reviendrai pour rencontrer Chizuko !,
16,,Miko,"Écoute, soit tu rentres chez toi, soit tu entres dans le Dojo. Mais ne reste pas là, je dois balayer.",
17,,*,"J'y vais ! Trésors divins, me voilà !",
18,Une Miko Méfiante,*,Les épreuves sont exténuantes... Je n'en peux plus...,
19,,Uriel,"Merci pour tes efforts, Senpai ! Nous avons pu collecter plusieurs Grues en papier. Contre quels trésors pourrions-nous les échanger au Bassin aux Vœux ?",
20,,*,Ah oui ! Les trésors ! Je suis à nouveau plein d'énergie !,
21,,,La jeune miko se mit à balayer aux pieds des deux visiteurs.,
22,,Miko,"Encore toi ! Oh, accompagné aujourd'hui de ce que je vois.",
23,,Uriel,"Bonjour, je m'appelle Uriel.",
24,,*,"Oh mademoiselle miko, ça faisait longtemps que je ne vous avais pas vu ! J'ai passé les épreuves depuis le temps !",
25,,*,"Regarde, mes Grues en papier.",
26,,Miko,"Wow ça en fait beaucoup. Tu as donc vraiment réussi à passer les épreuves... Tu as donc obtenu l'approbation divine... Mais attends, ce n'est pas uniquement grâce à cette jeune Fille n'est-ce pas ?",
27,,Uriel,"Non non, l'aide de Senpai était indispensable pour réussir les épreuves.",
28,,*,Ne me sous-estime pas !,
29,,Miko,"Bon, qu'est-ce que tu fais encore là à m'empêcher de balayer ? Va donc chercher tes trésors !",
30,,*,Mademoiselle miko ! Attendez...,
31,,*,"Je m'appelle *, et toi ?",
32,,Asami,"...Asami, je m'appelle Asami.",
33,,Asami,...,
34,,Asami,Qu'attends-tu encore pour y aller maintenant ?,
35,,Kong Ming,"Cette fois-ci, nous avons envoyé un grand nombre d'étudiants de l'Académie Yume pour participer aux épreuves du Grand Sanctuaire de Tsuruga. Leur mission est simplement de passer les épreuves et obtenir les trésors pour l'académie.",
36,,Kong Ming,"La vôtre sera différente, nous vous avons prévu autre chose.",
37,,Ithil,"*, en plus de collecter ces trésors en passant les épreuves, tu auras deux autres missions. La première étant de te rapprocher des mikos qui s'occupent du Grand Sanctuaire...",
38,,Ithil,Et la deuxième est de découvrir comment le Sanctuaire continue à s'approvisionner ces trésors divins.,
39,,Kong Ming,"Ces trésors nous seront utiles contre le Chaos. Même si nous ne pouvons pas connaître leur source, nous devons trouver un moyen de pouvoir les utiliser.",
40,,Kong Ming,"Uriel, tu es chargée de la sécurité de Senpai. Nous avons reçu l'information que des individus suspicieux ont été repérés au Grand Sanctuaire. Nous ne voudrions pas que Senpai attire trop le regard des gens à enquêter sur place.",
41,,Uriel,"Bien-sûr, je protégerai le Senpai coûte que coûte !",
42,,*,"En fait, j'aimerais en savoir plus sur votre sanctuaire.",
43,,*,"Quels sont les dieux que vous vénérez ? Pourquoi y a-t-il des épreuves dans le Dojo ? Et pourquoi ceux qui réussissent les épreuves reçoivent des trésors divins ? Parle-moi un peu plus du Grand Sanctuaire, petite Asami.",
44,,Asami,"Petite Asami ? Alors dans un premier temps, vous allez arrêter de m'appeler ainsi.",
45,,Asami,Tu n'es même pas allé récupérer tes trésors que tu veux en apprendre plus sur l'histoire de notre Sanctuaire... Tu es vraiment différent des autres...,
46,,*,"Tu vois, je ne suis pas ici aveuglément pour les trésors mais aussi pour leurs histoires, votre histoire.",
47,,Asami,Hein ?,
48,,*,"Si tu fronces trop les sourcils, tu auras des rides plus tard~",
49,,Asami,Ce n'est pas vrai !,
50,,Asami,"Je ne suis pas très douée pour raconter des histoires, alors si tu veux en savoir plus sur l'histoire du Grand Sanctuaire, tu peux aller au bureau du Sanctuaire le soir et demander à voir Madame Mizue.",
51,,Asami,Elle y est tous les soirs pour raconter le passé et les légendes du Sanctuaire aux jeunes mikos. Tu peux les rejoindre si ça t'intéresse.,
52,,Asami,"Et bien sûr, si j'entends que tu as des pensées impures sur les jeunes mikos, attention à mon balai !",
53,,*,Tout de même ! Pourquoi es-tu si méfiante à mon sujet ?,
54,,Asami,Je ne te connais pas assez pour savoir ce qui se passe dans ta tête.,
55,,Asami,"Bon, si tu n'as rien à ajouter, je vais retourner balayer le sol.",
56,,*,... Haha,
57,,Asami,Tu as quelque chose d'autre à dire ? Je t'écoute.,
58,,*,"Cette douce et gentille fille dont tu as parlé la dernière fois, Chizuko...",
59,,Asami,? !,
60,,*,Quand vas-tu me la présenter ? J'aimerais la rencontrer et faire plus ample connaissance avec elle.,
61,,Asami,Du balai ! ...,
62,Histoire du Soir I,Uriel,"Senpai, qu'est-ce qu'il se passe ? Tu n'as pas l'air dans ton assiette.",
63,,*,Pourquoi Asami agit-elle de la sorte avec moi ? Je veux juste faire connaissance avec Chizuko...,
64,,Uriel,Est-ce parce que tu as dit quelque chose de déplacé ? Tu as l'air de lui avoir laissé une mauvaise impression.,
65,,*,"Elle prend peut-être tout ça trop au sérieux... Il y a tant de jeunes mikos ici qui pourraient nous partager l'histoire du Sanctuaire, j'aurais juste aimé qu'Asami s'ouvre un peu plus...",
66,,,"Au loin, les jeunes mikos sont assises sur des petits tabourets, à écouter les histoires d'une miko âgée.",
67,,Uriel,"On arrive juste à temps, mais il n'y a plus de place pour s'asseoir, restons debout.",
68,,? ? ?,... (La jeune miko sur leur droite leur tendit deux petits tabourets),
69,,*,Merci~,
70,,? ? ?,... (La jeune miko sur leur gauche se décala plus loin.),
71,,Uriel,Pourquoi cette jeune miko s'est-elle éloignée sans rien dire ?,
72,,*,"Peu importe, écoutons d'abord les histoires de Madame Mizue, la collecte d'informations est notre priorité.",
73,,Mizue,Quelqu'un se souvient d'où j'en étais dans mon histoire d'hier ?,
74,,? ? ?,"Vous disiez qu'il y a longtemps, notre sanctuaire était une vaste plaine, qu'il n'y avait pas autant de montagnes qu'aujourd'hui, et qu'il y avait assez de nourriture pour tout le monde sans avoir à cultiver la terre !",
75,,Mizue,"Ah oui voilà, Chizuko a une bonne mémoire !",
76,,Chizuko,Hehe~,
77,,*,"(C'est donc elle Chizuko, elle est aussi charmante que ce qu'Asami avait dit.)",
78,,Mizue,"La plaine sur laquelle se trouve notre Sanctuaire était autrefois appelée Sawagi, ce qui signifie une terre riche et vaste.",
79,,Mizue,"Au début, la plaine Sawagi avait un climat agréable et des terres fertiles. Parfois je me dis que, si nous avions semé des graines à cette époque-là, aujourd'hui nous aurions eu une bonne récolte.",
80,,Mizue,"Mais un jour, deux monstres sont arrivés et tout a changé...",
81,,Mizue,"Ces deux monstres étaient frères. L'aîné était nommé Ao Oni et le cadet Aka Oni. Quand Ao Oni pleurait, il pouvait provoquer des inondations et quand Aka Oni riait, il pouvait provoquer la sécheresse.",
82,,Mizue,"Ils avaient auparavant fait tant de mal dans une ville appelée Tsuyuoka, que les habitants locaux n'ont pas supporté leur comportement et ont demandé aux dieux de détruire ces deux monstres.",
83,,Mizue,"Les habitants de Tsuyuoka avaient la capacité de communiquer avec les dieux, qui ont entendu leurs prières et décapité ces deux monstres.",
84,,Mizue,"Mais ça ne s'est pas arrêté à là... Ces deux monstres ne sont pas morts. Alors que les dieux ne regardaient pas, ils se sont échappés de Tsuyuoka avec leurs têtes coupées.",
85,,Mizue,Ces deux monstres étaient affamés durant tout leur trajet de fuite. Ils sont ensuite arrivés à Sawagi et sont devenus fous de colère et de jalousie en voyant que les habitants d'ici vivaient dans l'abondance.,
86,,Mizue,"Ils se sont emparés des plus grandes maisons et ont exigé aux habitants de leur apporter de la nourriture, des trésors et une petite fille chaque année. Les habitants n'ont pas pu rétorquer et ont dû se plier aux exigences de ces deux monstres.",
87,,Mizue,"Après avoir eu la petite fille, ces monstres l’ont lapidée jusqu'à son dernier souffle avant de la brûler.",
88,,Mizue,"À cette époque, Sawagi avait plein de ressources, il était donc même possible de nourrir ces deux monstres. De plus, les habitants étaient indifférents à la demande de sacrifier une petite fille chaque année.",
89,,Mizue,"Aka Oni était en colère de voir les habitants de Sawagi vivrent très heureux malgré leurs exigences excessives, car lui, est heureux de voir les autres malheureux.",
90,,Mizue,"Par la suite, Aka Oni riait souvent et Sawagi devint une terre stérile à cause des fortes sécheresses.",
91,,Mizue,"Depuis lors, cultiver était devenu nécessaire et les récoltes sont passées de quotidienne à annuelle, jusqu'à ce que plus aucune graine ne puisse être cultivée sur le sol.",
92,,Mizue,"Les offrandes pour Aka Oni devinrent moindres et Aka Oni en demandait plus. Lorsqu'il n'était pas satisfait, il torturait et fouettait les habitants.",
93,,Mizue,"Les habitants suppliaient Aka Oni de ne pas amener la sécheresse sur leur terre, tandis que ce dernier était ravi de les voir souffrir.",
94,,Mizue,"C'est alors qu'une femme courageuse est apparue, à savoir notre Déesse Kagura !",
95,,Mizue,"Selon elle, puisque la sécheresse a été provoquée par Aka Oni, s’il meurt, alors Sawagi pourra retrouver une vie paisible et heureuse.",
96,,Mizue,"Et pour savoir si la Déesse Kagura a réussi à tuer le monstre... Je vous retrouve demain. La nuit tombe, rentrez vous reposer !",
97,,Uriel,"Puisque cette femme de l'histoire est appelée Déesse, elle a dû réussir à tuer le monstre.",
98,,*,"Pas forcément, peut-être que le sacrifice de la Déesse Kagura a éveillé un mouvement de rébellion chez tous les habitants, c'est pourquoi elle est vénérée... ?",
99,,Uriel,Ah ? C'est vrai qu'il me semble avoir déjà lu des histoires qui finissaient comme celle-là.,
100,,Uriel,"Donc, est-ce qu'un protagoniste héroïque ne peut pas échapper à la mort ?",
101,,*,"Je dis sûrement des bêtises, ne prends pas mes paroles trop au sérieux, ce genre d'histoire légendaire a toujours une fin heureuse... je suppose.",
102,,*,Nous n'avons rien appris en rapport avec le Bassin aux Vœux aujourd'hui... Mais nous pouvons revenir demain pour écouter la suite de l'histoire.,
103,Nouvelle Rencontre,Chizuko,Lalala~,
104,,Uriel,"Regarde Senpai, cette jeune miko ne te rappelle pas quelqu'un ?",
105,,*,"C'est Chizuko, c'est ça ? Chizuko ?",
106,,Chizuko,"Hmm, on s'est déjà rencontré auparavant ? Il ne me semble pas, comment connais-tu mon nom ?",
107,,*,"Je m'appelle * et elle c'est Uriel. Hier j'écoutais également Madame Mizue raconter les histoires et lorsque tu as répondu à sa question, elle a mentionné ton nom, donc je me suis souvenu de ton visage.",
108,,*,"D’ailleurs, petite Asami m'a parlé de toi et me disait que Chizuko était une fille douce et gentille.",
109,,Chizuko,"Petite Asami ? D'où vient ce nom, c'est la première fois que j'entends ça...",
110,,Chizuko,"Et pourquoi Asami te dit des choses comme ça, c'est gênant...",
111,,*,"Maintenant que je te rencontre enfin, Asami a tout à fait raison.",
112,,*,"Mais petite Asami a toujours été froide avec moi, et je ne sais pas ce que j'ai fait qui aurait pu l'importuner.",
113,,Chizuko,"Asami se méfie beaucoup des personnes venant de l'extérieur du sanctuaire, car tout le monde vient pour le trésor et il y a toujours des personnes malintentionnées.",
114,,Chizuko,"Il y a longtemps de cela, une personne est venue et a essayé de kidnapper les jeunes miko du sanctuaire pour les forcer à révéler le secret de la production des trésors divins du Sanctuaire. Mais heureusement, Asami l'a repoussé.",
115,,Chizuko,"Mais il ne faut pas se méprendre sur Asami, tant qu'elle ne te frappe pas avec un balai pour te faire sortir, cela signifie qu'elle ne te déteste pas.",
116,,*,(Il me semble que c'est déjà arrivé.....),
117,,Chizuko,"Asami est très gentille et compétente, elle prend grand soin des mikos du sanctuaire.",
118,,Chizuko,"Moi, je suis toujours en apprentissage, je ne suis pas encore une vraie miko. Mais dans le futur, je veux être une miko aussi incroyable qu'Asami !",
119,,Uriel,Je suis curieuse de savoir pourquoi le Sanctuaire a fait savoir qu'on pouvait obtenir les trésors en passant les épreuves.,
120,,Uriel,Ne serait-il pas plus sûr de garder cela le secret afin d'avoir le trésor pour vous seuls et que personne en dehors du Sanctuaire n'essaie de l'obtenir ?,
121,,Chizuko,"La nouvelle concernant ces trésors divins est sortie il y a longtemps de cela, il est donc difficile de le garder secret et interdire aux personnes extérieures au Sanctuaire de venir ici maintenant...",
122,,Chizuko,"De plus, Guji Kugatsu dit que nous avons besoin de personnes de l'extérieur pour rejoindre les épreuves avec les mikos.",
123,,Chizuko,"Parce que les épreuves sont... Oh, au fait, vous êtes venus hier pour écouter l'histoire, alors venez écouter la suite pour en savoir plus sur les trésors !",
124,,*,Tu vas nous laisser dans le suspense ?,
125,,Chizuko,"Il est rare que des personnes s'intéressent à la légende du sanctuaire, je devrais donc en profiter pour la faire connaître à un plus grand nombre de personnes~",
126,,Chizuko,"Sinon un jour, notre sanctuaire deviendra un endroit où les gens ne viendront uniquement pour participer aux épreuves, bien que ça soit déjà un peu le cas aujourd'hui...",
127,,Uriel,"En parlant de l'histoire d'hier, je me demande si la Déesse Kagura a pu tuer le monstre.",
128,,Chizuko,"Tu as tout de suite compris, mais je ne peux pas vous spoiler, tout ce que je peux te dire c'est à plus tard pour la suite de l'histoire.",
129,,Chizuko,J'ai toujours admiré Déesse Kagura et vous l'aimerez aussi !,
130,,Chizuko,"Je dois y aller, à ce soir~",
131,,*,"Bien que Chizuko ne nous ait pas vendu la mèche, vu qu'elle admire tant Déesse Kagura, le monstre a sûrement été vaincu.",
132,,Uriel,"Si c'est ce que tu penses, Senpai, alors je peux être tranquille.",
133,,*,"Allons-y, continuons les épreuves, nous devons obtenir plus de mille Grues en papier pour les échanger contre des trésors.",
134,,*,"Par contre, selon petite Asami, cela devrait être appelé «l'approbation divine».",
135,,,......,
136,,? ? ?,"Sawagi--non, Tsuruga, cela fait vraiment longtemps que je n'ai pas posé les pieds sur cette terre.",
137,,? ? ?,Cet endroit m'a marqué de certains de mes souvenirs les plus traumatisants et... me donne inconsciemment envie de m'enfuir. Mais le jour où j'ai pris mon courage à deux pour remettre les pieds ici...,
138,,? ? ?,"Tout a changé... Les paysages, les noms, les visages... même le Grand Sanctuaire de Tsuruga, qui n'est plus le même, plus aussi prospère qu'avant.",
139,,? ? ?,"Si nous n'avions pas été retardé cette nuit et que nous nous étions échappés du sanctuaire plus tôt, je n'aurais pas été infectée par le Chaos...",
140,,Izanami,"Et tu ne m'aurais pas laissé aussi, n'est-ce pas Izanagi?",
141,,Izanami,Où es-tu maintenant...,
142,,Izanami,Es-tu déjà retourné chez nous...,
143,,Uriel,"Senpai, qu'est-ce que tu regardes ?",
144,,*,"Une silhouette qui m'est familière est passée à l'instant, mais a disparu sans que je ne l'aperçoive correctement, l'as-tu vue, Uriel ?",
145,,Uriel,Une silhouette familière ? Pourrait-il s'agir d’une des autres étudiantes de l'Académie Yume qui sont venues avec nous ?,
146,,*,"Elle ne ressemblait pas à l'une de celles qui nous ont accompagnées... Laisse tomber, peut-être je me suis trompé, continuons les épreuves !",
147,Histoire du Soir II,Uriel,"Vite, Senpai, Madame Mizue est sur le point de commencer son histoire !",
148,,*,"Oui j'arrive ! Tu te soucies de la fin de l'histoire, n'est-ce pas Uriel ?",
149,,Uriel,"J'ai beau y réfléchir ou essayer de me rassurer en me disant que c'est une fin heureuse, mais je suis toujours un peu inquiète...",
150,,Uriel,"Tiens, je n'ai pas vu Chizuko. Toutes les filles ici sont en costume traditionnel de miko, il est difficile de reconnaître Chizuko.",
151,,Mizue,"La dernière fois, je parlais du fait que la Déesse Kagura voulait tuer le monstre pour sauver les habitants locaux.",
152,,Mizue,"Déesse Kagura aiguisa une hache et se mit en costume traditionnel de miko, puis cacha la hache dans sa longe jupe rouge et se rendit dans la maison des monstres en prétendant les servir docilement.",
153,,Mizue,"Les deux monstres étant satisfaits des services de Déesse Kagura, ont peu à peu baissé leur garde et lui ont laissé le libre accès à la maison pour le nettoyage.",
154,,Mizue,"Pendant cette période, elle lut beaucoup de livres, se renseigna sur l'origine des monstres... Et dans leur chambre, elle vit également une peinture d'êtres humains accrochée à un épouvantail qui avait été fouettée à maintes reprises par les monstres...",
155,,Mizue,"Bien qu'elle ne sache pas ce qui était représenté sur la peinture, Déesse Kagura a estimé qu'il était important de noter tous les détails de l'œuvre d'art endommagée.",
156,,Mizue,"Un soir, alors qu'Ao Oni était sorti, elle est rentrée dans la chambre d'Aka Oni.",
157,,Mizue,Elle sortit la hache cachée de sa longue jupe et coupa la tête d'Aka Oni pendant son sommeil.,
158,,Mizue,"Elle voulut s'en aller immédiatement. Quand soudain, elle se souvint des blessures que ces deux monstres avaient au niveau du cou, et elle se rappela d'un ouvrage qu'elle avait lu racontant que ces monstres avaient été décapités mais n'en étaient pas morts.",
159,,Mizue,Déesse Kagura décida de placer la tête de l'épouvantail près du cou d'Aka Oni et de le recouvrir d'une couverture. Elle s'est alors empressée à sortir de la chambre en cachant la tête sous sa longue jupe rouge.,
160,,Mizue,"Au même moment, Ao Oni revenait de sa sortie et lui demanda avec méfiance : "" Ta jupe, était-elle aussi rouge avant ? "".",
161,,Mizue,"Déesse Kagura lui répondit calmement : ""Je porte toujours une jupe rouge.""",
162,,Mizue,"Ao Oni ne remarqua rien d'inhabituel, et laissa Déesse Kagura sortir de leur maison avec la tête de son frère.",
163,,Uriel,Ouais !,
164,,,Uriel s'exclama si fort qu'elle provoqua un silence soudain. Tout le monde regardait à gauche et à droite pour trouver d'où venait cette exclamation.,
165,,*,(en chuchotant) Chut ! Ne parle pas si fort...,
166,,Uriel,Ah... Désolée... Ne faites pas attention à moi...,
167,,Chizuko,OUAIS !,
168,,,Tous les regards se tournèrent alors vers Chizuko.,
169,,*,Chizuko ? Pourquoi a-t-elle crié si fort ?... Était-ce pour tirer Uriel de l'embarras ?,
170,,Chizuko,"Déesse Kagura a réussi à vaincre le monstre et à s'échapper en toute sécurité, c'est normal de s'exclamer !",
171,,Mizue,"Je vois que tu admires beaucoup Déesse Kagura, Chizuko. Tu as entendu cette histoire combien de fois déjà, et tu es toujours aussi enjouée.",
172,,Mizue,"Mais si tu cries encore plus fort la prochaine fois, personne ne m'entendra.",
173,,Chizuko,"Désolée, je promets de ne plus m'exclamer dorénavant.",
174,,Uriel,"(en chuchotant) Moi aussi, je promets de ne plus m'exclamer.",
175,,Mizue,"Continuons maintenant. Après avoir quitté la demeure des monstres, Déesse Kagura rejoint les habitants de la ville et leur montra la tête d'Aka Oni. Tous se rassemblèrent alors autour d'elle, dansaient, chantaient et riaient pour célébrer la fin de cette sécheresse qui accablait Sawagi.",
176,,Mizue,"Sous les yeux et les acclamations de tous, Déesse Kagura alluma une torche et brûla la tête d'Aka Oni, jusqu'à ce qu'il ne reste rien d'autre que des cendres.",
177,,Mizue,Aka Oni n'étant maintenant plus présent pour persécuter les humains et s'en réjouir causant ensuite la sécheresse...,
178,,Mizue,"... la vie des habitants de Sawagi n'étaient pas redevenue aussi paisible qu'avant l'arrivée des monstres, mais au moins, ils avaient retrouvés une terre cultivable.",
179,,Mizue,"Ao Oni remarqua qu'Aka Oni était resté au lit depuis longtemps déjà. Il s'était dit que son frère était simplement fatigué et avait besoin de repos. Cependant, au bout de quelques jours, Ao Oni commença à s'inquiéter...",
180,,Mizue,"Sceptique, il souleva la couverture qui recouvrait le corps de Aka Oni pour le réveiller, mais y découvrit à la place le corps de son frère décapité.",
181,,Mizue,"Ao Oni se précipita vers l'extérieur pour retrouver la tête d'Aka Oni à l'aide de son instinct qui les lie par le sang. Ao Oni finit par retrouver la tête de son frère, réduite en cendres.",
182,,Mizue,"Bien que les deux monstres soient immortels, leurs corps a besoin d'énormément de temps avant de pouvoir se régénérer entièrement.",
183,,Mizue,"Ao Oni savait qu'il serait séparé de son frère pendant longtemps, et ne pu s'empêcher de crier et pleurer de douleur.",
184,,Mizue,Les pleurs d'Ao Oni provoquèrent une intempérie dans la ville de Sawagi. Le ciel fut pendant longtemps recouvert de nuages et la pluie était omniprésente.,
185,,Mizue,"Les fortes pluies entraînèrent la crue des rivières adjacentes à la ville. Sawagi était inondée, les terres étaient incultivables et le climat chaud et humide était propice aux moustiques et donc aux virus.",
186,,Mizue,Les habitants qui venaient de retrouver un environnement vivable étaient à nouveau plongés dans la panique.,
187,,Mizue,Ao Oni annonça alors aux habitants qu'il ferait cesser cette pluie incessante à Sawagi s'ils lui délivraient la personne qui avait tué son frère.,
188,,Mizue,"Voulant calmer la colère d'Ao Oni coûte que coûte, les habitants dénoncèrent Déesse Kagura sans hésitation.",
189,,Mizue,"Il se fait tard, nous continuerons demain. Nos deux invités sont les bienvenues à nous rejoindre demain~",
190,,*,"Nous n'y manquerons pas, Madame Mizue~",
191,,*,"Je n'aurais jamais pensé que le destin de Déesse Kagura prendrait ce tournant, ces habitants étaient sans-cœur. On reviendra écouter la suite demain, Uri——？",
192,,Uriel,"Déesse Kagura, pourquoi....",
193,Les Grues,Uriel,......,
194,,Chizuko,......,
195,,*,Qu'est-ce qu'il vous arrive à toutes les deux ? Vous avez les yeux rouges et gonflés.,
196,,Chizuko,"L'histoire de Déesse Kagura est tragique, j'étais accablée...",
197,,Uriel,De même.,
198,,*,"Je comprends que tu sois triste, Uriel. Après tout, c'est la première fois que tu entends cette histoire. Mais Chizuko, ne connaissais-tu pas déjà l'histoire ?",
199,,Chizuko,Oui mais peu importe le nombre de fois... Elle me fait toujours le même effet que la première fois et je finis par pleurer toute la soirée...,
200,,Chizuko,"Mais comme nous avons des invités cette fois-ci, je ne peux pas me permettre d'avoir cette tête-là.",
201,,Chizuko,"Allez-vous nous rejoindre pour écouter la suite de l'histoire, ce soir ?",
202,,Uriel,"Bien sûr ! Déesse Kagura s'en sortira, n'est-ce pas ?",
203,,Chizuko,Je ne suis pas censée vous raconter la suite de l'histoire... Ça pourrait moins vous motiver à venir écouter Madame Mizue.,
204,,Chizuko,"Mais pour vous rassurer un peu, l'histoire de Déesse Kagura ne s'arrête pas là.",
205,,Chizuko,"Si Madame Mizue s'en tient à d'habitude, ce soir elle nous racontera les moments forts de Déesse Kagura, donc ne ratez surtout pas l'histoire de ce soir !",
206,,*,"Super ! Au moins ce soir, Uriel ne sera pas angoissée et passera une bonne nuit de sommeil.",
207,,Uriel,Senpai !,
208,,Chizuko,Vous avez l'air d'être proches tous les deux.,
209,,*,"Nous sommes tous les deux à l'Académie Yume et je suis son Senpai, donc oui nous sommes plutôt proches.",
210,,Chizuko,"Oh, et où se trouve cette académie ? Est-ce un endroit éloigné de Tsuruga ?",
211,,Uriel,"Connais-tu les terres désolées de Foehn ? Au sud de Tsuruga. Eh bien, nous venons d'encore plus loin que ces terres.",
212,,Chizuko,"Les terres désolées de Foehn ? J'ai lu beaucoup de livres sur ces terres, c'est incroyable que vous veniez d'encore plus loin que ces terres.",
